crypto,subreddit,title,score,comments,created,url
Binance Coin,CryptoCurrency,"In the Past 24 Hours: 181,071 Traders Were Liquidated, Totaling $370.5M in Losses",546,157,2025-02-01 22:33:12,https://www.reddit.com/gallery/1ifib7n
Binance Coin,CryptoCurrency,"Bitcoin ATH, this is what we want.",59,46,2025-01-20 07:53:19,https://www.reddit.com/r/CryptoCurrency/comments/1i5l83l/bitcoin_ath_this_is_what_we_want/
Binance Coin,CryptoCurrency,[SERIOUS] Exchange/Platform recommendation needed,4,10,2025-01-16 15:02:30,https://www.reddit.com/r/CryptoCurrency/comments/1i2quaf/serious_exchangeplatform_recommendation_needed/
Binance Coin,CryptoCurrency,Binance coin price prediction 2025-2031: Is BNB ready for the bull run?,2,15,2025-01-06 14:16:36,https://www.cryptopolitan.com/binance-coin-price-prediction/
Binance Coin,CryptoCurrency,2024 Performance Review of Major Exchange Coins/Tokens,4,6,2025-01-08 10:22:00,https://www.reddit.com/r/CryptoCurrency/comments/1hwgzth/2024_performance_review_of_major_exchange/
Binance Coin,CryptoCurrency,Saved my 2021 expectations of some tokens hope you enjoy ,13,30,2024-12-27 11:12:17,https://www.reddit.com/r/CryptoCurrency/comments/1hncqg7/saved_my_2021_expectations_of_some_tokens_hope/
Binance Coin,CryptoCurrency,Here it is - I made an open source AI crypto trading assistant to help me manage my cryptocurrency portfolio using natural language,6,4,2024-12-15 13:38:09,https://www.reddit.com/r/CryptoCurrency/comments/1hesq9e/here_it_is_i_made_an_open_source_ai_crypto/
Binance Coin,CryptoCurrency,"Alternative View of Your Portfolio: BTC as the Standard, and 'Stacking Sats' & 'Stash a Gwei'.",3,18,2024-12-12 01:33:42,https://www.reddit.com/r/CryptoCurrency/comments/1hc9vt0/alternative_view_of_your_portfolio_btc_as_the/
Binance Coin,CryptoCurrency,You should really be using CoinGecko over CoinMarketCap,418,81,2024-12-01 16:43:12,https://www.reddit.com/r/CryptoCurrency/comments/1h47cjp/you_should_really_be_using_coingecko_over/
Binance Coin,CryptoCurrency,Boom of Native Tokens - November Price Performance Review of Major Exchange Coins/Tokens,4,4,2024-12-03 07:41:45,https://www.reddit.com/r/CryptoCurrency/comments/1h5i925/boom_of_native_tokens_november_price_performance/
Binance Coin,CryptoCurrency,Does Staking Rewards rewards overrule the volatile risk? ,2,8,2024-12-02 00:33:43,https://www.reddit.com/r/CryptoCurrency/comments/1h4i7e4/does_staking_rewards_rewards_overrule_the/
Binance Coin,CryptoCurrency,Which exchanges and wallets do you actually trust? I see a lot of conflicting takes here,7,53,2024-11-26 18:45:36,https://www.reddit.com/r/CryptoCurrency/comments/1h0jclb/which_exchanges_and_wallets_do_you_actually_trust/
Binance Coin,CryptoCurrency,This is what I have been using to get free crypto (recommended for starters),3,1,2024-11-24 07:55:14,https://www.reddit.com/r/CryptoCurrency/comments/1gylv6n/this_is_what_i_have_been_using_to_get_free_crypto/
Binance Coin,CryptoCurrency,Ultimate Guide for beginners 2024 - A dApp founders perspective,49,33,2024-11-24 17:26:41,https://www.reddit.com/r/CryptoCurrency/comments/1gywbhg/ultimate_guide_for_beginners_2024_a_dapp_founders/
Binance Coin,CryptoCurrency,I have created a google sheet that compares fees across multiple crypto exchanges,66,9,2024-11-18 18:44:05,https://www.reddit.com/r/CryptoCurrency/comments/1guc34o/i_have_created_a_google_sheet_that_compares_fees/
Binance Coin,CryptoCurrency,Best way to cash out recovered CoinBase funds.,1,8,2024-11-18 14:06:50,https://www.reddit.com/r/CryptoCurrency/comments/1gu5hhm/best_way_to_cash_out_recovered_coinbase_funds/
Binance Coin,CryptoCurrency,Binance report finds 97% of meme coins ‘have died’,1483,208,2024-11-04 17:57:18,https://finbold.com/binance-report-finds-97-of-meme-coins-have-died/
Binance Coin,CryptoCurrency,This is the bullrun and your favorite projects are cooked,518,490,2024-10-26 09:24:18,https://www.reddit.com/r/CryptoCurrency/comments/1gch70i/this_is_the_bullrun_and_your_favorite_projects/
Binance Coin,CryptoCurrency,$1k invested into the Top Ten Cryptos in January 2021 - Month 45 (UP +196%),164,54,2024-10-27 12:38:15,https://www.reddit.com/r/CryptoCurrency/comments/1gda0ke/1k_invested_into_the_top_ten_cryptos_in_january/
Binance Coin,CryptoCurrency,Remember less than 2 weeks ago the posts predicting a crash and even $35K? Some of them had all the right convincing arguments. But one thing they forgot is crypto has its own dynamics. Don't try to bring in traditional market reasoning or even macros thinking that will be enough. ,61,48,2024-10-18 14:54:40,https://www.reddit.com/r/CryptoCurrency/comments/1g6jzax/remember_less_than_2_weeks_ago_the_posts/
Binance Coin,CryptoCurrency,"$1k invested into the Top 10 Cryptos on January 1st, 2020 Up +617% (AUG Update - Month 56)",112,76,2024-09-18 11:39:38,https://www.reddit.com/r/CryptoCurrency/comments/1fjqnhe/1k_invested_into_the_top_10_cryptos_on_january/
Binance Coin,CryptoCurrency,Withdraw and transfer fees are way to high for mainstream adoption,19,72,2024-08-30 00:17:40,https://www.reddit.com/r/CryptoCurrency/comments/1f4ht3n/withdraw_and_transfer_fees_are_way_to_high_for/
Binance Coin,CryptoCurrency,Beware of the scam exchange called NODEXY,6,8,2024-08-24 01:14:20,https://www.reddit.com/r/CryptoCurrency/comments/1eztbba/beware_of_the_scam_exchange_called_nodexy/
Binance Coin,CryptoCurrency,"Get to know ""Haveno"" the long awaited decentralized exchange and full LocalMonero replacement that enables direct Fiat-to-Crypto trades.",10,6,2024-08-23 15:56:39,https://www.reddit.com/r/CryptoCurrency/comments/1ezgc41/get_to_know_haveno_the_long_awaited_decentralized/
Binance Coin,CryptoCurrency,July Price Performance Review of Major Exchange Coins/Tokens,5,6,2024-08-01 08:41:18,https://www.reddit.com/r/CryptoCurrency/comments/1ehboxu/july_price_performance_review_of_major_exchange/
Binance Coin,CryptoCurrency,Scammers Impersonating Coinbase Stole Millions of Dollars,34,25,2024-07-18 08:48:27,https://www.reddit.com/r/CryptoCurrency/comments/1e66niu/scammers_impersonating_coinbase_stole_millions_of/
Binance Coin,CryptoCurrency,Recent Price Fall in the Industry Hits Exchange Coins Hard: June Price Performance Review of Major Exchange Coins/Tokens,3,5,2024-07-02 06:43:11,https://www.reddit.com/r/CryptoCurrency/comments/1dtfbqk/recent_price_fall_in_the_industry_hits_exchange/
Binance Coin,CryptoCurrency,Most cost effective way for someone in my situation to buy crypto?,24,33,2024-06-20 12:40:12,https://www.reddit.com/r/CryptoCurrency/comments/1dkamy9/most_cost_effective_way_for_someone_in_my/
Binance Coin,CryptoCurrency,Most cost effective way to transfer bitcoin from binance to coinbase?,3,25,2024-06-18 03:18:59,https://www.reddit.com/r/CryptoCurrency/comments/1diguv9/most_cost_effective_way_to_transfer_bitcoin_from/
Binance Coin,CryptoCurrency,Bybit will pay $26 million compensation after their Notcoin Airdrop Failure,8,0,2024-06-11 13:03:01,https://www.reddit.com/r/CryptoCurrency/comments/1dddl22/bybit_will_pay_26_million_compensation_after/
Binance Coin,CryptoCurrency,[AMA] RCC MarketCap – Your One-Stop Shop for All Your Reddit S**** Tokens!,37,192,2024-06-08 01:25:29,https://www.reddit.com/r/CryptoCurrency/comments/1daraxx/ama_rcc_marketcap_your_onestop_shop_for_all_your/
Binance Coin,CryptoCurrency, How the Major Exchange Coins / Tokens performed in May:,21,11,2024-06-03 10:33:11,https://www.reddit.com/r/CryptoCurrency/comments/1d7198p/how_the_major_exchange_coins_tokens_performed_in/
Binance Coin,CryptoCurrency,Binance Coin Price Wobbles as Founder Faces Sentencing,8,9,2024-05-01 12:40:53,https://cryptotale.org/binance-coin-price-wobbles-as-founder-faces-sentencing/
Binance Coin,CryptoCurrency,"Nigerian central bank to freeze Bybit, KuCoin, OKX, Binance user accounts",208,46,2024-04-24 09:16:43,https://cointelegraph.com/news/nigerian-central-bank-freeze-user-accounts
Binance Coin,CryptoCurrency,"Trying to withdraw to UK bank, KuCoin, Binance, Coinbase etc all not working",23,72,2024-04-21 18:43:18,https://www.reddit.com/r/CryptoCurrency/comments/1c9pa6s/trying_to_withdraw_to_uk_bank_kucoin_binance/
Binance Coin,CryptoCurrency,The most ridiculous coin ranking in the whole space is provided to you buy Binance owned Coinmarketcap (CMC).,91,34,2024-04-22 10:19:00,https://coinmarketcap.com/view/privacy/
Binance Coin,CryptoCurrency,$1k invested into the Top Ten Cryptos in January 2021 - Month 39 (UP +250%),192,50,2024-04-26 13:21:30,https://www.reddit.com/r/CryptoCurrency/comments/1cdl9v1/1k_invested_into_the_top_ten_cryptos_in_january/
Binance Coin,CryptoCurrency,Results of public audit of XMR reserves (MoneroRun),21,8,2024-04-20 04:23:00,https://www.reddit.com/r/CryptoCurrency/comments/1c8h2tk/results_of_public_audit_of_xmr_reserves_monerorun/
Binance Coin,CryptoCurrency,Get up to date for Monero's 10 year anniversary on April 18th! A lot of stuff currently going on at the moment...,635,68,2024-04-11 09:04:32,https://www.reddit.com/r/CryptoCurrency/comments/1c1ago2/get_up_to_date_for_moneros_10_year_anniversary_on/
Binance Coin,CryptoCurrency,FYI: Exodus is dropping support for a few coins/tokens,34,22,2024-04-09 16:44:58,https://www.reddit.com/r/CryptoCurrency/comments/1bzwueu/fyi_exodus_is_dropping_support_for_a_few/
Binance Coin,CryptoCurrency,Friend had his coins disappear from binance Australia ,27,74,2024-03-29 10:02:06,https://www.reddit.com/r/CryptoCurrency/comments/1bqlivv/friend_had_his_coins_disappear_from_binance/
Binance Coin,CryptoCurrency,"Binance proof of reserves missing coins BCH, XMR",23,34,2024-03-25 17:09:19,https://www.reddit.com/r/CryptoCurrency/comments/1bniyb2/binance_proof_of_reserves_missing_coins_bch_xmr/
Binance Coin,CryptoCurrency,"Crypto.com is expanding to South Korea on April 29, 2024. Here is what this move entails. #크립토닷컴",207,54,2024-04-03 10:08:22,https://www.reddit.com/r/CryptoCurrency/comments/1buow81/cryptocom_is_expanding_to_south_korea_on_april_29/
Binance Coin,CryptoCurrency,How the Major Exchange Coins/Tokens performed in March:,62,34,2024-04-01 08:08:08,https://www.reddit.com/r/CryptoCurrency/comments/1bsxymp/how_the_major_exchange_coinstokens_performed_in/
Binance Coin,CryptoCurrency,Crypto Card In UK,2,52,2024-03-31 09:44:13,https://www.reddit.com/r/CryptoCurrency/comments/1bs6l31/crypto_card_in_uk/
Binance Coin,CryptoCurrency,US resident here with BNB stuck on Binance. I have 7 days to withdraw my assets and can't convert or trade. What should I do?,4,17,2024-03-28 03:28:16,https://www.reddit.com/r/CryptoCurrency/comments/1bplotw/us_resident_here_with_bnb_stuck_on_binance_i_have/
Binance Coin,CryptoCurrency,Time to take another look at the CRO token?,174,344,2024-03-26 07:52:10,https://www.reddit.com/r/CryptoCurrency/comments/1bo28k4/time_to_take_another_look_at_the_cro_token/
Binance Coin,CryptoCurrency,"Important US Crypto Tax Info, According to MSN.com & Fortune.com",3,6,2024-03-26 18:41:03,https://www.reddit.com/r/CryptoCurrency/comments/1boffr3/important_us_crypto_tax_info_according_to_msncom/
Binance Coin,CryptoCurrency,"$1k invested into the Top 10 Cryptos on January 1st, 2020 Up +658% (FEB Update - Month 50)",157,40,2024-03-18 04:44:23,https://www.reddit.com/r/CryptoCurrency/comments/1bhijuc/1k_invested_into_the_top_10_cryptos_on_january/
Binance Coin,CryptoCurrency,"GroveCoin and all Grove products are a ruthless facade - another scam token in the Safemoon scam ecosystem. Fake Royal Prince. Fake ""Coin"", fake volume..",75,16,2024-03-15 15:47:34,https://www.reddit.com/r/CryptoCurrency/comments/1bfh2f7/grovecoin_and_all_grove_products_are_a_ruthless/
Binance Coin,CryptoCurrency,"Withdraw your XMR, ANT, MULTI, VAI from Binance until May 20 or lost everything!",22,12,2024-03-14 17:23:40,https://www.reddit.com/r/CryptoCurrency/comments/1beqmlq/withdraw_your_xmr_ant_multi_vai_from_binance/
Binance Coin,CryptoCurrency,How to Not Be a Crypto Bagholder: Advice on Avoiding Shills,14,10,2024-03-14 14:05:55,https://www.reddit.com/r/CryptoCurrency/comments/1belz47/how_to_not_be_a_crypto_bagholder_advice_on/
Binance Coin,CryptoCurrency,Beginner's guide to Ethereum L2 (or how to save 99.9% in gas),380,156,2024-03-19 15:27:43,https://www.reddit.com/r/CryptoCurrency/comments/1bimxr9/beginners_guide_to_ethereum_l2_or_how_to_save_999/
Binance Coin,CryptoCurrency,🔔 Public audit of XMR reserves on April 18th - MoneroRun,62,13,2024-03-13 10:07:29,https://www.reddit.com/r/CryptoCurrency/comments/1bdntzm/public_audit_of_xmr_reserves_on_april_18th/
Binance Coin,CryptoCurrency,Best practice to move funds between exhanges/wallets?,3,12,2024-03-08 22:04:08,https://www.reddit.com/r/CryptoCurrency/comments/1ba0q8n/best_practice_to_move_funds_between/
Binance Coin,CryptoCurrency,"UK moving to a different platform, advice needed",1,22,2024-03-07 16:30:33,https://www.reddit.com/r/CryptoCurrency/comments/1b8ywl6/uk_moving_to_a_different_platform_advice_needed/
Binance Coin,CryptoCurrency,"The last time BTC was above $67K was Nov. 10th 2021. ETH was ~$5K, Cardano was $2.27 and Polkadot was $51. A look at how the Crypto Markets has changed since then.",329,137,2024-03-04 20:54:38,https://www.reddit.com/r/CryptoCurrency/comments/1b6lwb4/the_last_time_btc_was_above_67k_was_nov_10th_2021/
Binance Coin,CryptoCurrency,Spot top moving crypto prices every minute,36,8,2024-03-03 03:33:17,https://www.cryptomarketchange.com/
Binance Coin,CryptoCurrency,Deep Dive: What Dogecoin teaches us about human psychology,150,106,2024-03-04 02:20:11,https://www.reddit.com/r/CryptoCurrency/comments/1b5zbs9/deep_dive_what_dogecoin_teaches_us_about_human/
Binance Coin,CryptoCurrency,How the major Exchange coins/tokens performed in February:,27,35,2024-03-01 10:09:32,https://www.reddit.com/r/CryptoCurrency/comments/1b3qu47/how_the_major_exchange_coinstokens_performed_in/
Binance Coin,CryptoCurrency,"PSA: OKX will suspend XMR, ZEC and DASH withdrawals post delisting on March 5th.",7,8,2024-03-01 21:47:55,https://www.reddit.com/r/CryptoCurrency/comments/1b46lcz/psa_okx_will_suspend_xmr_zec_and_dash_withdrawals/
Binance Coin,CryptoCurrency,Coinbase has a Path to Asset Recovery,22,7,2024-02-28 04:27:26,https://www.reddit.com/r/CryptoCurrency/comments/1b1x2kt/coinbase_has_a_path_to_asset_recovery/
Binance Coin,CryptoCurrency,Urgent Help Needed: Binance Account Shutdown for U.S. Clients - Withdrawal Concerns,2,19,2024-02-25 03:34:59,https://www.reddit.com/r/CryptoCurrency/comments/1aze18v/urgent_help_needed_binance_account_shutdown_for/
Binance Coin,CryptoCurrency,2024 Crypto Tax Guide for U.S.,40,24,2024-02-23 15:27:44,https://www.reddit.com/r/CryptoCurrency/comments/1ay37v9/2024_crypto_tax_guide_for_us/
Binance Coin,CryptoCurrency,"On July 12th, 2023 I invested $51900 into 60 different projects at $865 equally into each. Here are the results: Worst performing: LTC (-36%); best performing: HNT (+870%).",454,275,2024-02-20 00:28:01,https://www.reddit.com/r/CryptoCurrency/comments/1av3qiq/on_july_12th_2023_i_invested_51900_into_60/
Binance Coin,CryptoCurrency,"Data analyst of instant exchange claims: There is an ongoing attack on XMR by Binance, faking its price on purpose in an attempt to release CZ from the U.S. juridical custody.",133,157,2024-02-09 07:00:59,https://www.reddit.com/r/CryptoCurrency/comments/1amia7q/data_analyst_of_instant_exchange_claims_there_is/
Binance Coin,CryptoCurrency,How To Crypto 301: Grid Trading,32,25,2024-02-10 19:01:02,https://www.reddit.com/r/CryptoCurrency/comments/1annkgm/how_to_crypto_301_grid_trading/
Binance Coin,CryptoMarkets,Is this the official trump coin on binance?,5,5,2025-01-19 10:08:36,https://postimg.cc/v4xN3T1N
Binance Coin,CryptoMarkets,28.01.25 Crypto highlights:,18,5,2025-01-28 19:02:30,https://www.reddit.com/r/CryptoMarkets/comments/1ic99wd/280125_crypto_highlights/
Binance Coin,CryptoMarkets,KuCoin’s $300 million Guilty Plea Exposes Crypto’s Compliance Crisis,5,6,2025-01-28 11:41:14,https://www.reddit.com/r/CryptoMarkets/comments/1ibzo6w/kucoins_300_million_guilty_plea_exposes_cryptos/
Binance Coin,CryptoMarkets,"Hello, begginner here",4,12,2025-01-25 16:42:57,https://www.reddit.com/r/CryptoMarkets/comments/1i9qzwa/hello_begginner_here/
Binance Coin,CryptoMarkets,How is TRUMP coin doing for you? ,675,1368,2025-01-19 09:01:19,https://www.reddit.com/r/CryptoMarkets/comments/1i4ugnu/how_is_trump_coin_doing_for_you/
Binance Coin,CryptoMarkets,The Glitch In The Matrix Feel Like Deja Vu? Anyone Else Trading Like This?,9,8,2025-01-21 17:13:16,https://www.reddit.com/r/CryptoMarkets/comments/1i6nl02/the_glitch_in_the_matrix_feel_like_deja_vu_anyone/
Binance Coin,CryptoMarkets,Official TRUMP coin discussion ,20,178,2025-01-19 07:27:56,https://www.reddit.com/r/CryptoMarkets/comments/1i4t6w5/official_trump_coin_discussion/
Binance Coin,CryptoMarkets,I Don't Understand My Gains,5,14,2025-01-18 14:36:32,https://www.reddit.com/r/CryptoMarkets/comments/1i48tv7/i_dont_understand_my_gains/
Binance Coin,CryptoMarkets,Trump Coin and Altcoin Rally Truths,27,3,2025-01-19 17:08:37,https://www.reddit.com/r/CryptoMarkets/comments/1i539sq/trump_coin_and_altcoin_rally_truths/
Binance Coin,CryptoMarkets,I think I found the next $UNI,5,3,2025-01-15 20:22:18,https://www.reddit.com/r/CryptoMarkets/comments/1i26sik/i_think_i_found_the_next_uni/
Binance Coin,CryptoMarkets,My Crypto Investment Strategy for Long-Term Passive Investing with DCA,9,2,2025-01-10 07:19:17,https://www.reddit.com/r/CryptoMarkets/comments/1hxz0no/my_crypto_investment_strategy_for_longterm/
Binance Coin,CryptoMarkets,Pepecoin $PEP: The Pepe That Actually Might Make Millionaires,7,22,2024-12-28 22:49:35,https://www.reddit.com/r/CryptoMarkets/comments/1hohivg/pepecoin_pep_the_pepe_that_actually_might_make/
Binance Coin,CryptoMarkets,Creating a bot to DCA out?,1,4,2024-12-27 00:02:51,https://www.reddit.com/r/CryptoMarkets/comments/1hn1tsc/creating_a_bot_to_dca_out/
Binance Coin,CryptoMarkets,Looking for Feedback on My Long-Term Crypto Investment Strategy,4,4,2024-12-20 17:36:24,https://www.reddit.com/r/CryptoMarkets/comments/1hip31h/looking_for_feedback_on_my_longterm_crypto/
Binance Coin,CryptoMarkets,"This time, things are not the same.",40,30,2024-12-19 22:21:32,https://www.reddit.com/r/CryptoMarkets/comments/1hi4t5n/this_time_things_are_not_the_same/
Binance Coin,CryptoMarkets,Where can I buy crypto that is just recently released?,6,46,2024-12-18 03:57:53,https://www.reddit.com/r/CryptoMarkets/comments/1hgt793/where_can_i_buy_crypto_that_is_just_recently/
Binance Coin,CryptoMarkets,Tracking all coins on Binance ,2,13,2024-11-18 21:50:17,https://www.reddit.com/r/CryptoMarkets/comments/1gugm7o/tracking_all_coins_on_binance/
Binance Coin,CryptoMarkets,"Opinions on AI Projects, Worth Investing?",60,39,2024-11-27 18:43:21,https://www.reddit.com/r/CryptoMarkets/comments/1h1bk34/opinions_on_ai_projects_worth_investing/
Binance Coin,CryptoMarkets,"Bitcoin on cold wallet, send it to CEX or try to sale through DEX and how?",4,1,2024-11-25 01:42:00,https://www.reddit.com/r/CryptoMarkets/comments/1gz7jpp/bitcoin_on_cold_wallet_send_it_to_cex_or_try_to/
Binance Coin,CryptoMarkets,How hard is it to get a meme coin listed on Binance,4,8,2024-11-13 16:11:18,https://www.reddit.com/r/CryptoMarkets/comments/1gqgg24/how_hard_is_it_to_get_a_meme_coin_listed_on/
Binance Coin,CryptoMarkets,How to purchase meme coins that aren’t on large exchanges like Binance yet,6,14,2024-11-14 11:34:49,https://www.reddit.com/r/CryptoMarkets/comments/1gr2t4i/how_to_purchase_meme_coins_that_arent_on_large/
Binance Coin,CryptoMarkets,Investing 2000$ in cryptos for this month,62,299,2024-11-16 21:36:04,https://www.reddit.com/r/CryptoMarkets/comments/1gsxndy/investing_2000_in_cryptos_for_this_month/
Binance Coin,CryptoMarkets,"Where do you buy memecoins like SHRUB, Pepe, that you can't get on Coinbase?",3,20,2024-11-15 00:57:43,https://www.reddit.com/r/CryptoMarkets/comments/1grkbdr/where_do_you_buy_memecoins_like_shrub_pepe_that/
Binance Coin,CryptoMarkets,Which coin should I buy as a noob?,13,92,2024-11-04 19:38:08,https://www.reddit.com/r/CryptoMarkets/comments/1gjn3uo/which_coin_should_i_buy_as_a_noob/
Binance Coin,CryptoMarkets,KuCoin imposing a 0.1% fee on BSC deposits – Why does it worry users?,4,7,2024-10-25 13:03:11,https://www.reddit.com/r/CryptoMarkets/comments/1gbtq80/kucoin_imposing_a_01_fee_on_bsc_deposits_why_does/
Binance Coin,CryptoMarkets,Need suggestions for getting into crypto on an exchange! ,56,30,2024-10-23 20:25:24,https://www.reddit.com/r/CryptoMarkets/comments/1gakf2c/need_suggestions_for_getting_into_crypto_on_an/
Binance Coin,CryptoMarkets,BlackRock Discusses Using BUIDL Tokens as Collateral on Crypto Exchanges,3,1,2024-10-21 09:01:23,https://www.reddit.com/r/CryptoMarkets/comments/1g8l88y/blackrock_discusses_using_buidl_tokens_as/
Binance Coin,CryptoMarkets,Potential Scam ,6,35,2024-08-27 20:18:40,https://www.reddit.com/r/CryptoMarkets/comments/1f2r3m2/potential_scam/
Binance Coin,CryptoMarkets,"Solana, XRP, Binance - Which coin is the best to buy?",1,6,2024-08-13 14:51:46,https://www.youtube.com/watch?v=ttjdN4gFgR4&list=PL-FZqBaZd2jxI17Hsr-PBwKLFzITXuQqI&index=1
Binance Coin,CryptoMarkets,Binance account deactivation,2,5,2024-08-11 16:38:14,https://www.reddit.com/r/CryptoMarkets/comments/1epp609/binance_account_deactivation/
Binance Coin,CryptoMarkets,Derivatives trading,4,4,2024-08-12 11:29:00,https://www.reddit.com/r/CryptoMarkets/comments/1eqb7zk/derivatives_trading/
Binance Coin,CryptoMarkets,I need some help please ,3,0,2024-07-29 07:22:30,https://www.reddit.com/r/CryptoMarkets/comments/1eetfe9/i_need_some_help_please/
Binance Coin,CryptoMarkets,Cant do future transaction,4,2,2024-06-27 13:37:14,https://www.reddit.com/r/CryptoMarkets/comments/1dprhgu/cant_do_future_transaction/
Binance Coin,CryptoMarkets,Most cost effective way for someone in my situation to buy crypto?,4,7,2024-06-20 12:40:13,https://www.reddit.com/r/CryptoMarkets/comments/1dkamyt/most_cost_effective_way_for_someone_in_my/
Binance Coin,CryptoMarkets,"Binance Coin breaks $700, registers new all-time high",3,0,2024-06-05 11:46:18,https://cryptobriefing.com/bnb-record-high-surges/
Binance Coin,CryptoMarkets,Turbo meme coin,19,26,2024-05-25 22:23:35,https://www.reddit.com/r/CryptoMarkets/comments/1d0n5jb/turbo_meme_coin/
Binance Coin,CryptoMarkets,Need help in new coin trading bot binance,2,6,2024-04-17 18:30:03,https://www.reddit.com/r/CryptoMarkets/comments/1c6hc1c/need_help_in_new_coin_trading_bot_binance/
Binance Coin,CryptoMarkets,"What platforms do you use for buying coins that haven't been listed yet, and in general in your arsenal? ",3,20,2024-04-21 12:57:54,https://www.reddit.com/r/CryptoMarkets/comments/1c9h9am/what_platforms_do_you_use_for_buying_coins_that/
Binance Coin,CryptoMarkets,Is it impossible to swap BTC directly to other coins while in a wallet?,2,3,2024-04-16 21:19:10,https://www.reddit.com/r/CryptoMarkets/comments/1c5ro41/is_it_impossible_to_swap_btc_directly_to_other/
Binance Coin,CryptoMarkets,New to trading in crypto ,7,55,2024-04-09 07:41:45,https://www.reddit.com/r/CryptoMarkets/comments/1bzmefl/new_to_trading_in_crypto/
Binance Coin,CryptoMarkets,There is any alternative platform to invest in Micro/Small Cap Altcoins besides Kucoin? ,2,34,2024-03-27 11:46:19,https://www.reddit.com/r/CryptoMarkets/comments/1bozv8i/there_is_any_alternative_platform_to_invest_in/
Binance Coin,CryptoMarkets,Spot top moving crypto prices every minute,8,7,2024-03-03 03:40:36,https://www.cryptomarketchange.com/
