crypto,subreddit,title,score,comments,created,url
Chainlink,CryptoCurrency,My cursed portfolio. My wrong way. 3k -> 1k,109,81,2025-02-05 16:17:23,https://www.reddit.com/r/CryptoCurrency/comments/1iidqkh/my_cursed_portfolio_my_wrong_way_3k_1k/
Chainlink,CryptoCurrency,BTC Dominance,23,71,2025-02-05 09:38:32,https://www.reddit.com/r/CryptoCurrency/comments/1ii6fym/btc_dominance/
Chainlink,CryptoCurrency,Chainlink (LINK) Just Launched the DeFi Yield Index (CDY Index) - A Game Changer for Onchain Lending,35,27,2025-01-30 14:52:10,https://www.reddit.com/r/CryptoCurrency/comments/1idonwc/chainlink_link_just_launched_the_defi_yield_index/
Chainlink,CryptoCurrency,"Tuttle Capital Seeks SEC Approval for First-Ever Chainlink, Cardano, and Polkadot ETFs",7,16,2025-01-28 09:49:43,https://decrypt.co/303115/tuttle-captial-seeks-sec-approval-for-first-ever-chainlink-cardano-and-polkadot-etfs
Chainlink,CryptoCurrency,Why $2.87 Billion in Bridge Hacks Are Preventable: A Look at Chainlink (LINK) Cross-Chain Security,20,5,2025-01-28 16:38:18,https://www.reddit.com/r/CryptoCurrency/comments/1ic5pmk/why_287_billion_in_bridge_hacks_are_preventable_a/
Chainlink,CryptoCurrency,Chainlink is tokenizing Swiss equities,50,14,2025-01-23 21:03:59,https://bxdigital.ch/en/bx-digital-and-bx-swiss-partner-with-chainlink-to-bring-pricing-data-onchain/
Chainlink,CryptoCurrency,"Charles Hoskinson Outlines Chainlink Partnership, Bitcoin Liquidity and Stablecoin Focus for Cardano",27,13,2025-01-19 19:01:10,https://beincrypto.com/cardano-eyes-growth-with-bitcoin-and-chainlink-integrations/
Chainlink,CryptoCurrency,Trimming my portfolio - advice much appreciated!,3,19,2025-01-22 18:37:20,https://www.reddit.com/r/CryptoCurrency/comments/1i7i9zk/trimming_my_portfolio_advice_much_appreciated/
Chainlink,CryptoCurrency,"World Liberty Financial ""Secretly"" Accumulated $47M in Bitcoin (BTC) and $100M+ in Ethereum (ETH)",526,144,2025-01-20 20:30:24,https://www.reddit.com/gallery/1i6072q
Chainlink,CryptoCurrency,"Do you still believe we’re trading crypto? I woke up and saw this, 4-hour candles moving like an F1 race, identical patterns, same timing. Crypto is how institutions are finding new liquidity. Forget the hype we’re all just pawns in their game.",30,28,2025-01-20 07:57:10,https://www.reddit.com/gallery/1i5l9z5
Chainlink,CryptoCurrency,Ripple partners with Chainlink to improve RLUSD stablecoin pricing,221,75,2025-01-07 17:17:18,https://crypto.news/ripple-partners-with-chainlink-to-improve-rlusd-stablecoin-pricing/
Chainlink,CryptoCurrency,Ripple Aims to Boost RLUSD Stablecoin's DeFi Utility with Chainlink Standard,21,76,2025-01-07 14:04:43,https://www.coindesk.com/tech/2025/01/07/ripple-aims-to-boost-rlusd-stablecoins-de-fi-utility-with-chainlink-standard
Chainlink,CryptoCurrency,"Chainlink’s Work With Swift, Euroclear, and Major Banking and Capital Markets Institutions | Chainlink Blog",22,13,2024-12-24 05:43:10,https://blog.chain.link/chainlink-banking-capital-markets-announcements/
Chainlink,CryptoCurrency,The best infographic on why to buy Chainlink ,17,15,2024-12-20 20:19:25,https://x.com/ChainLinkGod/status/1869838373013328100?t=xzddJDhuGLoNtV4lm3wK4Q&s=19
Chainlink,CryptoCurrency,"Gravity Blockchain Ditches Layerzero, Partners With Chainlink for CCIP",11,1,2024-12-20 04:46:54,https://allincrypto.com/gravity-blockchain-ditches-layerzero-partners-with-chainlink/
Chainlink,CryptoCurrency,Chainlink price reverses as one whale keeps accumulating LINK tokens,52,19,2024-12-18 14:59:43,https://crypto.news/chainlink-price-reverses-as-one-whale-keeps-accumulating-link-tokens/
Chainlink,CryptoCurrency,"Chainlink (LINK) breaks $28 for the first time in two years
",525,134,2024-12-13 01:55:31,https://coinmarketcap.com/currencies/chainlink/
Chainlink,CryptoCurrency,DTCC announces TradFi t okenizationwide launchpad ,3,14,2024-12-17 19:40:43,https://www.dtcc.com/digital-assets/-/media/WhitePapers/Transforming-Collateral-Management-With-Digital-Assets-JSCC.pdf
Chainlink,CryptoCurrency,Leading Bank in the Middle East Emirates NBD partners with Chainlink,6,4,2024-12-11 17:47:08,https://www.emiratesnbd.com/en/media-center/emirates-nbd-welcomes-chainlink-to-digital-asset-lab
Chainlink,CryptoCurrency,ChainLink - incredible utility/intrinsic value?,9,28,2024-12-09 13:23:00,https://www.reddit.com/r/CryptoCurrency/comments/1ha9lqk/chainlink_incredible_utilityintrinsic_value/
Chainlink,CryptoCurrency,Coinbase's Project Diamond Strategically Integrates the Chainlink Standard To Scale Institutional Adoption of Digital Assets,15,12,2024-12-10 17:20:04,https://www.prnewswire.com/news-releases/coinbases-project-diamond-strategically-integrates-the-chainlink-standard-to-scale-institutional-adoption-of-digital-assets-302327790.html
Chainlink,CryptoCurrency,ChainLink on the rise. Will it be next to break LINK ATH soon?,5,18,2024-12-08 14:16:48,https://cryptopurview.com/link-usd-price-live-charts/#tech_analysis
Chainlink,CryptoCurrency,Chainlink (LINK) Price Surges to 2-Year High with More Gains in Sight,33,15,2024-12-07 22:04:27,https://beincrypto.com/link-price-two-year-high/
Chainlink,CryptoCurrency,Well played CDC!,10,10,2024-12-11 18:17:22,https://www.reddit.com/gallery/1hc00vx
Chainlink,CryptoCurrency,Current Real World Use Cases,12,10,2024-12-08 16:34:22,https://www.reddit.com/r/CryptoCurrency/comments/1h9mnm1/current_real_world_use_cases/
Chainlink,CryptoCurrency,Here are a few market snapshots from April 2021. What’s your take more than three years later in the midst of this bullish run? ,253,196,2024-12-11 05:06:52,https://www.reddit.com/gallery/1hbm4wu
Chainlink,CryptoCurrency,"Chainlink CCIP is being used by a EU regulated tokenized security exchange 21X, going live in 2025",480,67,2024-12-02 18:04:23,https://21x.eu/21x-announces-partnership-with-chainlink-in-preparation-for-the-launch-of-its-eu-regulated-trading-and-settlement-system-a-part-of-its-market-infrastructure-for-tokenized-securities/
Chainlink,CryptoCurrency,"Chainlink Enters EU RWA Space, Could Cross $53 in Q1 and $100 in H1, 2025 - Das Crypto",11,15,2024-12-03 13:18:22,https://www.reddit.com/r/CryptoCurrency/comments/1h5n6xo/chainlink_enters_eu_rwa_space_could_cross_53_in/
Chainlink,CryptoCurrency,Chainlink Up 20%: Whale Activity Sparks Break From Bear Trend,15,6,2024-11-23 22:38:22,https://www.newsbtc.com/news/chainlink-rockets-20-whale-activity-sparks-break-from-bear-trend/?utm_source=coingecko&utm_content=coingecko&utm_campaign=coingecko&utm_medium=coingecko&utm_term=coingecko
Chainlink,CryptoCurrency,Rarity of Cryptos Based on their Non-divisible Base Units.,16,8,2024-12-03 01:54:21,https://www.reddit.com/r/CryptoCurrency/comments/1h5c9wr/rarity_of_cryptos_based_on_their_nondivisible/
Chainlink,CryptoCurrency,Eventually everything will run through the Chainlink ecosystem,10,55,2024-11-20 23:24:15,https://www.reddit.com/r/CryptoCurrency/comments/1gw1ocs/eventually_everything_will_run_through_the/
Chainlink,CryptoCurrency,"Chainlink, Microsoft, Banco Inter collaborate on Brazil’s CBDC pilot",20,9,2024-11-19 14:23:19,https://cointelegraph.com/news/brazil-drex-cbdc-pilot-phase-2-trade-finance-blockchain
Chainlink,CryptoCurrency,never have a few beers and scroll coinbase like it’s reddit. .. ,217,138,2024-11-24 18:38:15,https://www.reddit.com/r/CryptoCurrency/comments/1gyy0hz/never_have_a_few_beers_and_scroll_coinbase_like/
Chainlink,CryptoCurrency,"Chainlink Whales Accumulate $165 Million Worth of LINK, Suggesting Potential Bullish Trends",77,34,2024-11-14 13:18:04,https://en.coinotag.com/chainlink-whales-accumulate-165-million-worth-of-link-suggesting-potential-bullish-trends/
Chainlink,CryptoCurrency,Ethereum just hit a brand new 3.5 year low against Bitcoin. ,1217,520,2024-11-14 20:27:07,https://www.reddit.com/r/CryptoCurrency/comments/1greczo/ethereum_just_hit_a_brand_new_35_year_low_against/
Chainlink,CryptoCurrency,Big Financial Institutions Solve A $3.1 Trillion Problem With AI And Blockchain (Chainlink),12,23,2024-11-07 19:52:06,https://www.forbes.com/sites/lawrencewintermeyer/2024/11/07/big-financial-institutions-solve-a-31-trillion-problem-with-ai-and-blockchain/
Chainlink,CryptoCurrency,"Chainlink, SWIFT and UBS Announce Successful Pilot for Settling Tokenized Asset Transactions on Swift Network",106,27,2024-11-05 20:00:56,https://dailyhodl.com/2024/11/05/chainlink-swift-and-ubs-announce-successful-pilot-for-settling-tokenized-asset-transactions-on-swift-network/
Chainlink,CryptoCurrency,"Chainlink Unveils 'Chainlink Runtime Environment,' Aiming for Better Blockchain Workflows",49,26,2024-10-30 15:17:59,https://www.coindesk.com/tech/2024/10/30/chainlink-unveils-chainlink-runtime-environment-aiming-for-better-blockchain-workflows/
Chainlink,CryptoCurrency,Chainlink launches private blockchain transactions for institutions,79,31,2024-10-22 13:04:06,https://cointelegraph.com/news/chainlink-private-blockchain-transactions-institutions
Chainlink,CryptoCurrency,"No big deal, it’s just the biggest deal in Crypto in the last 5-10 years.",54,93,2024-10-25 20:22:23,https://cointelegraph.com/news/chainlink-cofounder-unveils-blockchain-payments-tradfi
Chainlink,CryptoCurrency,$1k invested into the Top Ten Cryptos in January 2021 - Month 45 (UP +196%),160,54,2024-10-27 12:38:15,https://www.reddit.com/r/CryptoCurrency/comments/1gda0ke/1k_invested_into_the_top_ten_cryptos_in_january/
Chainlink,CryptoCurrency,Chainlink and 8 Major Market Participants Launch AI-Powered Corporate Actions Initiative To Address Unstructured Data Challenge for the Financial Industry,3,13,2024-10-21 20:21:37,https://www.prnewswire.com/news-releases/chainlink-and-8-major-market-participants-launch-ai-powered-corporate-actions-initiative-to-address-unstructured-data-challenge-for-the-financial-industry-302281824.html
Chainlink,CryptoCurrency,Shoutout to the Cryptocurrencies that haven't paid influencers to promote their coin but rather let their tech/ideas do the talking,96,85,2024-10-13 22:35:12,https://www.reddit.com/r/CryptoCurrency/comments/1g31p58/shoutout_to_the_cryptocurrencies_that_havent_paid/
Chainlink,CryptoCurrency,"Chainlink Data Feeds are Now Live on Soneium Minato Testnet, as Soneium Joins Chainlink Scale Program",2,27,2024-09-12 14:15:36,https://www.prnewswire.com/news-releases/chainlink-data-feeds-are-now-live-on-soneium-minato-testnet-as-soneium-joins-chainlink-scale-program-302245424.html
Chainlink,CryptoCurrency,21Shares and Chainlink team up to enhance Ethereum ETF transparency with Proof of Reserve integration,6,10,2024-07-29 14:05:27,https://cryptobriefing.com/ethereum-etf-transparency-enhanced/
Chainlink,CryptoCurrency,"Chainlink Unlocks $295 Million in LINK Tokens, Transfers $264 Million to Binance",165,138,2024-06-22 13:56:45,https://cryptotale.org/chainlink-unlocks-295-million-in-link-tokens-transfers-264-million-to-binance/
Chainlink,CryptoCurrency,Zengate integrates Chainlink services on Cardano (Knee Bent),10,5,2024-06-20 18:50:34,https://www.reddit.com/r/CryptoCurrency/comments/1dkjb1e/zengate_integrates_chainlink_services_on_cardano/
Chainlink,CryptoCurrency,Chainlink (LINK) And SWIFT Set To Unveil Major Partnership,195,102,2024-05-27 15:33:00,https://www.coinfeeds.io/daily/chainlink-and-swift-set-to-unveil-major-partnership
Chainlink,CryptoCurrency,I lost 650k from last bull run.,1027,767,2024-05-20 02:54:07,https://www.reddit.com/r/CryptoCurrency/comments/1cw5gpv/i_lost_650k_from_last_bull_run/
Chainlink,CryptoCurrency,Measuring the predictability in coin price data,5,14,2024-05-12 17:18:31,https://www.reddit.com/r/CryptoCurrency/comments/1cqcum1/measuring_the_predictability_in_coin_price_data/
Chainlink,CryptoCurrency,$1k invested into the Top Ten Cryptos in January 2021 - Month 39 (UP +250%),193,50,2024-04-26 13:21:30,https://www.reddit.com/r/CryptoCurrency/comments/1cdl9v1/1k_invested_into_the_top_ten_cryptos_in_january/
Chainlink,CryptoCurrency,"Chainlink debuts Transporter app, targets hyper-security for cross-chain transactions",84,25,2024-04-11 16:42:03,https://cryptobriefing.com/chainlink-transporter-launch-app/
Chainlink,CryptoCurrency,Thoughts on Litecoin?,188,305,2024-04-10 21:50:21,https://www.reddit.com/r/CryptoCurrency/comments/1c0xo97/thoughts_on_litecoin/
Chainlink,CryptoCurrency,"[AMA/giveaway] with addrs! - The Easiest,Non-custodial Way to Accept Crypto Payments. Ask Us Anything!",28,66,2024-04-10 20:36:48,https://www.reddit.com/r/CryptoCurrency/comments/1c0vvys/amagiveaway_with_addrs_the_easiestnoncustodial/
Chainlink,CryptoCurrency,Spotlight on Chainlink TVS: Oracle Usage Testify Growing Activity on Ethereum and Arbitrum,26,21,2024-03-26 23:50:40,https://www.observers.com/spotlight-on-chainlink-tvs-oracle-usage-testify-growing-activity-on-ethereum-and-arbitrum/
Chainlink,CryptoCurrency,Chainlink CCIP usage increasing exponentially ,48,27,2024-03-23 12:06:33,https://dune.com/linkpool/chainlink-ccip
Chainlink,CryptoCurrency,Why the main narratives around the top Crypto AI projects are all bullcrap,179,119,2024-03-20 23:42:49,https://www.reddit.com/r/CryptoCurrency/comments/1bjs7oo/why_the_main_narratives_around_the_top_crypto_ai/
Chainlink,CryptoCurrency,Meme Coins vs. Utility Tokens: The Battle for Crypto Supremacy,16,29,2024-03-14 22:09:24,https://www.reddit.com/r/CryptoCurrency/comments/1bexkxb/meme_coins_vs_utility_tokens_the_battle_for/
Chainlink,CryptoCurrency,Projects with over 95% already in circulating supply,145,216,2024-02-28 01:53:51,https://www.reddit.com/r/CryptoCurrency/comments/1b1tvmi/projects_with_over_95_already_in_circulating/
Chainlink,CryptoCurrency,Whales Grab $50M of Chainlink’s LINK as Price Climbs 40% in a Month,252,57,2024-02-08 06:34:01,https://www.coindesk.com/markets/2024/02/07/whales-grab-50m-in-chainlinks-link-as-price-climbs-40-in-a-month/?utm_medium=referral&utm_source=rss&utm_campaign=headlines
Chainlink,CryptoMarkets,Chainlink vs Sui?? Which would You put all Your Money on??,16,47,2025-02-01 17:26:36,https://www.reddit.com/r/CryptoMarkets/comments/1ifbbyx/chainlink_vs_sui_which_would_you_put_all_your/
Chainlink,CryptoMarkets,Chainlink vs Cardano. Which would You put 100k into?,39,164,2025-01-30 22:40:46,https://www.reddit.com/r/CryptoMarkets/comments/1idzr1i/chainlink_vs_cardano_which_would_you_put_100k_into/
Chainlink,CryptoMarkets,"Reddit users, You Don't Need to Be Negative! Bullish Market Ahead - Which Coins Do You Think Have the Most Potential?",21,84,2025-02-05 12:39:20,https://www.reddit.com/r/CryptoMarkets/comments/1ii90vc/reddit_users_you_dont_need_to_be_negative_bullish/
Chainlink,CryptoMarkets,Chainlink vs Hbar?? Which one Would you Bet on making you a Millionaire??,12,99,2025-01-29 16:29:25,https://www.reddit.com/r/CryptoMarkets/comments/1icxszb/chainlink_vs_hbar_which_one_would_you_bet_on/
Chainlink,CryptoMarkets,"Trumps World Liberty Finance Loading up on BTC, ETH, Chainlink hours before Inauguration ",69,30,2025-01-20 15:46:15,https://www.reddit.com/r/CryptoMarkets/comments/1i5t453/trumps_world_liberty_finance_loading_up_on_btc/
Chainlink,CryptoMarkets,Where's the value in any coin right now? ,19,93,2025-01-19 20:02:12,https://www.reddit.com/r/CryptoMarkets/comments/1i57i4x/wheres_the_value_in_any_coin_right_now/
Chainlink,CryptoMarkets,Which Cryptos are best  for Long-Term Investment Beyond Bitcoin and Why?,15,125,2025-01-12 10:43:43,https://www.reddit.com/r/CryptoMarkets/comments/1hzk5e4/which_cryptos_are_best_for_longterm_investment/
Chainlink,CryptoMarkets,"I’ve seen people who are long LINK be short ETH, but LINK is built on ETH. Am I missing something?",14,32,2025-01-02 22:20:08,https://www.reddit.com/r/CryptoMarkets/comments/1hs68zl/ive_seen_people_who_are_long_link_be_short_eth/
Chainlink,CryptoMarkets,Best coins to buy for next year ? ,27,85,2024-12-31 20:32:04,https://www.reddit.com/r/CryptoMarkets/comments/1hqnctv/best_coins_to_buy_for_next_year/
Chainlink,CryptoMarkets,Rate my portfolio! I will rate your suggestions,3,46,2024-12-31 09:40:46,https://www.reddit.com/r/CryptoMarkets/comments/1hqbeq4/rate_my_portfolio_i_will_rate_your_suggestions/
Chainlink,CryptoMarkets,Chainlink is connecting everything in the world to blockchain,146,108,2024-12-15 20:26:31,https://www.reddit.com/r/CryptoMarkets/comments/1hf1hq2/chainlink_is_connecting_everything_in_the_world/
Chainlink,CryptoMarkets,"How do I learn crypto, without paying ""educationmoney"" on the market",3,4,2024-12-19 23:44:14,https://www.reddit.com/r/CryptoMarkets/comments/1hi6jm5/how_do_i_learn_crypto_without_paying/
Chainlink,CryptoMarkets,Looking for Feedback on My Long-Term Crypto Investment Strategy,4,4,2024-12-20 17:36:24,https://www.reddit.com/r/CryptoMarkets/comments/1hip31h/looking_for_feedback_on_my_longterm_crypto/
Chainlink,CryptoMarkets,LINK Surges to 2021 Levels as Trump’s World Liberty Buys More Chainlink Tokens,5,1,2024-12-13 08:49:01,https://markets.businessinsider.com/news/currencies/link-surges-to-2021-levels-as-trump-s-world-liberty-buys-more-chainlink-tokens-1034133342
Chainlink,CryptoMarkets,The Cryptocurrency Market: A Tool for Economic Control?,1,5,2024-12-20 16:21:18,https://www.reddit.com/r/CryptoMarkets/comments/1hindlj/the_cryptocurrency_market_a_tool_for_economic/
Chainlink,CryptoMarkets,Coins to invest in,5,50,2024-12-05 19:07:19,https://www.reddit.com/r/CryptoMarkets/comments/1h7gzw8/coins_to_invest_in/
Chainlink,CryptoMarkets,Portfolio Review,14,52,2024-12-04 01:02:05,https://www.reddit.com/r/CryptoMarkets/comments/1h63mum/portfolio_review/
Chainlink,CryptoMarkets,First time investor here!,2,10,2024-11-24 23:00:56,https://www.reddit.com/r/CryptoMarkets/comments/1gz45w0/first_time_investor_here/
Chainlink,CryptoMarkets,is it too late to buy? ,9,75,2024-11-23 00:19:20,https://www.reddit.com/r/CryptoMarkets/comments/1gxmnwd/is_it_too_late_to_buy/
Chainlink,CryptoMarkets,"Genuine Ranking Question - LINK, HBAR, ALGO, ADA",4,7,2024-11-15 22:18:33,https://www.reddit.com/r/CryptoMarkets/comments/1gs8csd/genuine_ranking_question_link_hbar_algo_ada/
Chainlink,CryptoMarkets,"LINK, HBAR, ALGO, ADA - Please rank!",2,32,2024-11-15 22:23:25,https://www.reddit.com/r/CryptoMarkets/comments/1gs8gos/link_hbar_algo_ada_please_rank/
Chainlink,CryptoMarkets,€20k pension fund to use on Crypto. ,3,13,2024-11-14 14:00:50,https://www.reddit.com/r/CryptoMarkets/comments/1gr5eb6/20k_pension_fund_to_use_on_crypto/
Chainlink,CryptoMarkets,Rate my portfolio,11,49,2024-11-13 02:13:32,https://www.reddit.com/r/CryptoMarkets/comments/1gq28ld/rate_my_portfolio/
Chainlink,CryptoMarkets,"Chainlink, UBS Asset Management, Swift Complete Pilot to Extract Cash From Tokenized Funds",3,1,2024-11-05 17:21:30,https://www.coindesk.com/tech/2024/11/05/chainlink-ubs-asset-management-swift-complete-pilot-to-extract-cash-from-tokenized-funds/
Chainlink,CryptoMarkets,Chainlink adds Landshare tokenization infrastructure,2,0,2024-07-24 14:49:57,https://www.cryptonewsz.com/chainlink-adds-landshare-tokenization-infrastructure/
Chainlink,CryptoMarkets,First timer bad luck,5,33,2024-06-11 12:48:29,https://www.reddit.com/r/CryptoMarkets/comments/1ddda4c/first_timer_bad_luck/
Chainlink,CryptoMarkets,Just started to invest into crypto and I’m looking for guidance ,17,53,2024-06-03 06:25:19,https://www.reddit.com/r/CryptoMarkets/comments/1d6xvoz/just_started_to_invest_into_crypto_and_im_looking/
Chainlink,CryptoMarkets,"Chainlink debuts Transporter app, targets hyper-security for cross-chain transactions",5,0,2024-04-11 16:42:17,https://cryptobriefing.com/chainlink-transporter-launch-app/
Chainlink,CryptoMarkets,Trusted AI for next generation RWAs with OriginTrail (TRAC) and Chainlink,2,0,2024-03-29 15:07:35,https://medium.com/origintrail/trusted-ai-for-next-generation-rwas-with-origintrail-and-chainlink-d13d89209917
Chainlink,CryptoMarkets,Ark and 21shares integrate chainlink for proof of reserves for their bitcoin etf,2,0,2024-02-28 14:09:48,https://www.prnewswire.com/news-releases/21shares-integrates-chainlink-proof-of-reserve-to-increase-transparency-of-ark-21shares-bitcoin-etf-arkb-302073701.html
Chainlink,CryptoMarkets,Oracle Projects are finally gaining the recognition they deserve,42,7,2024-02-21 14:18:59,https://www.reddit.com/r/CryptoMarkets/comments/1awd52r/oracle_projects_are_finally_gaining_the/
Chainlink,CryptoMarkets,Telefónica Partners with Chainlink to Bolster Security Against SIM-Swap Attacks,2,0,2024-02-16 14:26:47,https://coincodecap.com/telefonica-partners-with-chainlink-to-bolster-security-against-sim-swap-attacks
Chainlink,CryptoMarkets,Cryptocurrency market witnessed a rollercoaster ride this week. Global crypto market cap surged to $1.77 Trillion but soon lost about $100 Billion before dropping to $1.67 Trillion.,3,2,2024-02-07 18:08:29,https://www.reddit.com/r/CryptoMarkets/comments/1al9dls/cryptocurrency_market_witnessed_a_rollercoaster/
