crypto,subreddit,title,score,comments,created,url
Tether,CryptoCurrency,Rising and Falling The Bitcoin Story,3,5,2024-04-04 20:34:26,https://www.reddit.com/r/CryptoCurrency/comments/1bvy1t6/rising_and_falling_the_bitcoin_story/
Tether,CryptoCurrency,Help transferring from Metamask to Coinbase,5,17,2024-03-27 00:36:30,https://www.reddit.com/r/CryptoCurrency/comments/1booe49/help_transferring_from_metamask_to_coinbase/
Tether,CryptoCurrency,Now is the perfect time to buy altcoins,266,276,2024-03-26 14:24:26,https://www.reddit.com/r/CryptoCurrency/comments/1bo96co/now_is_the_perfect_time_to_buy_altcoins/
Tether,CryptoCurrency,JUST IN: OKX Decides to Delist Tether (USDT) Pairs in Europe,24,13,2024-03-18 17:31:58,https://en.bitcoinsistemi.com/just-in-okx-decides-to-delist-tether-usdt-pairs-in-europe/?utm_source=CryptoNews&utm_medium=app
Tether,CryptoCurrency,My way of approximating the potential high of a coin or token.,75,74,2024-03-23 19:40:04,https://www.reddit.com/r/CryptoCurrency/comments/1bm0uzj/my_way_of_approximating_the_potential_high_of_a/
Tether,CryptoCurrency,"$1k invested into the Top 10 Cryptos on January 1st, 2020 Up +658% (FEB Update - Month 50)",158,40,2024-03-18 04:44:23,https://www.reddit.com/r/CryptoCurrency/comments/1bhijuc/1k_invested_into_the_top_10_cryptos_on_january/
Tether,CryptoCurrency,A Dollar on Blockchain Rails: Tether's 100B Market Cap In Perspective,27,2,2024-03-08 13:57:03,https://www.observers.com/a-dollar-on-blockchain-rails-tethers-100b-market-cap-in-perspective/
Tether,CryptoCurrency,"Does Tether printing cause the price of Bitcoin to surge, or does Tether printing respond to the price surge and demand? Simply looking at the chart can answer that question.",114,92,2024-03-06 16:06:01,https://www.reddit.com/r/CryptoCurrency/comments/1b83g1v/does_tether_printing_cause_the_price_of_bitcoin/
Tether,CryptoCurrency,"Tether USDT Above $100 Billion Marketcap , DeFi TVL Near $100 Billion",60,13,2024-03-07 08:28:46,https://dailycoinpost.com/tether-usdt-above-100-billion-marketcap-defi-tvl-near-100-billion/
Tether,CryptoCurrency,Debunking the unbacked stablecoins pump Bitcoin price theory once and for all,53,67,2024-03-09 17:18:02,https://www.reddit.com/r/CryptoCurrency/comments/1bamse0/debunking_the_unbacked_stablecoins_pump_bitcoin/
Tether,CryptoCurrency,Safest and cheapest way to store stablecoins in ledger wallet?,8,22,2024-03-04 20:12:26,https://www.reddit.com/r/CryptoCurrency/comments/1b6ku61/safest_and_cheapest_way_to_store_stablecoins_in/
Tether,CryptoCurrency,"Binance is giving 1 5-25% APR in real time on USDT with no limits on earn account, how safe is it?",294,202,2024-03-05 14:14:38,https://www.reddit.com/r/CryptoCurrency/comments/1b766wt/binance_is_giving_1_525_apr_in_real_time_on_usdt/
Tether,CryptoCurrency,Tether won’t confirm or deny if it’s dropping USDT on Tron,104,97,2024-02-22 01:11:27,https://cointelegraph.com/news/tether-wont-confirm-deny-plans-drop-usdt-support-tron
Tether,CryptoCurrency,[HELP] USDT asset in Coinbase wallet cannot be sent or swapped,1,11,2024-02-26 20:10:39,https://www.reddit.com/r/CryptoCurrency/comments/1b0rbyh/help_usdt_asset_in_coinbase_wallet_cannot_be_sent/
Tether,CryptoCurrency,1inch router is broken,45,21,2024-02-24 18:51:04,https://www.reddit.com/r/CryptoCurrency/comments/1az23zc/1inch_router_is_broken/
Tether,CryptoCurrency,"UNODEX - DeFi Trading revolution combined with revenue sharing AMA with r/CryptoCurrency Feb, 26 come and join us for exciting updates and the latest news from UNODEX",43,37,2024-02-25 18:58:52,https://www.reddit.com/r/CryptoCurrency/comments/1azvqm7/unodex_defi_trading_revolution_combined_with/
Tether,CryptoCurrency,"$1k into the Top 10 Cryptos on January 1st, 2019 (JAN Update/Month 61) +320%",179,42,2024-02-26 13:02:47,https://www.reddit.com/r/CryptoCurrency/comments/1b0gzet/1k_into_the_top_10_cryptos_on_january_1st_2019/
Tether,CryptoCurrency,Tether's Market Cap Represents Demand for USD more than anything,33,33,2024-02-12 15:26:18,https://www.reddit.com/r/CryptoCurrency/comments/1ap2ilm/tethers_market_cap_represents_demand_for_usd_more/
Tether,CryptoCurrency,Cashing out my crypto with an El Salvadorian Binance account ,46,47,2024-02-17 06:53:25,https://www.reddit.com/r/CryptoCurrency/comments/1asvr2n/cashing_out_my_crypto_with_an_el_salvadorian/
Tether,CryptoCurrency,"Is crypto eating Legacy or is Legacy eating crypto? This is something cryptocurrency Reddit can’t understand because the only metric that matters is number go up. ~10 entities: 3 major CEXs, 3 major ETF funds and 3 major asset-backed stablecoin entities rule all crypto. A warning-shot essay!",48,73,2024-02-13 11:07:16,https://www.reddit.com/r/CryptoCurrency/comments/1apqxyw/is_crypto_eating_legacy_or_is_legacy_eating/
Tether,CryptoMarkets,What do you do after selling?,13,56,2025-02-06 19:17:08,https://www.reddit.com/r/CryptoMarkets/comments/1ijarbu/what_do_you_do_after_selling/
Tether,CryptoMarkets,Tether's USDT is coming to Bitcoin and the Lightning Network. Paolo Ardoino announced at a conference in El Salvador that the world's largest stablecoin is integrating with the Bitcoin network.,7,8,2025-01-31 07:16:38,https://v.redd.it/hdundv6e5age1
Tether,CryptoMarkets,War drums are beating?,2,1,2025-02-01 02:13:32,https://www.reddit.com/r/CryptoMarkets/comments/1ievyzb/war_drums_are_beating/
Tether,CryptoMarkets,ETH forever tethered to BTC? Swap ETH for BTC now?,11,32,2025-01-22 04:49:31,https://www.reddit.com/r/CryptoMarkets/comments/1i73cr5/eth_forever_tethered_to_btc_swap_eth_for_btc_now/
Tether,CryptoMarkets,Honest three sentence thoughts,2,4,2025-01-25 03:43:34,https://www.reddit.com/r/CryptoMarkets/comments/1i9e9j1/honest_three_sentence_thoughts/
Tether,CryptoMarkets,Tether-backed Oobit to expand crypto payments with ADGM license,35,4,2025-01-08 16:00:54,https://financefeeds.com/tether-backed-oobit-to-expand-crypto-payments-with-adgm-license/
Tether,CryptoMarkets,Delisting of tether in Europe,4,21,2024-12-30 09:27:12,https://www.reddit.com/r/CryptoMarkets/comments/1hpjkrh/delisting_of_tether_in_europe/
Tether,CryptoMarkets,Delisting of Tether - Effects on Bitcoin price ,5,49,2024-12-28 04:12:34,https://www.reddit.com/r/CryptoMarkets/comments/1hnxk4s/delisting_of_tether_effects_on_bitcoin_price/
Tether,CryptoMarkets,Tether delisting in Europe ,3,10,2024-12-23 11:16:44,https://www.reddit.com/r/CryptoMarkets/comments/1hklnvt/tether_delisting_in_europe/
Tether,CryptoMarkets,Tether’s MiCA Challenge: The December 30th 2024 Deadline That Could Change Everything,6,2,2024-12-08 20:09:43,https://www.reddit.com/r/CryptoMarkets/comments/1h9rjxl/tethers_mica_challenge_the_december_30th_2024/
Tether,CryptoMarkets,Best DePIN projects ,7,16,2024-12-13 13:30:59,https://www.reddit.com/r/CryptoMarkets/comments/1hdc8os/best_depin_projects/
Tether,CryptoMarkets,BlackRock Discusses Using BUIDL Tokens as Collateral on Crypto Exchanges,3,1,2024-10-21 09:01:23,https://www.reddit.com/r/CryptoMarkets/comments/1g8l88y/blackrock_discusses_using_buidl_tokens_as/
Tether,CryptoMarkets,What do you think?,17,63,2024-10-07 18:29:05,https://www.reddit.com/r/CryptoMarkets/comments/1fyetx2/what_do_you_think/
Tether,CryptoMarkets,Tether Accused of Hiding the Truth About USDT Reserves,3,4,2024-09-13 12:01:52,https://www.bitdegree.org/crypto/news/tether-accused-of-hiding-the-truth-about-usdt-reserves?utm_source=reddit&utm_medium=social&utm_campaign=r-tether-hiding-the-truth-about-usdt
Tether,CryptoMarkets,Circle Integrates USDC with National Payment Systems in Brazil and Mexico,3,0,2024-09-18 08:00:59,https://www.reddit.com/r/CryptoMarkets/comments/1fjnjx8/circle_integrates_usdc_with_national_payment/
Tether,CryptoMarkets,Tether Invests $100M in Latin America's Agriculture Leader,3,2,2024-09-09 12:07:00,https://www.bitdegree.org/crypto/news/tether-invests-100m-in-latin-americas-agriculture-leader?utm_source=reddit&utm_medium=social&utm_campaign=r-tether-invests-agriculture
Tether,CryptoMarkets,Why would Coinbase Wallet say my trade is likely to fail?,5,2,2024-09-10 01:24:35,https://www.reddit.com/r/CryptoMarkets/comments/1fd65bl/why_would_coinbase_wallet_say_my_trade_is_likely/
Tether,CryptoMarkets,Tether Has Helped Recover Over $108 Million in Illicit USDT Since 2014,9,1,2024-08-25 09:16:37,https://coincodecap.com/tether-has-helped-recover-over-108-million-in-illicit-usdt-since-2014
Tether,CryptoMarkets,Tether Breaks Records with $5.2 Billion Profit in H1 2024,2,4,2024-08-01 12:57:37,https://www.bitdegree.org/crypto/news/tether-breaks-records-with-5-2-billion-profit-in-first-half-of-2024?utm_source=reddit&utm_medium=social&utm_campaign=r-tether-breaks-records
Tether,CryptoMarkets,Philippines Integrates Tether’s USDT for Social Security Payments,4,0,2024-07-01 11:56:14,https://coincodecap.com/philippines-integrates-tethers-usdt-for-social-security-payments
Tether,CryptoMarkets,Hi how will the Tether ban in Europe affect current trading trends? What are the profitable alternatives to USDT?,3,14,2024-06-21 18:54:54,https://www.reddit.com/r/CryptoMarkets/comments/1dlbmec/hi_how_will_the_tether_ban_in_europe_affect/
Tether,CryptoMarkets,"Tether Reveals aUSDT: Gold-Backed, Dollar-Pegged Stablecoin",2,1,2024-06-18 11:15:18,https://www.bitdegree.org/crypto/news/tether-introduces-ausdt-a-gold-backed-dollar-pegged-stablecoin?utm_source=reddit&utm_medium=social&utm_campaign=r-tether-introduces-stablecoin
Tether,CryptoMarkets,Tether introduces its new gold-backed digital asset called Alloy,14,12,2024-06-17 13:08:07,https://cryptobriefing.com/tether-launches-alloy-gold/
Tether,CryptoMarkets,Tether Acquires $100 Million Stake in Jihan Wu’s BTC Mining Firm Bitdeer,2,2,2024-05-31 15:56:39,https://coincodecap.com/tether-acquires-100-million-stake-in-jihan-wus-btc-mining-firm-bitdeer
Tether,CryptoMarkets,Safest Stable alternative to USDT and why ? ,8,26,2024-05-22 00:20:38,https://www.reddit.com/r/CryptoMarkets/comments/1cxn4su/safest_stable_alternative_to_usdt_and_why/
Tether,CryptoMarkets,Ripple CEO Foresees U.S. Government Targeting Tether,10,5,2024-05-13 11:11:14,https://tradersdex.com/ripple-ceo-foresees-u-s-government-targeting-tether/
Tether,CryptoMarkets,"Tether Hits Slams Deutsche Bank Study on Stablecoins, Dubs it Vague",6,5,2024-05-10 09:21:28,https://coincodecap.com/tether-hits-slams-deutsche-bank-study-on-stablecoins-dubs-it-vague
Tether,CryptoMarkets,Tether Pumps Funds into CityPay to Bolster Crypto Payments in Europe,27,5,2024-05-09 20:29:21,https://thecryptobasic.com/2024/05/09/tether-pumps-funds-into-citypay-to-bolster-crypto-payments-in-europe/
Tether,CryptoMarkets,Tether reports record $4.52 billion Q1 profit,2,3,2024-05-01 13:09:00,https://cryptobriefing.com/tether-financial-growth-q1/
Tether,CryptoMarkets,Tether’s CEO just told us why the Big Four won’t audit reserves backing $108bn stablecoin,5,1,2024-04-18 19:19:21,https://www.dlnews.com/articles/markets/tether-ceo-just-told-us-why-the-big-4-wont-audit-its-books/?utm_source=reddit&utm_medium=organic_social&utm_campaign=
Tether,CryptoMarkets,Tether Boosts Bitcoin Reserves to $5.3 Billion with New Purchase,15,3,2024-04-01 10:12:07,https://coincodecap.com/tether-boosts-bitcoin-reserves-to-5-3-billion-with-new-purchase
Tether,CryptoMarkets,Tether Assisted US DOJ and FBI Retrieve $1.4M in Stolen Funds,3,1,2024-03-12 20:02:07,https://coincodecap.com/tether-assisted-us-doj-and-fbi-retrieve-1-4m-in-stolen-funds
Tether,CryptoMarkets,"Bitcoin (BTC) could hit $300,000 at the peak of its next bull run, Tether's cofounder, William Quigley. GLTA!!!",16,7,2024-03-07 17:13:11,/r/glta_eth/comments/1b8x554/bitcoin_btc_could_hit_300000_at_the_peak_of_its/
Tether,CryptoMarkets,Wall Street Journal Faces Defamation Lawsuit Tied to 2023 Tether-Bitfinex Story,5,2,2024-03-04 05:31:45,https://coincodecap.com/wall-street-journal-faces-defamation-lawsuit-tied-to-2023-tether-bitfinex-story
Tether,CryptoMarkets,Tether co-founder on why Bitcoin could reach $300k at the peak of the next bull market. GLTA!!!,4,1,2024-03-04 21:38:02,/r/glta_eth/comments/1b6mypb/tether_cofounder_on_why_bitcoin_could_reach_300k/
Tether,CryptoMarkets,Coinbase wallet random crypto sent to me?,11,37,2024-03-03 03:22:47,https://www.reddit.com/r/CryptoMarkets/comments/1b571s7/coinbase_wallet_random_crypto_sent_to_me/
Tether,CryptoMarkets,The Resurgence of Bitcoin and the Rise of Utility Cryptocurrencies: A Deep Dive,12,3,2024-02-17 20:50:47,https://www.reddit.com/r/CryptoMarkets/comments/1atbzlb/the_resurgence_of_bitcoin_and_the_rise_of_utility/
