crypto,subreddit,title,score,comments,created,url
Tether,CryptoCurrency,Tether CEO Paolo Ardoino on Record $13-Billion Year,2,2,2025-02-05 19:20:39,https://www.youtube.com/watch?v=W_SEiLEU20M
Tether,CryptoCurrency,"Tether discloses 83,758 BTC holdings and $13 billion profit in 2024",531,80,2025-01-31 21:28:28,https://cryptoslate.com/tether-discloses-83758-btc-holdings-and-13-billion-profit-in-2024/
Tether,CryptoCurrency,"USDT Issuer Tether Reports $13B Net Profits for 2024, With Gold, Bitcoin (BTC) Price Appreciation Contributing",30,49,2025-01-31 15:32:44,https://www.coindesk.com/business/2025/01/30/tether-reports-usd13b-profit-for-2024-with-rising-bitcoin-gold-prices-contributing
Tether,CryptoCurrency,"Crypto.com to delist Tether USDT, 9 other tokens in Europe on Jan. 31",37,14,2025-01-29 08:06:19,https://cointelegraph.com/news/crypto-com-delist-usdt-europe-mica-compliance
Tether,CryptoCurrency,"Tether Brings USDt to Bitcoin. Supported by a new taproot-powered protocol, USDt will operate seamlessly on Bitcoin’s base layer and its layer-2 Lightning Network.",7,16,2025-01-30 23:07:36,https://tether.io/news/tether-brings-usdt-to-bitcoins-lightning-network-ushering-in-a-new-era-of-unstoppable-technology/
Tether,CryptoCurrency,Coinbase Would Delist Tether's USDT If New US Legislation Requires,19,7,2025-01-22 02:30:00,https://beincrypto.com/armstrong-coinbase-would-delist-tether/
Tether,CryptoCurrency,Tether Prepares for a Bold U.S. Market Entry,6,2,2025-01-19 22:03:50,https://www.reddit.com/r/CryptoCurrency/comments/1i5agdt/tether_prepares_for_a_bold_us_market_entry/
Tether,CryptoCurrency,South Korea arrests six Chinese suspects over alleged $690k Tether heist: report,2,2,2025-01-20 07:46:03,https://crypto.news/south-korea-arrests-six-chinese-suspects-over-alleged-690k-tether-heist-report/
Tether,CryptoCurrency,Tether Relocation to El Salvador Includes Plans for New Landmark Tower.,1,4,2025-01-16 00:59:43,https://elsalvadorinenglish.com/2025/01/15/tether-relocation-to-el-salvador-includes-plans-for-new-landmark-tower/
Tether,CryptoCurrency,Tether taps Kraken’s Ink Layer 2 for the first deployment of its cross-chain USDT0 stablecoin,1,3,2025-01-16 17:14:30,https://www.theblock.co/post/335144/tether-taps-krakens-ink-layer-2-for-the-first-deployment-of-its-cross-chain-usdt0-stablecoin
Tether,CryptoCurrency,Tether to relocate global headquarters to El Salvador,55,14,2025-01-13 21:32:55,https://cryptoslate.com/tether-to-relocate-global-headquarters-to-bitcoin-friendly-el-salvador/
Tether,CryptoCurrency,Tether to establish HQ in El Salvador,15,11,2025-01-13 20:15:15,https://crypto.news/tether-to-establish-hq-in-el-salvador/
Tether,CryptoCurrency,Circle’s USDC beats Tether USDT in market cap surge during 2024,27,10,2025-01-14 16:26:58,https://cointelegraph.com/news/circle-usdc-beats-tether-usdt-supply-growth-2024
Tether,CryptoCurrency,Crypto firm Tether and its founders finalizing move to El Salvador ,12,3,2025-01-14 04:10:49,https://www.voanews.com/a/crypto-firm-tether-and-its-founders-finalizing-move-to-el-salvador-/7935830.html
Tether,CryptoCurrency,Tether will relocate HQ to El Salvador after securing license,22,9,2025-01-13 16:09:53,https://cointelegraph.com/news/tether-el-salvador-securing-license-property?utm_source=rss_feed&utm_medium=rss&utm_campaign=rss_partner_inbound
Tether,CryptoCurrency,"World Liberty Financial ""Secretly"" Accumulated $47M in Bitcoin (BTC) and $100M+ in Ethereum (ETH)",526,144,2025-01-20 20:30:24,https://www.reddit.com/gallery/1i6072q
Tether,CryptoCurrency,"Do you still believe we’re trading crypto? I woke up and saw this, 4-hour candles moving like an F1 race, identical patterns, same timing. Crypto is how institutions are finding new liquidity. Forget the hype we’re all just pawns in their game.",32,28,2025-01-20 07:57:10,https://www.reddit.com/gallery/1i5l9z5
Tether,CryptoCurrency,Tether tops weekly revenue charts with $122.78M in fees,6,7,2025-01-11 21:59:09,https://www.cryptopolitan.com/tether-tops-weekly-revenue-charts/
Tether,CryptoCurrency,Tether USDT’s market cap drop linked to ‘seasonal holiday lull’,5,26,2025-01-06 10:26:06,https://cointelegraph.com/news/tether-usdt-market-cap-drop-seasonal-matrixport
Tether,CryptoCurrency,"Tether Delisting 'FUD' Having Zero Effect on USDT Reserves, According to CryptoQuant CEO",27,8,2025-01-02 14:43:17,https://dailyhodl.com/2025/01/02/tether-delisting-fud-having-zero-effect-on-usdt-reserves-according-to-cryptoquant-ceo/
Tether,CryptoCurrency,Tether’s USDT sees largest weekly market cap drop since FTX collapse amid MiCA full implementation,8,3,2025-01-02 16:33:33,https://www.theblock.co/post/332808/tethers-usdt-sees-largest-weekly-market-cap-drop-since-ftx-collapse-amid-mica-full-implementation
Tether,CryptoCurrency,Tether Expands Bitcoin Reserves by $700M Amidst FUD Over USDT's Status in Europe,43,13,2025-01-01 03:18:46,https://cryptopotato.com/tether-expands-bitcoin-reserves-by-700m-amidst-fud-over-usdts-status-in-europe/
Tether,CryptoCurrency,Tether (USDT) Faces MiCA Compliance Issues in Europe - Market Cap Takes $2 Billion Hit,6,8,2025-01-02 04:10:20,https://www.bitcoinsensus.com/news/tether-faces-mica-compliance-issues-market-cap-takes-2-billion-hit/
Tether,CryptoCurrency,SHIB HODLER: 'Hey Elon How much SHIB you are holding?' Elon: 'None.' 💀📉 - Still One of my Favorite Crypto Moments,966,103,2025-01-06 18:33:41,https://www.reddit.com/gallery/1hv62i0
Tether,CryptoCurrency,Banks Want In on Tether’s Billions in Stablecoin Profits,123,65,2024-12-28 15:15:53,https://www.bnnbloomberg.ca/business/2024/12/28/banks-want-in-on-tethers-billions-in-stablecoin-profits/
Tether,CryptoCurrency,EU Exchanges Delist Tether's USDT In Preparation for MiCA,2,6,2024-12-20 20:24:45,https://beincrypto.com/eu-mica-delist-tether-chaos/
Tether,CryptoCurrency,"""Screw your stupid coins""",1203,61,2024-12-20 20:16:18,https://i.redd.it/t56cxktaa28e1.jpeg
Tether,CryptoCurrency,"Coinbase delists Tether, other MiCA noncompliant stablecoins",19,11,2024-12-13 19:25:05,https://crypto.news/coinbase-delists-tether-other-mica-noncompliant-stablecoins/
Tether,CryptoCurrency,Coinbase prepares to delist Tether’s USDT stablecoin in Europe,367,125,2024-12-12 16:16:44,https://cointelegraph.com/news/coinbase-delisting-tether-usdt-stablecoin-europe
Tether,CryptoCurrency,Tether’s USDT approved as accepted virtual asset in Abu Dhabi,5,3,2024-12-10 16:26:30,https://cointelegraph.com/news/abu-dhabi-approves-tether-usdt-stablecoin
Tether,CryptoCurrency,Can someone here pls convince me otherwise…,344,312,2024-12-14 08:01:21,https://www.reddit.com/r/CryptoCurrency/comments/1hdy5sv/can_someone_here_pls_convince_me_otherwise/
Tether,CryptoCurrency,"Alternative View of Your Portfolio: BTC as the Standard, and 'Stacking Sats' & 'Stash a Gwei'.",3,18,2024-12-12 01:33:42,https://www.reddit.com/r/CryptoCurrency/comments/1hc9vt0/alternative_view_of_your_portfolio_btc_as_the/
Tether,CryptoCurrency,What are some possible bear scenarios for the market in the next few months?,23,114,2024-12-08 21:08:27,https://www.reddit.com/r/CryptoCurrency/comments/1h9svnu/what_are_some_possible_bear_scenarios_for_the/
Tether,CryptoCurrency,"XRP becomes world's third-largest crypto, overtakes Tether’s USDT in market cap",1023,307,2024-12-02 10:00:24,https://www.theblock.co/post/328877/xrp-third-largest-overtakes-usdt-market-cap
Tether,CryptoCurrency,WenBullRun Guide to Crypto Market Trends,31,16,2024-12-10 14:57:30,https://www.reddit.com/r/CryptoCurrency/comments/1hb3lfl/wenbullrun_guide_to_crypto_market_trends/
Tether,CryptoCurrency,"Tether mints another 1B USDT, the stablecoin issuer has minted 14B USDT since Nov 8 | Cryptopolitan",101,56,2024-11-30 03:20:36,https://www.cryptopolitan.com/tether-mints-another-1b-usdt/
Tether,CryptoCurrency,Tether mints an additional $3 billion in USDt stablecoins,268,85,2024-11-24 21:35:00,https://cointelegraph.com/news/tether-mints-additional-3-billion-usdt-stablecoins
Tether,CryptoCurrency,Tether in Talks to Support Cantor Fitzgerald’s Planned Bitcoin Lending Program: WSJ,19,5,2024-11-25 15:41:28,https://coinstats.app/news/da6723c62a4c4c0a2d580e540829f9d6b222bb49c823a1452c2eb0aec074a32d_Tether-in-Talks-to-Support-Cantor-Fitzgerald%E2%80%99s-Planned-Bitcoin-Lending-Program%3A-WSJ/
Tether,CryptoCurrency,"Lutnick, Cantor Fitzgerald negotiated a 5% ownership stake in Tether: WSJ",4,0,2024-11-24 12:58:48,https://www.theblock.co/post/327961/lutnick-cantor-fitzgerald-negotiated-a-5-ownership-stake-in-tether-wsj
Tether,CryptoCurrency,"I’m Zeke Faux, author of “Number Go Up,” the story of Sam Bankman-Fried, Tether, and the crypto boom and bust. AMA!",18,111,2024-11-25 18:02:17,https://www.reddit.com/r/CryptoCurrency/comments/1gzpam9/im_zeke_faux_author_of_number_go_up_the_story_of/
Tether,CryptoCurrency,Now the market is back hitting all-time highs... what do you see as the short-term risks? ,78,140,2024-11-22 11:58:37,https://www.reddit.com/r/CryptoCurrency/comments/1gx6628/now_the_market_is_back_hitting_alltime_highs_what/
Tether,CryptoCurrency,"Tether launches tokenization platform called Hadron for institutions, governments",5,5,2024-11-15 01:35:24,https://cryptoslate.com/tether-launches-tokenization-platform-called-hadron-for-institutions-governments/
Tether,CryptoCurrency,"Tether Mints $7 billion USDT in a Week, Injecting Massive Liquidity in the Market",15,20,2024-11-14 18:16:28,https://beincrypto.com/tether-usdt-minting-reaches-7-billion-in-a-week/
Tether,CryptoCurrency,Tether prints $5 billion USDT in 5 days adding to bull run market liquidity,72,48,2024-11-12 14:04:27,https://cryptoslate.com/tether-prints-5-billion-usdt-in-5-days-adding-bull-run-market-liquidity/
Tether,CryptoCurrency,"Stablecoin Issuer Tether Prints Nearly 4,000,000,000 USDT As Crypto Markets Edge Higher - The Daily Hodl",48,38,2024-11-11 18:56:52,https://dailyhodl.com/2024/11/11/stablecoin-issuer-tether-prints-nearly-4000000000-usdt-as-crypto-markets-edge-higher/
Tether,CryptoCurrency,Tether moves USDT from smaller chains to Ethereum version in planned chain swap,23,16,2024-11-06 19:43:11,https://www.cryptopolitan.com/tether-moves-usdt-from-smaller-chains-to-ethereum-version-in-planned-chain-swap/
Tether,CryptoCurrency,"Tether is not planning to build a blockchain, says CEO Paolo Ardoino ",4,9,2024-11-03 22:29:57,https://www.cryptopolitan.com/tether-is-not-planning-to-build-a-blockchain-says-ceo-paolo-ardoino/
Tether,CryptoCurrency,Tether Reports $2.4B Q3 Profits,44,35,2024-11-01 06:13:05,https://bitcoinworld.co.in/tether-reports-2-4b-q3-profits/
Tether,CryptoCurrency,Tether's USDT reaches 330M wallets.,20,20,2024-10-28 20:44:25,https://cryptoslate.com/tethers-usdt-reaches-330m-wallets-from-explosive-ethereum-l2-and-ton-network-growth/
Tether,CryptoCurrency,"Tether Reveals 82,454 Bitcoin and 48.3-Ton Gold Holdings",875,271,2024-10-28 18:25:55,https://blockzeit.com/tether-reveals-82454-bitcoin-and-48-3-ton-gold-holdings/
Tether,CryptoCurrency,We've gotta talk about Republicans and crypto,755,791,2024-11-05 00:48:05,https://www.reddit.com/r/CryptoCurrency/comments/1gjubyp/weve_gotta_talk_about_republicans_and_crypto/
Tether,CryptoCurrency,Tether Scrutiny and Middle East Tensions Trigger $380 Million Crypto Liquidations,36,20,2024-10-27 08:17:51,https://beincrypto.com/bitcoins-rally-stalls-amid-tethers-probe/
Tether,CryptoCurrency,Tether Investigation by the US Government Is Underway: WSJ Report,55,41,2024-10-26 03:16:37,https://coincu.com/289170-tether-investigation-by-the-us-government/
Tether,CryptoCurrency,Tether CEO Rejects WSJ's Allegations of Federal Money Laundering Investigation,11,6,2024-10-26 06:59:47,https://beincrypto.com/tether-rejects-wsj-claims-on-investigation/
Tether,CryptoCurrency,"US ‘dropping the ball’ on crypto, but that should change soon: Tether CEO",16,27,2024-10-23 02:57:28,https://cointelegraph.com/news/us-dropping-the-ball-crypto-should-improve-post-election-tether-ceo
Tether,CryptoCurrency,"Tether is 'doubling down' on communication and transparency, CEO Paolo Ardoino says",15,14,2024-10-22 18:40:08,https://www.theblock.co/post/322487/tether-is-doubling-down-on-communication-and-transparency-ceo-paolo-ardoino-says?utm_source=rss&utm_medium=rss
Tether,CryptoCurrency,"Bolivia Takes a Bold Step Amid an Economical Crisis: Pioneers Regulated Crypto Custody Service (USDT), Expanding Financial Options for Citizens",12,6,2024-10-26 16:35:36,https://www.reddit.com/r/CryptoCurrency/comments/1gcp2qw/bolivia_takes_a_bold_step_amid_an_economical/
Tether,CryptoCurrency,$1k invested into the Top Ten Cryptos in January 2021 - Month 45 (UP +196%),157,54,2024-10-27 12:38:15,https://www.reddit.com/r/CryptoCurrency/comments/1gda0ke/1k_invested_into_the_top_ten_cryptos_in_january/
Tether,CryptoCurrency,"Olympic Snowboarder Used Tether in Cocaine-Smuggling Murder Scheme, Feds Say - Decrypt",36,33,2024-10-18 19:49:31,https://decrypt.co/287204/olympic-snowboarder-tether-cocaine-murders
Tether,CryptoCurrency,"Police Seize $100,000 Worth of Tether From Government-Backed Solar Program Impersonators",4,4,2024-10-15 14:04:24,https://decrypt.co/286303/indian-police-impersonators-solar-program
Tether,CryptoCurrency,Tether explores lending billions to commodity traders to shake up traditional trade finance,19,7,2024-10-14 18:10:24,https://cryptobriefing.com/tether-commodity-lending-finance/
Tether,CryptoCurrency,Stablecoin Giant Tether Celebrates 10th Anniversary: The Journey So Far,28,12,2024-10-13 12:42:21,https://cryptopotato.com/stablecoin-giant-tether-celebrates-10th-anniversary-the-journey-so-far/
Tether,CryptoCurrency,Tether CEO Open to Big Four Audit in Transparency Drive,13,13,2024-10-10 16:16:19,https://dailycoin.com/tether-ceo-open-to-big-four-audit-in-transparency-drive
Tether,CryptoCurrency,Tether teases USDT documentary on 10th anniversary,6,9,2024-10-06 16:22:01,https://cointelegraph.com/news/tether-teases-usdt-documentary-10th-anniversary
Tether,CryptoCurrency,The Impressive Amount of Treasury Bonds Tether Holds Surpasses Entire Nations!,35,17,2024-10-06 21:37:25,https://www.ethnews.com/revealed-the-impressive-amount-of-treasury-bonds-tether-holds-surpasses-entire-nations/
Tether,CryptoCurrency,Coinbase to Delist Tether and Other Non-Compliant Stablecoins Ahead of MiCA Compliance in Europe,189,56,2024-10-05 13:17:25,https://cryptonewsland.com/coinbase-to-delist-tether-and-other-non-compliant/?utm_source=CryptoNews&utm_medium=app
Tether,CryptoCurrency,Vitalik Donates Ether to “Free Alexey & Roman” Campaign After Dumping Memecoins and Tether’s USDT,47,23,2024-10-05 14:17:15,https://dailycoin.com/vitalik-buterin-dumps-neiro-moodeng-and-usdt-in-exchange-for-ether/
Tether,CryptoCurrency,FBI Recovers Over $6 Million in Stolen Cryptocurrency: Tether Linked to International Fraud Scheme,51,16,2024-09-28 02:43:55,https://en.coinotag.com/fbi-recovers-over-6-million-in-stolen-cryptocurrency-tether-linked-to-international-fraud-scheme/
Tether,CryptoCurrency,'Uptober' looms for crypto as Tether's market cap hits a record high,4,10,2024-09-24 16:54:13,https://finbold.com/uptober-looms-for-crypto-as-tethers-market-cap-hits-a-record-high/?pick
Tether,CryptoCurrency,"Tether Is the Biggest Crypto Scam Ever, Warns Cyber Capital Founder",29,67,2024-09-16 06:32:08,https://cryptodnes.bg/en/tether-is-the-biggest-crypto-scam-ever-warns-cyber-capital-founder/
Tether,CryptoCurrency,Tether's market share grows from 55% to 75% in the last 2 years | Cryptopolitan,6,13,2024-09-17 13:15:31,https://www.cryptopolitan.com/tethers-market-share-grows-from-55-to-75-in-the-last-2-years/
Tether,CryptoCurrency,“Tether is a 118 Billion Dollar Scam; Bigger Than FTX & Bernie Madoff Combined”: Cyber Capital Founder Justin Bons Claims,413,187,2024-09-15 11:29:27,https://dailycoin.com/tether-faces-allegations-of-being-a-bigger-scam-than-ftx/?utm_source=cryptopanic&utm_medium=rss
Tether,CryptoCurrency,Consumer protection watchdog warns about Tether's reserves,11,21,2024-09-13 07:14:55,https://cointelegraph.com/news/consumer-watchdog-group-issues-warning-tether-transparency
Tether,CryptoCurrency,Consumer Watchdog Calls Tether a 'Disaster for Consumers Waiting to Happen' - Decrypt,91,46,2024-09-13 15:41:08,https://decrypt.co/249323/consumer-watchdog-calls-tether-a-disaster-for-consumers-waiting-to-happen
Tether,CryptoCurrency,Tether has achieved higher profits than BlackRock,149,112,2024-09-11 12:18:22,https://tradersunion.com/news/cryptocurrency-news/show/8987-tether-has-achieved-higher-profits/
Tether,CryptoCurrency,"$1k invested into the Top 10 Cryptos on January 1st, 2020 Up +617% (AUG Update - Month 56)",105,76,2024-09-18 11:39:38,https://www.reddit.com/r/CryptoCurrency/comments/1fjqnhe/1k_invested_into_the_top_10_cryptos_on_january/
Tether,CryptoCurrency,"Tether addresses $102 million agricultural investment: land is ""crucial asset class""",18,21,2024-09-08 19:00:56,https://www.theblock.co/post/315171/tether-addresses-102-million-agricultural-investment-land-is-crucial-asset-class
Tether,CryptoCurrency,Tether Decides Against Creating Its Own Blockchain Amid Market Saturation,13,11,2024-09-03 11:01:25,https://thecurrencyanalytics.com/altcoins/tether-decides-against-creating-its-own-blockchain-amid-market-saturation-133881
Tether,CryptoCurrency,"Tether and DOJ Team Up to Combat 'Pig Butchering' Scams, Recovering Millions",30,11,2024-08-24 17:28:29,https://cryptonewsland.com/tether-and-doj-team-up-to-combat-pig-butchering-scams-recovering-millions/
Tether,CryptoCurrency,Tether introduces UAE Dirham-pegged stablecoin,2,9,2024-08-21 12:04:03,https://cryptobriefing.com/tether-uae-dirham-stablecoin/
Tether,CryptoCurrency,"Tether Treasury minted 1 billion USDT. Since the crash on August 5, 2024, Tether has continuously transferred USDT to various exchanges such as Coinbase, Kraken, OKX, and Binance via wallet 0x1db (likely Cumberland), totaling 1.476B USDT.",56,75,2024-08-21 08:19:44,https://platform.spotonchain.ai/en/signal-details/tether-treasury-minted-1b-usdt-162678
Tether,CryptoCurrency,"$1k into the Top 10 Cryptos on January 1st, 2019 (JULY Update/Month 67) +470%",77,25,2024-08-27 14:04:43,https://www.reddit.com/r/CryptoCurrency/comments/1f2hwdd/1k_into_the_top_10_cryptos_on_january_1st_2019/
Tether,CryptoCurrency,"Tether Transfers $955M USDT to Kraken, Sparking Market Shift Speculations",27,19,2024-08-15 13:31:03,https://blockchainreporter.net/tether-transfers-955m-usdt-to-kraken-sparking-market-shift-speculations/
Tether,CryptoCurrency,Tether Co-Founder Faces the Unraveling of a Crypto Dream in Puerto Rico,17,25,2024-08-13 08:24:48,https://www.nytimes.com/2024/08/13/technology/brock-pierce-crypto-puerto-rico.html
Tether,CryptoCurrency,"Celsius Sues Tether for $2.4 Billion Over BTC Liquidation, Tether says it will Defend Itself Against “Shake Down” Litigation Commenced by Celsius",64,32,2024-08-10 15:07:56,https://tether.io/news/tether-will-defend-itself-against-shake-down-litigation-commenced-by-celsius/
Tether,CryptoCurrency,"Tether calls Celsius' lawsuit ""baseless"" in response to Bitcoin liquidation dispute!",13,9,2024-08-11 16:06:41,https://cryptoslate.com/tether-calls-celsius-lawsuit-baseless-in-response-to-bitcoin-liquidation-dispute/
Tether,CryptoCurrency,"3 major CEXes, 3 major ETF funds & 3 major asset-backed stablecoin entities now almost rule all crypto because cryptobros mostly care about numbers going up. Legacy is now taking over Satoshi's legacy, and laughing in your face, ain't that a meme bros!",81,76,2024-08-18 16:35:59,https://www.reddit.com/r/CryptoCurrency/comments/1evdk5n/3_major_cexes_3_major_etf_funds_3_major/
Tether,CryptoCurrency,Tether mints $1.3B USDT since market bottom — Can it push Bitcoin above $65K?,53,54,2024-08-09 13:20:52,https://cointelegraph.com/news/tether-usdt-mint-bitcoin-65k
Tether,CryptoCurrency,Tether generates a record $5.2 billion profit in first half of the year.,153,76,2024-07-31 17:35:04,https://www.theblock.co/post/308599/tether-generates-a-record-5-2-billion-profit-in-first-half-of-the-year?utm_source=telegram1&utm_medium=social
Tether,CryptoCurrency,Tether Market Cap Falls in EU Under MiCA—Investors Shift Towards Approved Stablecoins,9,7,2024-07-28 13:54:25,https://www.ccn.com/news/crypto/tether-market-cap-eu-investors-approved-stablecoins/
Tether,CryptoCurrency,Tether freezes $28m in USDT linked to Cambodian fraud,120,84,2024-07-14 16:34:09,https://crypto.news/tether-freezes-28m-in-usdt-linked-to-cambodian-fraud/
Tether,CryptoCurrency,"Plaintiffs File New, Slimmed Down Complaint in Class Action Lawsuit Against Tether",4,3,2024-07-15 21:11:28,https://www.coindesk.com/policy/2024/07/15/plaintiffs-file-new-slimmed-down-complaint-in-class-action-lawsuit-against-tether/?utm_medium=referral&utm_source=feedly&utm_campaign=headlines
Tether,CryptoCurrency,Strange botted wallet?,95,40,2024-07-21 23:24:32,https://www.reddit.com/gallery/1e8zoh2
Tether,CryptoCurrency,"Tether Freezes $29,620,000 in Tron Address With Links to Cambodian Ruling Family: Report",45,37,2024-07-15 19:26:49,https://dailyhodl.com/2024/07/15/tether-freezes-29620000-in-tron-address-with-links-to-cambodian-ruling-family-report/
Tether,CryptoCurrency,CEX lobbying spend - Q1 overview (source OpenSecrets),7,12,2024-06-30 19:35:04,https://www.reddit.com/r/CryptoCurrency/comments/1ds9ix1/cex_lobbying_spend_q1_overview_source_opensecrets/
Tether,CryptoCurrency,Tether introduces its new gold-backed digital asset called Alloy,29,24,2024-06-17 13:08:20,https://cryptobriefing.com/tether-launches-alloy-gold/
Tether,CryptoCurrency,how to purchase crypto from Australia?,9,76,2024-06-22 05:13:51,https://www.reddit.com/r/CryptoCurrency/comments/1dlo5kw/how_to_purchase_crypto_from_australia/
Tether,CryptoCurrency,"Bitcoin Price Analysis for June 18, 2024",7,4,2024-06-18 15:38:33,https://www.reddit.com/r/CryptoCurrency/comments/1ditoqq/bitcoin_price_analysis_for_june_18_2024/
Tether,CryptoCurrency,Tether expands in the Eastern Europe - Georgian CityPay.io received $10 million Series A investment from Tether.to ,15,14,2024-06-03 14:08:10,https://www.reddit.com/r/CryptoCurrency/comments/1d75bmn/tether_expands_in_the_eastern_europe_georgian/
Tether,CryptoCurrency,‘Inevitable’ – Tether Co-Founder Says China Is Going To Open Up to Crypto: Report,77,71,2024-06-03 19:33:40,https://dailyhodl.com/2024/06/03/inevitable-tether-co-founder-says-china-is-going-to-open-up-to-crypto-report/
Tether,CryptoCurrency,"If Tether (USDT) doesn’t comply in the EU, Kraken and others could be forced to delist it ahead of the upcoming MiCA regulation in July",36,26,2024-05-20 12:31:29,https://dailycoin.com/kraken-no-plans-delist-usdt-eu/
Tether,CryptoCurrency,"US Scrutiny of Tether Could Disrupt Crypto Ecosystem, Ripple CEO Warns ",14,30,2024-05-12 12:53:37,https://news.bitcoin.com/us-scrutiny-of-tether-could-disrupt-crypto-ecosystem-ripple-ceo-warns/
Tether,CryptoCurrency,Tether Enters Transaction Surveillance Partnership with Chainalysis as Regulatory Pressure Mounts,51,19,2024-05-03 08:54:23,https://www.coindesk.com/policy/2024/05/02/tether-enters-transaction-surveillance-partnership-with-chainalysis-as-regulatory-pressure-mounts/
Tether,CryptoCurrency,Tether reports record $4.52 billion Q1 profit,243,88,2024-05-01 13:08:49,https://cryptobriefing.com/tether-financial-growth-q1/
Tether,CryptoCurrency,"Tether Seeks to Boost Peer-to-Peer Payments on Telegram by Expanding Dollar, Gold Stablecoins to TON Network",19,22,2024-04-28 18:37:47,https://www.coindesk.com/business/2024/04/19/tether-is-expanding-its-usdt-xaut-stablecoins-to-ton-network-transparency-page-shows/
Tether,CryptoCurrency,Why the Big Four apparently won’t audit Tethers $108bn reserves,379,226,2024-04-19 10:05:52,https://www.dlnews.com/articles/markets/tether-ceo-just-told-us-why-the-big-4-wont-audit-its-books/
Tether,CryptoCurrency,$1k invested into the Top Ten Cryptos in January 2021 - Month 39 (UP +250%),192,50,2024-04-26 13:21:30,https://www.reddit.com/r/CryptoCurrency/comments/1cdl9v1/1k_invested_into_the_top_ten_cryptos_in_january/
Tether,CryptoCurrency,"If the Tether Treasury keeps on minting USDT like this, what makes them different from the government that prints fiat money? What will happen in the future if it stays like this?",213,233,2024-04-21 03:26:52,https://coinmarketcap.com/community/post/335796995/
Tether,CryptoCurrency,"Nigerian central bank to freeze Bybit, KuCoin, OKX, Binance user accounts",214,46,2024-04-24 09:16:43,https://cointelegraph.com/news/nigerian-central-bank-freeze-user-accounts
Tether,CryptoCurrency,16 Upcoming Bitcoin Events To Mark On Your Calendar,2,2,2024-04-21 02:01:05,https://www.reddit.com/r/CryptoCurrency/comments/1c96ocy/16_upcoming_bitcoin_events_to_mark_on_your/
Tether,CryptoCurrency,Tether's Weekly Transaction Volume on Tron Hits $110 Billion,213,32,2024-04-12 00:28:17,https://www.binance.com/en/square/post/2024-04-10-tether-s-weekly-transaction-volume-on-tron-hits-110-billion-6588246935338
Tether,CryptoCurrency,Tether Boosts Bitcoin Portfolio with $627 Million Purchase,146,26,2024-04-01 20:50:19,https://dailycoinpost.com/tether-boosts-bitcoin-portfolio-with-627-million-purchase/
Tether,CryptoCurrency,"Tether Buys 8,888 Bitcoin For $618 Million, But Why Is Price Down?",794,240,2024-04-02 13:21:23,https://www.newsbtc.com/news/bitcoin/tether-buys-8888-bitcoin/
Tether,CryptoCurrency,Tether completes ‘gold standard’ security audit | CoinTelegraph,17,22,2024-04-02 09:13:46,https://cointelegraph.com/news/tether-completes-soc-2-audit
Tether,CryptoCurrency,"[AMA/giveaway] with addrs! - The Easiest,Non-custodial Way to Accept Crypto Payments. Ask Us Anything!",30,66,2024-04-10 20:36:48,https://www.reddit.com/r/CryptoCurrency/comments/1c0vvys/amagiveaway_with_addrs_the_easiestnoncustodial/
Tether,CryptoCurrency,Ripple to launch USD backed stable coin on xrpl and eth,128,80,2024-04-04 13:15:12,https://x.com/ripple/status/1775873224531665051?s=46&t=L01IcsEEBzl6pulAVaJjiA
