crypto,subreddit,title,score,comments,created,url
XRP,ripple,What is the advantage that XRP has over other cryptos?,30,54,2025-02-05 06:21:07,https://www.reddit.com/r/Ripple/comments/1ii3s6n/what_is_the_advantage_that_xrp_has_over_other/
XRP,ripple,HODL XRP on Ledger / Bep20 / ERC20,2,11,2025-01-29 21:53:01,https://www.reddit.com/r/Ripple/comments/1id5r3i/hodl_xrp_on_ledger_bep20_erc20/
XRP,ripple,Newb here folks and boy am am I ignorant,6,11,2025-02-03 21:53:24,https://www.reddit.com/r/Ripple/comments/1ih16gs/newb_here_folks_and_boy_am_am_i_ignorant/
XRP,ripple,"Ripple and u/OndoFinance are bringing OUSG, tokenized U.S. Treasuries to the XRP Ledger.",31,2,2025-01-28 14:52:13,https://www.reddit.com/r/Ripple/comments/1ic39hf/ripple_and_uondofinance_are_bringing_ousg/
XRP,ripple,02/01/25 [Join XRPhoenix Discord] - discord.com/invite/XRPhoenix,5,0,2025-02-01 05:00:59,https://www.reddit.com/r/Ripple/comments/1ieyyh7/020125_join_xrphoenix_discord/
XRP,ripple,Would XRP/BTC All time high be broken ever?,29,9,2025-01-26 11:45:37,https://www.reddit.com/r/Ripple/comments/1iacj0z/would_xrpbtc_all_time_high_be_broken_ever/
XRP,ripple,ELI5 how does the ripple network facilitate a CBDC like a potential euro coin and how does that directly affect the price of xrp?,9,10,2025-01-28 02:44:56,https://www.reddit.com/r/Ripple/comments/1ibrlvd/eli5_how_does_the_ripple_network_facilitate_a/
XRP,ripple,ETF XRP,19,12,2025-01-23 20:07:13,https://www.reddit.com/r/Ripple/comments/1i8cmeg/etf_xrp/
XRP,ripple,Gatehub can't verify my uk based account anymore,4,9,2025-01-29 22:38:56,https://www.reddit.com/r/Ripple/comments/1id6tw5/gatehub_cant_verify_my_uk_based_account_anymore/
XRP,ripple,Does anything on XRPL ledger use gas?,7,9,2025-01-27 09:50:00,https://www.reddit.com/r/Ripple/comments/1ib4qnf/does_anything_on_xrpl_ledger_use_gas/
XRP,ripple,PSA: Accessing old Rippex wallets from modern command line,12,1,2025-01-30 17:37:42,https://www.reddit.com/r/Ripple/comments/1idsiqt/psa_accessing_old_rippex_wallets_from_modern/
XRP,ripple,I had a golden goose and didn't know it,52,24,2025-01-25 07:45:30,https://www.reddit.com/r/Ripple/comments/1i9i0y3/i_had_a_golden_goose_and_didnt_know_it/
XRP,ripple,01/25/25 [Join XRPhoenix Discord] - discord.com/invite/XRPhoenix,6,0,2025-01-25 05:00:39,https://www.reddit.com/r/Ripple/comments/1i9fkzs/012525_join_xrphoenix_discord/
XRP,ripple,Patience Pays Off: My XRP Journey to Success,18,29,2025-01-19 10:31:40,https://www.reddit.com/r/Ripple/comments/1i4vo87/patience_pays_off_my_xrp_journey_to_success/
XRP,ripple,Common XRP Misconceptions ,13,14,2025-01-17 20:59:11,https://www.reddit.com/r/Ripple/comments/1i3ql2s/common_xrp_misconceptions/
XRP,ripple,What is the wallet everyone uses?,8,24,2025-01-23 04:01:35,https://www.reddit.com/r/Ripple/comments/1i7uvzy/what_is_the_wallet_everyone_uses/
XRP,ripple,Whales Purchase $1 Billion Worth of XRP in Just 48 Hours,178,8,2025-01-15 18:45:51,https://www.binance.com/en/square/post/18826849113665
XRP,ripple,Trying to invest in it using Interactive brokers,8,10,2025-01-17 06:34:10,https://www.reddit.com/r/Ripple/comments/1i3adt2/trying_to_invest_in_it_using_interactive_brokers/
XRP,ripple,Why Ripple (XRP) Is Poised to Lead in the Digital Economy,62,5,2025-01-11 11:35:18,https://dexstory.com/why-xrp-is-poised-to-lead-in-the-digital-economy/
XRP,ripple,Ripple's XRP one of the top gainers in last 1-hour. Spill the beans !!! what's cooking here?,17,3,2025-01-11 18:17:08,/r/XRP/comments/1hz0ljp/ripples_xrp_one_of_the_top_gainers_in_last_1hour/
XRP,ripple,01/11/25 [Join XRPhoenix Discord] - discord.com/invite/XRPhoenix,2,0,2025-01-11 05:00:38,https://www.reddit.com/r/Ripple/comments/1hyokad/011125_join_xrphoenix_discord/
XRP,ripple,"Took a hiatus , is TW a valid option?",11,10,2025-01-09 01:01:27,https://www.reddit.com/r/Ripple/comments/1hx0glc/took_a_hiatus_is_tw_a_valid_option/
XRP,ripple,01/04/25 [Join XRPhoenix Discord] - discord.com/invite/XRPhoenix,5,1,2025-01-04 05:00:17,https://www.reddit.com/r/Ripple/comments/1ht6x5q/010425_join_xrphoenix_discord/
XRP,ripple,12/28/24 [Join XRPhoenix Discord] - discord.com/invite/XRPhoenix,8,1,2024-12-28 05:00:18,https://www.reddit.com/r/Ripple/comments/1hnydrh/122824_join_xrphoenix_discord/
XRP,ripple,Uphold is a Rip Off!,51,114,2024-12-20 05:02:05,https://www.reddit.com/r/Ripple/comments/1hicfau/uphold_is_a_rip_off/
XRP,ripple,Has anyone ever transferred XRP to and exchange using the XRPDelete method before?,14,8,2024-12-14 23:40:49,https://www.reddit.com/r/Ripple/comments/1hefqp4/has_anyone_ever_transferred_xrp_to_and_exchange/
XRP,ripple,Anyone else having problems sending xrp out of crypto defi wallet,6,12,2024-12-14 11:01:12,https://www.reddit.com/r/Ripple/comments/1he0n7l/anyone_else_having_problems_sending_xrp_out_of/
XRP,ripple,OG Toast Wallet (2017+),42,39,2024-12-17 11:59:51,https://www.reddit.com/r/Ripple/comments/1hg93e5/og_toast_wallet_2017/
XRP,ripple,How will RLUSD affect the price of XRP?,122,83,2024-12-12 17:57:32,https://www.reddit.com/r/Ripple/comments/1hcqz8s/how_will_rlusd_affect_the_price_of_xrp/
XRP,ripple,XRP Quiz,15,11,2024-12-10 20:26:09,https://www.reddit.com/r/Ripple/comments/1hbbc62/xrp_quiz/
XRP,ripple,Ripple congrats on the new stable coin and what do you predict XRP price at in July 2025,114,51,2024-12-12 00:41:55,https://www.reddit.com/r/Ripple/comments/1hc8u33/ripple_congrats_on_the_new_stable_coin_and_what/
XRP,ripple,BRAD. 60MINUTES. XRP,26,114,2024-12-09 03:55:46,https://www.reddit.com/r/Ripple/comments/1ha1309/brad_60minutes_xrp/
XRP,ripple,Scaring of investors before ISO20022?,63,44,2024-12-12 14:07:44,https://www.reddit.com/r/Ripple/comments/1hcluht/scaring_of_investors_before_iso20022/
XRP,ripple,Might be too late to buy XRP,30,102,2024-12-08 08:40:10,https://www.reddit.com/r/Ripple/comments/1h9el8e/might_be_too_late_to_buy_xrp/
XRP,ripple,12/14/24 [Join XRPhoenix Discord] - discord.com/invite/XRPhoenix,10,0,2024-12-14 05:00:18,https://www.reddit.com/r/Ripple/comments/1hdvhut/121424_join_xrphoenix_discord/
XRP,ripple,Heard big companies & congressmen were investing in xrp 2 months ago @ $0.50,86,10,2024-12-09 07:42:35,https://www.reddit.com/gallery/1ha4nyu
XRP,ripple,XRP ,88,35,2024-12-06 02:07:43,https://www.reddit.com/r/Ripple/comments/1h7qgnk/xrp/
XRP,ripple,XRP will change this data DRAMATICALLY.,50,13,2024-12-07 04:46:27,/r/XRP/comments/1h8kmzq/xrp_will_change_this_data_dramatically/
XRP,ripple,How fast?,65,28,2024-12-12 11:36:31,https://www.reddit.com/r/Ripple/comments/1hcj758/how_fast/
XRP,ripple,RIPPLE RELEASE DATE,67,49,2024-12-11 22:07:11,https://www.reddit.com/r/Ripple/comments/1hc5hyg/ripple_release_date/
XRP,ripple,XRP price needs to be high instantly before regulations?,15,65,2024-12-07 00:56:07,https://www.reddit.com/r/Ripple/comments/1h8gnv1/xrp_price_needs_to_be_high_instantly_before/
XRP,ripple,Xrp not dropping in price when the bull market is over...?,60,141,2024-12-06 21:07:44,https://www.reddit.com/r/Ripple/comments/1h8bs4e/xrp_not_dropping_in_price_when_the_bull_market_is/
XRP,ripple,Where to check my balance with my privatekey (not the passphrase),10,19,2024-12-11 17:38:43,https://www.reddit.com/r/Ripple/comments/1hbz37l/where_to_check_my_balance_with_my_privatekey_not/
XRP,ripple,Time IN the game,94,21,2024-12-11 07:06:33,https://www.reddit.com/r/Ripple/comments/1hbny9r/time_in_the_game/
XRP,ripple,Do you stake/Lend your XRP? ,19,38,2024-12-04 11:40:31,https://www.reddit.com/r/Ripple/comments/1h6e1ta/do_you_stakelend_your_xrp/
XRP,ripple,XRP is trending twice as high as Bitcoin on google trends,347,47,2024-12-04 19:28:20,https://www.reddit.com/r/Ripple/comments/1h6orwp/xrp_is_trending_twice_as_high_as_bitcoin_on/
XRP,ripple,Is XRP the Future of Crypto? Here's What Experts Predict!,71,11,2024-12-04 05:19:51,https://bitperfect.pe/en/is-xrp-the-future-of-crypto-heres-what-experts-predict/
XRP,ripple,XRP back at #3,225,43,2024-12-02 01:24:45,https://www.reddit.com/r/Ripple/comments/1h4j9jo/xrp_back_at_3/
XRP,ripple,Xrp and the Road to 100.,597,311,2024-12-02 00:29:15,https://www.reddit.com/r/Ripple/comments/1h4i3xf/xrp_and_the_road_to_100/
XRP,ripple,"XRP cuts reserve requirement by 90%, allowing for smaller new wallets",114,18,2024-12-03 11:26:48,https://www.msn.com/en-us/money/markets/xrp-cuts-reserve-requirement-by-90-allowing-for-smaller-new-wallets/ar-AA1vbiHg?ocid=finance-verthp-feeds
XRP,ripple,"bought XRP in 2018, been sitting in gatehub since. Now I am locked out of my account. Help??",30,53,2024-12-04 19:59:59,https://www.reddit.com/r/Ripple/comments/1h6pjy1/bought_xrp_in_2018_been_sitting_in_gatehub_since/
XRP,ripple,XRP Becomes The 3rd Largest Crypto,77,1,2024-12-02 05:31:32,https://www.reddit.com/r/Ripple/comments/1h4nulr/xrp_becomes_the_3rd_largest_crypto/
XRP,ripple,Why do I have more XRP than I thought I did?,12,25,2024-12-03 06:21:18,https://www.reddit.com/r/Ripple/comments/1h5h3u5/why_do_i_have_more_xrp_than_i_thought_i_did/
XRP,ripple,RLUSD and XRP,50,19,2024-12-01 00:50:10,https://www.reddit.com/r/Ripple/comments/1h3r381/rlusd_and_xrp/
XRP,ripple,Stablecoin on the way,157,38,2024-12-06 16:14:50,https://www.reddit.com/gallery/1h84y81
XRP,ripple,12/07/24 [Join XRPhoenix Discord] - discord.com/invite/XRPhoenix,3,0,2024-12-07 05:00:20,https://www.reddit.com/r/Ripple/comments/1h8l41m/120724_join_xrphoenix_discord/
XRP,ripple,Should Ripple target EBay as a Partner or customer?,21,6,2024-12-04 16:01:03,https://www.reddit.com/r/Ripple/comments/1h6jj1e/should_ripple_target_ebay_as_a_partner_or_customer/
XRP,ripple,XRP balance not showing up in Coinbase. ,20,12,2024-11-30 18:58:22,https://www.reddit.com/r/Ripple/comments/1h3jkqb/xrp_balance_not_showing_up_in_coinbase/
XRP,ripple,Realistic XRP Predictions...?!?!,4,11,2024-11-30 02:26:26,https://www.reddit.com/r/Ripple/comments/1h32di3/realistic_xrp_predictions/
XRP,ripple,"Rumor: Ripple May Use XRP Escrow to Back $RLUSD, Unlocking Capital and Boosting XRP's Value | Mind Bend Theory",189,30,2024-12-02 09:19:47,https://mindbendtheory.com/rumor-ripple-may-use-xrp-escrow-to-back-dollarrlusd-unlocking-capital-and-boosting-xrps-value
XRP,ripple,Haven't seen anything about this on here just wondering if there is anyone here that knows more about this,36,12,2024-12-04 09:49:07,https://www.reddit.com/gallery/1h6cgl6
XRP,ripple,I want in on the action,46,28,2024-12-03 15:05:58,https://www.reddit.com/r/Ripple/comments/1h5pgz6/i_want_in_on_the_action/
XRP,ripple,Finally got it back!,62,32,2024-12-04 00:50:05,https://www.reddit.com/r/Ripple/comments/1h63doq/finally_got_it_back/
XRP,ripple,WTF EXACTLY IS RLUSD ,21,153,2024-12-04 02:27:10,https://www.reddit.com/r/Ripple/comments/1h65dzx/wtf_exactly_is_rlusd/
XRP,ripple,Uphold makes you sell at a lower price,28,28,2024-12-02 19:35:14,https://www.reddit.com/r/Ripple/comments/1h53jxv/uphold_makes_you_sell_at_a_lower_price/
XRP,ripple,Should I buy more? ,82,83,2024-12-01 23:51:02,https://www.reddit.com/r/Ripple/comments/1h4hab5/should_i_buy_more/
XRP,ripple,Rippex - cold storage,17,8,2024-12-03 15:13:01,https://www.reddit.com/r/Ripple/comments/1h5pmzk/rippex_cold_storage/
XRP,ripple,XRP and DLO,7,2,2024-11-25 22:36:34,https://www.reddit.com/r/Ripple/comments/1gzw4wj/xrp_and_dlo/
XRP,ripple,Should I sell my Shiba and Doge Coin to buy more XRP? ,83,126,2024-11-27 06:43:56,https://www.reddit.com/r/Ripple/comments/1h0y9at/should_i_sell_my_shiba_and_doge_coin_to_buy_more/
XRP,ripple,$100 billion market cap,218,11,2024-11-30 00:12:32,https://i.redd.it/lmuybzadlx3e1.png
XRP,ripple,WisdomTree Funds has registered for an XRP ETF.,64,3,2024-11-25 19:29:17,https://www.reddit.com/r/Ripple/comments/1gzrgov/wisdomtree_funds_has_registered_for_an_xrp_etf/
XRP,ripple,How do I create a ripple private wallet?,7,11,2024-11-29 04:47:48,https://www.reddit.com/r/Ripple/comments/1h2dytg/how_do_i_create_a_ripple_private_wallet/
XRP,ripple,??How to Transfer XRP from cold storage paper wallet to Uphold account??,5,1,2024-11-25 22:29:13,https://www.reddit.com/r/Ripple/comments/1gzvyg8/how_to_transfer_xrp_from_cold_storage_paper/
XRP,ripple,11/30/24 [Join XRPhoenix Discord] - discord.com/invite/XRPhoenix,7,1,2024-11-30 05:00:22,https://www.reddit.com/r/Ripple/comments/1h352if/113024_join_xrphoenix_discord/
XRP,ripple,XRP,22,20,2024-11-22 02:32:25,https://www.reddit.com/r/Ripple/comments/1gwxei2/xrp/
XRP,ripple,Potential Ripple IPO Valuation 2025,29,36,2024-11-28 15:17:38,https://www.reddit.com/r/Ripple/comments/1h1y5eb/potential_ripple_ipo_valuation_2025/
XRP,ripple,XRP will soon be #5 in market cap!,96,24,2024-11-23 05:32:00,https://www.reddit.com/r/Ripple/comments/1gxsgp1/xrp_will_soon_be_5_in_market_cap/
XRP,ripple,Rigged From the Start(xrp unleashed),12,4,2024-11-23 04:05:00,https://www.reddit.com/r/Ripple/comments/1gxqzwq/rigged_from_the_startxrp_unleashed/
XRP,ripple,XRP just hit $1.4! 🥂,106,11,2024-11-22 05:15:20,https://imgur.com/nEcpsI6
XRP,ripple,Can you sell xrp on coinbase,11,9,2024-11-22 04:31:54,https://www.reddit.com/r/Ripple/comments/1gwzn13/can_you_sell_xrp_on_coinbase/
XRP,ripple,Need Advice on Accessing Toast Wallet and Sending XRP,8,10,2024-11-22 07:52:03,https://www.reddit.com/r/Ripple/comments/1gx2qxl/need_advice_on_accessing_toast_wallet_and_sending/
XRP,ripple,WisdomTree Launches Physical XRP ETP with Competitive Fees,27,2,2024-11-21 23:12:09,https://www.coinspeaker.com/wisdomtree-launches-physical-xrp-etp-competitive-fees/
XRP,ripple,Lost xrp during transfer,3,11,2024-11-20 19:38:36,https://www.reddit.com/r/Ripple/comments/1gvy533/lost_xrp_during_transfer/
XRP,ripple,Case report day 2285 ,35,15,2024-11-25 05:50:17,https://www.reddit.com/r/Ripple/comments/1gzbzfa/case_report_day_2285/
XRP,ripple,Ripple Announces First Tokenized Money Market Fund on the XRPL,126,21,2024-11-25 14:16:08,https://www.reddit.com/r/Ripple/comments/1gzjsde/ripple_announces_first_tokenized_money_market/
XRP,ripple,Xrp Dex,8,1,2024-11-19 01:53:58,https://www.reddit.com/r/Ripple/comments/1gum0u3/xrp_dex/
XRP,ripple,$XRP $100 Let’s Go Ripple! ,25,31,2024-11-17 22:37:39,https://www.reddit.com/r/Ripple/comments/1gtpqij/xrp_100_lets_go_ripple/
XRP,ripple,XRP potential ,38,22,2024-11-16 16:59:08,https://www.reddit.com/r/Ripple/comments/1gsrllf/xrp_potential/
XRP,ripple,11/23/24 [Join XRPhoenix Discord] - discord.com/invite/XRPhoenix,2,0,2024-11-23 05:00:17,https://www.reddit.com/r/Ripple/comments/1gxrxr2/112324_join_xrphoenix_discord/
XRP,ripple,Warning: They stole all my XRP,45,46,2024-11-16 12:43:35,https://www.reddit.com/r/Ripple/comments/1gsmhpy/warning_they_stole_all_my_xrp/
XRP,ripple,Toastwallet passphrase restoring,6,19,2024-11-21 00:08:36,https://www.reddit.com/r/Ripple/comments/1gw2ky1/toastwallet_passphrase_restoring/
XRP,ripple,Dumbshit took a screenshot,12,43,2024-11-22 02:11:08,https://www.reddit.com/r/Ripple/comments/1gwwz9y/dumbshit_took_a_screenshot/
XRP,ripple,XRP has now broken out again $1,106,23,2024-11-16 04:48:07,https://www.reddit.com/r/Ripple/comments/1gsfr9t/xrp_has_now_broken_out_again_1/
XRP,ripple,Is it possible to trade on gatehub?,3,1,2024-11-22 04:28:02,https://www.reddit.com/r/Ripple/comments/1gwzkkk/is_it_possible_to_trade_on_gatehub/
XRP,ripple,If XRP goes to $100,58,70,2024-11-15 17:51:55,https://www.reddit.com/r/Ripple/comments/1gs2893/if_xrp_goes_to_100/
XRP,ripple,Gatehub ,3,1,2024-11-21 19:17:56,https://www.reddit.com/r/Ripple/comments/1gwnp0w/gatehub/
XRP,ripple,XRP ALL THE WAY UP!!!!,48,4,2024-11-15 15:01:43,https://i.redd.it/40m6li6cy21e1.jpeg
XRP,ripple,Xrp $1 by end of day?,8,1,2024-11-15 14:15:20,https://www.reddit.com/r/Ripple/comments/1grxalk/xrp_1_by_end_of_day/
XRP,ripple,If.. if is good.,38,4,2024-11-19 03:23:22,https://www.reddit.com/r/Ripple/comments/1gunrls/if_if_is_good/
XRP,ripple,How to withdraw XRP from binance ,10,7,2024-11-14 22:40:11,https://www.reddit.com/r/Ripple/comments/1grhemm/how_to_withdraw_xrp_from_binance/
XRP,ripple,"RippleClient Wallet question
",5,0,2024-11-19 10:27:55,https://www.reddit.com/r/Ripple/comments/1guu4vk/rippleclient_wallet_question/
XRP,ripple,Need help accessing old ripple file,7,15,2024-11-19 21:39:50,https://www.reddit.com/r/Ripple/comments/1gv8rkn/need_help_accessing_old_ripple_file/
XRP,ripple,Just got ripped off.,24,36,2024-11-17 18:30:42,https://www.reddit.com/r/Ripple/comments/1gtk4sd/just_got_ripped_off/
XRP,ripple,What's the difference between this thread and XRP thread?,12,7,2024-11-10 15:05:54,https://www.reddit.com/r/Ripple/comments/1go2mcg/whats_the_difference_between_this_thread_and_xrp/
XRP,ripple,Q3 2024 XRP Markets Report by Ripple,11,0,2024-11-02 05:33:07,https://ripple.com/insights/q3-2024-xrp-markets-report/
XRP,ripple,Deaton Now Annihilates Senator Warren on The XRP Movement,40,1,2024-10-16 23:25:02,https://franknez.com/deaton-now-annihilates-senator-warren-on-the-xrp-movement/
XRP,ripple,Question regarding result of lawsuit,10,20,2024-10-15 21:10:45,https://www.reddit.com/r/Ripple/comments/1g4ijqg/question_regarding_result_of_lawsuit/
XRP,ripple,09/29/24 [Join XRPLounge Discord] - discord.com/invite/XRPLounge-621074040169431052,11,3,2024-09-29 04:00:28,https://www.reddit.com/r/Ripple/comments/1frvwqr/092924_join_xrplounge_discord/
XRP,ripple,09/22/24 [Join XRPLounge Discord] - discord.com/invite/XRPLounge-621074040169431052,6,2,2024-09-22 04:00:25,https://www.reddit.com/r/Ripple/comments/1fmkmln/092224_join_xrplounge_discord/
XRP,ripple,Grayscale Investments Launches Grayscale XRP Trust,75,8,2024-09-12 13:52:55,https://www.globenewswire.com/news-release/2024/09/12/2945244/0/en/Grayscale-Investments-Launches-Grayscale-XRP-Trust.html
XRP,ripple,Download XRP Ledger Data,9,2,2024-09-11 13:17:50,https://www.reddit.com/r/Ripple/comments/1fe9wk3/download_xrp_ledger_data/
XRP,ripple,Public Known Adresses/Domains,5,4,2024-09-16 12:26:20,https://www.reddit.com/r/Ripple/comments/1fi3a50/public_known_adressesdomains/
XRP,ripple,Burns,5,18,2024-09-14 12:59:09,https://www.reddit.com/r/Ripple/comments/1fglgwt/burns/
XRP,ripple,Keep having dreams,43,61,2024-09-09 20:01:11,https://www.reddit.com/r/Ripple/comments/1fcywew/keep_having_dreams/
XRP,ripple,Problem with electrum-xrp,5,3,2024-08-19 01:12:35,https://www.reddit.com/r/Ripple/comments/1evpd5u/problem_with_electrumxrp/
XRP,ripple,08/25/24 [Join XRPLounge Discord] - discord.com/invite/XRPLounge-621074040169431052,9,2,2024-08-25 04:00:30,https://www.reddit.com/r/Ripple/comments/1f0nq9m/082524_join_xrplounge_discord/
XRP,ripple,Xrp,5,40,2024-08-08 17:40:34,https://www.reddit.com/r/Ripple/comments/1enc8xf/xrp/
XRP,ripple,Ripple's Strategic Partnership with DIFC Innovation Hub to Drive Blockchain Adoption in the Middle East,43,16,2024-08-13 19:53:27,https://www.reddit.com/r/Ripple/comments/1erhfsi/ripples_strategic_partnership_with_difc/
XRP,ripple,Ripple USD Begins Testing on the XRP Ledger Mainnet,71,8,2024-08-09 16:37:04,https://ripple.com/insights/a-new-era-of-stablecoins-ripple-usd-begins-testing-on-the-xrp-ledger-mainnet/?utm_source=x&utm_medium=organic_social&utm_campaign=cont-blog-global-stablecoin-mainnetdeployment-all-2024-q3&utm_content=thread_static
XRP,ripple,OpenEden Introduces Tokenized US Treasury Bills onto the XRP Ledger | Ripple,49,5,2024-08-01 03:21:02,https://ripple.com/ripple-press/openeden-introduces-tokenized-us-treasury-bills-onto-the-xrp-ledger/?utm_campaign=&utm_medium=organic_social&utm_source=twitter
XRP,ripple,"Since 2017, I have been hearing that 1 Billion xrp will be released every month for 55 months. ",20,9,2024-08-01 03:04:35,/r/XRP/comments/1eh5xdb/since_2017_i_have_been_hearing_that_1_billion_xrp/
XRP,ripple,08/04/24 [Join XRPLounge Discord] - discord.com/invite/XRPLounge-621074040169431052,6,2,2024-08-04 04:00:33,https://www.reddit.com/r/Ripple/comments/1ejmati/080424_join_xrplounge_discord/
XRP,ripple,Over it.,170,229,2024-08-01 17:59:11,https://www.reddit.com/r/Ripple/comments/1ehn8x8/over_it/
XRP,ripple,Am I crazy?,3,41,2024-07-25 15:39:06,https://www.reddit.com/r/Ripple/comments/1eby01e/am_i_crazy/
XRP,ripple,Ripple's Data Evolution: Leveraging Databricks for Next-Gen XRP Ledger Analytics,30,4,2024-07-17 04:07:02,https://engineering.ripple.com/ripples-data-evolution-leveraging-databricks-for-next-gen-xrp-ledger-analytics/
XRP,ripple,XRP Whales Accumulate 100 Million Coins,44,1,2024-07-15 10:18:38,https://coinradar.news/article/7LY9pmR1aDtJXczewtfvcq-xrp-whales-accumulate-100-million-coins-amid-ripple-vs-sec-settlement-speculations
XRP,ripple,Ripple CEO and Chief Justice look back on the big win against the SEC over XRP.,45,7,2024-07-14 18:47:10,https://coinradar.news/article/21okt4SHQ8j9edAfG2O4fw-ripple-ceo-and-chief-justice-look-back-on-the-big-win-against-the-sec-over-xrp
XRP,ripple,07/14/24 [Join XRPLounge Discord] - discord.com/invite/XRPLounge-621074040169431052,8,3,2024-07-14 04:00:27,https://www.reddit.com/r/Ripple/comments/1e2t3e8/071424_join_xrplounge_discord/
XRP,ripple,07/07/24 [Join XRPLounge Discord] - discord.com/invite/XRPLounge-621074040169431052,4,3,2024-07-07 04:00:30,https://www.reddit.com/r/Ripple/comments/1dx7oh1/070724_join_xrplounge_discord/
XRP,ripple,"SEC vs Ripple “final” stages - Will the court announce the decision release date in advance, or will it be released unexpectedly?",36,29,2024-07-06 07:31:47,https://www.reddit.com/r/Ripple/comments/1dwk6db/sec_vs_ripple_final_stages_will_the_court/
XRP,ripple,Strange message in escrow unlock,4,3,2024-07-02 14:58:11,https://www.reddit.com/r/Ripple/comments/1dtnvt5/strange_message_in_escrow_unlock/
XRP,ripple,06/30/24 [Join XRPLounge Discord] - discord.com/invite/XRPLounge-621074040169431052,7,0,2024-06-30 04:00:25,https://www.reddit.com/r/Ripple/comments/1drsxhu/063024_join_xrplounge_discord/
XRP,ripple,06/16/24 [Join XRPLounge Discord] - discord.com/invite/XRPLounge-621074040169431052,3,3,2024-06-16 04:00:38,https://www.reddit.com/r/Ripple/comments/1dgz8ms/061624_join_xrplounge_discord/
XRP,ripple,OK Story Time! XRP ,21,20,2024-06-04 22:25:19,https://www.reddit.com/r/Ripple/comments/1d8a2nc/ok_story_time_xrp/
XRP,ripple,06/09/24 [Join XRPLounge Discord] - discord.com/invite/XRPLounge-621074040169431052,7,2,2024-06-09 04:00:29,https://www.reddit.com/r/Ripple/comments/1dbkwfs/060924_join_xrplounge_discord/
XRP,ripple,XRP now available on Coinbase in New York!,135,21,2024-05-29 20:41:02,https://i.redd.it/9uwuoq4xff3d1.jpeg
XRP,ripple,06/02/24 [Join XRPLounge Discord] - discord.com/invite/XRPLounge-621074040169431052,4,1,2024-06-02 04:00:29,https://www.reddit.com/r/Ripple/comments/1d64rjv/060224_join_xrplounge_discord/
XRP,ripple,05/19/24 [Join XRPLounge Discord] - discord.com/invite/XRPLounge-621074040169431052,5,2,2024-05-19 04:00:32,https://www.reddit.com/r/Ripple/comments/1cvfhav/051924_join_xrplounge_discord/
XRP,ripple,Japan’s Finance Giant SBI Becomes XRP Ledger Validator,58,5,2024-05-12 16:12:56,https://thecryptobasic.com/2024/05/10/japans-finance-giant-sbi-becomes-xrp-ledger-validator/
XRP,ripple,How will SBI Japan influence xrp? ,15,25,2024-05-11 03:00:43,https://www.reddit.com/r/Ripple/comments/1cp7kjc/how_will_sbi_japan_influence_xrp/
XRP,ripple,Ripple stablecoin,14,6,2024-05-10 20:27:59,https://www.reddit.com/r/Ripple/comments/1cozabj/ripple_stablecoin/
XRP,ripple,CTF price on SoloDex wallet,9,10,2024-05-02 09:09:53,https://www.reddit.com/r/Ripple/comments/1cib2pk/ctf_price_on_solodex_wallet/
XRP,ripple,04/28/24 [Join XRPLounge Discord] - discord.com/invite/XRPLounge-621074040169431052,2,1,2024-04-28 04:00:35,https://www.reddit.com/r/Ripple/comments/1cexbwr/042824_join_xrplounge_discord/
XRP,ripple,04/21/24 [Join XRPLounge Discord] - discord.com/invite/XRPLounge-621074040169431052,2,2,2024-04-21 04:00:31,https://www.reddit.com/r/Ripple/comments/1c98rk7/042124_join_xrplounge_discord/
XRP,ripple,04/14/24 [Join XRPLounge Discord] - discord.com/invite/XRPLounge-621074040169431052,2,1,2024-04-14 04:00:37,https://www.reddit.com/r/Ripple/comments/1c3kh7c/041424_join_xrplounge_discord/
XRP,ripple,04/07/24 [Join XRPLounge Discord] - discord.com/invite/XRPLounge-621074040169431052,4,1,2024-04-07 04:00:34,https://www.reddit.com/r/Ripple/comments/1bxv1lb/040724_join_xrplounge_discord/
XRP,ripple,Ripple Desktop Wallet and access,8,30,2024-04-05 15:45:54,https://www.reddit.com/r/Ripple/comments/1bwlbp9/ripple_desktop_wallet_and_access/
XRP,ripple,03/31/24 [Join XRPLounge Discord] - discord.com/invite/XRPLounge-621074040169431052,2,0,2024-03-31 04:00:31,https://www.reddit.com/r/Ripple/comments/1bs1a2d/033124_join_xrplounge_discord/
XRP,ripple,03/25/24 [Join XRPLounge Discord] - discord.com/invite/XRPLounge-621074040169431052,5,3,2024-03-25 18:34:08,https://www.reddit.com/r/Ripple/comments/1bnl3n5/032524_join_xrplounge_discord/
XRP,ripple,Jaw dropping XRP news from Zoniqx (Tassets) CEO ,82,64,2024-03-15 19:05:20,https://www.reddit.com/r/Ripple/comments/1bflp6r/jaw_dropping_xrp_news_from_zoniqx_tassets_ceo/
XRP,ripple,03/18/24 [Join XRPLounge Discord] - discord.com/invite/XRPLounge-621074040169431052,2,11,2024-03-18 18:34:09,https://www.reddit.com/r/Ripple/comments/1bhy3fv/031824_join_xrplounge_discord/
XRP,ripple,Password manager with XRP wallet from 2017/2018?,4,0,2024-03-11 18:09:44,https://www.reddit.com/r/Ripple/comments/1bc9uwe/password_manager_with_xrp_wallet_from_20172018/
XRP,ripple,blah blah blah,18,69,2024-03-12 15:21:49,https://www.reddit.com/r/Ripple/comments/1bczty1/blah_blah_blah/
XRP,ripple,Mmmhhhh,35,8,2024-03-11 16:38:31,https://i.redd.it/z6dippzmgqnc1.jpeg
XRP,ripple,Airdrop years ago to a password manager,4,1,2024-03-11 18:08:52,https://www.reddit.com/r/Ripple/comments/1bc9u34/airdrop_years_ago_to_a_password_manager/
XRP,ripple,03/11/24 [Join XRPLounge Discord] - discord.com/invite/XRPLounge-621074040169431052,3,6,2024-03-11 18:34:20,https://www.reddit.com/r/Ripple/comments/1bcagu1/031124_join_xrplounge_discord/
XRP,ripple,03/10/24 [Join XRPLounge Discord] - discord.com/invite/XRPLounge-621074040169431,3,6,2024-03-10 05:00:37,https://www.reddit.com/r/Ripple/comments/1bb23ny/031024_join_xrplounge_discord/
XRP,ripple,Advice,3,4,2024-03-08 06:04:37,https://www.reddit.com/r/Ripple/comments/1b9gxr4/advice/
XRP,ripple,Transaction Hunt Help,2,12,2024-03-04 22:20:27,https://www.reddit.com/r/Ripple/comments/1b6o1kx/transaction_hunt_help/
XRP,ripple,03/03/24 [Join XRPLounge Discord] - discord.com/invite/XRPLounge-621074040169431,5,8,2024-03-03 05:00:31,https://www.reddit.com/r/Ripple/comments/1b58wc0/030324_join_xrplounge_discord/
XRP,ripple,XRP Toolkit - Should be using that to buy and sell?,7,1,2024-02-26 16:24:57,https://www.reddit.com/r/Ripple/comments/1b0llpi/xrp_toolkit_should_be_using_that_to_buy_and_sell/
XRP,ripple,Have you received an email pretending to be from Ripple about the token being released?,14,14,2024-03-01 11:07:37,https://www.reddit.com/r/Ripple/comments/1b3rq67/have_you_received_an_email_pretending_to_be_from/
XRP,ripple,02/25/24 [Join XRPLounge Discord] - discord.com/invite/XRPLounge-621074040169431,6,14,2024-02-25 05:00:32,https://www.reddit.com/r/Ripple/comments/1azflzs/022524_join_xrplounge_discord/
XRP,ripple,XRP ADVICE,13,61,2024-02-16 15:17:15,https://www.reddit.com/r/Ripple/comments/1asb21f/xrp_advice/
XRP,ripple,02/18/24 [Join XRPLounge Discord] - discord.com/invite/XRPLounge-621074040169431,8,4,2024-02-18 17:26:08,https://www.reddit.com/r/Ripple/comments/1atzerx/021824_join_xrplounge_discord/
XRP,ripple,02/15/24 [Join XRPLounge Discord] - discord.com/invite/XRPLounge-621074040169431052,7,10,2024-02-15 05:00:20,https://www.reddit.com/r/Ripple/comments/1ar7oo5/021524_join_xrplounge_discord/
XRP,ripple,02/14/24 [Join XRPLounge Discord] - discord.com/invite/XRPLounge-621074040169431052,4,8,2024-02-14 05:00:22,https://www.reddit.com/r/Ripple/comments/1aqeu17/021424_join_xrplounge_discord/
XRP,ripple,"Kraken: Notice of class action lawsuit against Ripple, XRP II, and Brad Garlinghouse",19,8,2024-02-08 22:10:20,https://support.kraken.com/hc/en-us/articles/ripple-class-action-lawsuit
XRP,ripple,02/12/24 [Join XRPLounge Discord] - discord.com/invite/XRPLounge-621074040169431052,4,5,2024-02-12 05:00:41,https://www.reddit.com/r/Ripple/comments/1aos19i/021224_join_xrplounge_discord/
XRP,ripple,02/11/24 [Join XRPLounge Discord] - discord.com/invite/XRPLounge-621074040169431052,3,2,2024-02-11 05:00:29,https://www.reddit.com/r/Ripple/comments/1ao00n8/021124_join_xrplounge_discord/
XRP,ripple,02/07/24 [Join XRPLounge Discord] - discord.com/invite/XRPLounge-621074040169431052,4,3,2024-02-07 05:00:24,https://www.reddit.com/r/Ripple/comments/1akv227/020724_join_xrplounge_discord/
XRP,ripple,02/05/24 [Join XRPLounge Discord] - discord.com/invite/XRPLounge-621074040169431052,4,3,2024-02-05 05:00:43,https://www.reddit.com/r/Ripple/comments/1aj8igu/020524_join_xrplounge_discord/
XRP,CryptoCurrency,XRP Ledger Halted Block Production for over an hour,447,217,2025-02-05 04:47:30,https://decrypt.co/304451/xrp-ledger-temporarily-halts-block-production-ripple-cto?amp=1
XRP,CryptoCurrency,"Zachxbt: North Korea Botches 46,300 XRP Transfer, Leaving Funds Stranded in Blockchain Limbo",280,41,2025-02-04 17:40:23,https://news.bitcoin.com/zachxbt-north-korea-botches-46300-xrp-transfer-leaving-funds-stranded-in-blockchain-limbo/
XRP,CryptoCurrency,Ripple's XRP omitted from Hong Kong regulator’s approved list of cryptos,164,67,2025-02-03 10:53:08,https://cryptoslate.com/ripples-xrp-omitted-from-hong-kong-regulators-approved-list-of-cryptos/
XRP,CryptoCurrency,Grayscale files for XRP ETF with NYSE,171,92,2025-01-30 19:48:23,https://crypto.news/grayscale-files-for-xrp-etf-with-nyse/
XRP,CryptoCurrency,Does it even matter which one you hold from top 30 ?,189,166,2025-02-04 11:00:53,https://www.reddit.com/gallery/1ihf5wc
XRP,CryptoCurrency,I am literally shaking from all this winning,1569,446,2025-02-05 01:07:18,https://i.redd.it/dwaj582808he1.jpeg
XRP,CryptoCurrency,Noob Question,3,13,2025-02-04 17:08:34,https://www.reddit.com/r/CryptoCurrency/comments/1ihmn65/noob_question/
XRP,CryptoCurrency,"Free Fall: Dow Futures Slide, Crypto Liquidations Top $1B",371,202,2025-02-03 01:53:24,https://www.reddit.com/r/CryptoCurrency/comments/1igdy8u/free_fall_dow_futures_slide_crypto_liquidations/
XRP,CryptoCurrency,"Judge Analisa Torres, whose landmark decision that retail XRP sales weren't securities, sentenced a crypto Ponzi scheme promoter to 30 months in prison Thursday for defrauding investors of $8.4 million.",41,5,2025-01-28 21:13:31,https://decrypt.co/303174/judge-ripple-sentence-crypto-ponzi
XRP,CryptoCurrency,Regulatory filings flood in from Grayscale and CoinShares proposing ETFs tracking XRP and Litecoin,15,2,2025-01-24 22:05:48,https://www.theblock.co/post/337024/regulatory-filings-flood-in-from-grayscale-and-coinshares-proposing-etfs-tracking-xrp-and-litecoin
XRP,CryptoCurrency,"CME Group clarifies no official decision made on XRP, Solana futures contracts",20,6,2025-01-23 11:09:04,https://cryptobriefing.com/cme-contracts-decision-xrp-solana/
XRP,CryptoCurrency,XRP Wallet Scam Explodes: How Scammers Are Using FOMO to Target Investors,13,8,2025-01-23 07:51:48,https://voiceofcrypto.online/latest-news/xrp-wallet-scam
XRP,CryptoCurrency,"CME staging website suggests XRP, Solana futures will go live on CME on Feb. 10 pending regulatory approval",22,5,2025-01-22 20:26:25,https://www.theblock.co/post/336440/cme-staging-website-suggests-xrp-solana-futures-will-go-live-on-cme-on-feb-10-pending-regulatory-approval
XRP,CryptoCurrency,The entire point of a blockchain is the ability for anyone to audit it starting from genesis block. You can’t do that with Ripple.,842,236,2025-01-24 10:15:09,https://www.reddit.com/r/CryptoCurrency/comments/1i8s9ez/the_entire_point_of_a_blockchain_is_the_ability/
XRP,CryptoCurrency,2025 feels like 2017 all over again.,556,339,2025-01-23 23:36:02,https://www.reddit.com/r/CryptoCurrency/comments/1i8hhim/2025_feels_like_2017_all_over_again/
XRP,CryptoCurrency,"Understanding the ""inverse r/cryptocurrency"" trading strategy. Is this sub consistently wrong? How it works, how to exploit it, and the underlying reason driving it:",1,26,2025-01-28 15:42:12,https://www.reddit.com/r/CryptoCurrency/comments/1ic4dus/understanding_the_inverse_rcryptocurrency_trading/
XRP,CryptoCurrency,What cryptocurrencies have the biggest cults?,99,355,2025-01-24 17:45:05,https://www.reddit.com/r/CryptoCurrency/comments/1i918hy/what_cryptocurrencies_have_the_biggest_cults/
XRP,CryptoCurrency,"Wave of ETF filings proposes Litecoin ETF, XRP and Solana leveraged funds, and more",5,3,2025-01-20 01:48:30,https://www.theblock.co/post/335596/wave-of-etf-filings-proposes-litecoin-etf-xrp-and-solana-leveraged-funds-and-more
XRP,CryptoCurrency,"Be honest, did I miss the XRP boat?",144,422,2025-01-18 02:26:08,https://www.reddit.com/r/CryptoCurrency/comments/1i3xgpu/be_honest_did_i_miss_the_xrp_boat/
XRP,CryptoCurrency,Seeking crypto recommendations with strong potential for the coming months,7,72,2025-01-24 04:38:59,https://www.reddit.com/r/CryptoCurrency/comments/1i8nhex/seeking_crypto_recommendations_with_strong/
XRP,CryptoCurrency,So no one really knows anything about anything what do we do?,1,10,2025-01-24 02:53:38,https://www.reddit.com/r/CryptoCurrency/comments/1i8ljsc/so_no_one_really_knows_anything_about_anything/
XRP,CryptoCurrency,XRP Trading Volume Surges Past Bitcoin on Coinbase Amid 600% Price Rally,268,70,2025-01-17 15:13:54,https://blockonomi.com/xrp-xrp-trading-volume-surges-past-bitcoin-on-coinbase-amid-600-price-rally/
XRP,CryptoCurrency,Trimming my portfolio - advice much appreciated!,3,19,2025-01-22 18:37:20,https://www.reddit.com/r/CryptoCurrency/comments/1i7i9zk/trimming_my_portfolio_advice_much_appreciated/
XRP,CryptoCurrency,XRP Hits a New All-time High at $3.39 After Nearly Seven Years,475,182,2025-01-16 21:33:52,https://beincrypto.com/xrp-hits-all-time-high/
XRP,CryptoCurrency,XRP hits 7-year high as optimism outweighs SEC appeal concerns,181,92,2025-01-16 11:48:13,https://cointelegraph.com/news/xrp-price-hits-seven-year-high-bullish-2025-outlook?utm_source=rss_feed&utm_medium=rss&utm_campaign=rss_partner_inbound
XRP,CryptoCurrency,AMA with Eclipse: Solana on Ethereum,30,87,2025-01-22 16:15:29,https://www.reddit.com/r/CryptoCurrency/comments/1i7erzp/ama_with_eclipse_solana_on_ethereum/
XRP,CryptoCurrency,Clear me up….Who holds it? Who uses it?  Where does it go?,185,203,2025-01-18 14:51:55,https://www.reddit.com/r/CryptoCurrency/comments/1i49556/clear_me_upwho_holds_it_who_uses_it_where_does_it/
XRP,CryptoCurrency,"Cuba, country with $147B GDP launched an official Memecoin and then rug pulled shortly after it pumped millions, now they have removed the tweet and account from “X”.",6691,621,2025-01-21 13:01:31,https://i.redd.it/uxhxlawyhcee1.jpeg
XRP,CryptoCurrency,Ripple’s XRP flips BlackRock by market cap,145,25,2025-01-15 13:05:05,https://www.cryptopolitan.com/ripples-xrp-flips-blackrock-by-market-cap/
XRP,CryptoCurrency,Ripple Price Hits 7-Year High at $3 Amid Growing XRP Network Adoption,868,243,2025-01-15 16:00:03,https://coinmarketcap.com/community/articles/6787d595c5edc52206032877/
XRP,CryptoCurrency,Ripple donates $100k in XRP for California wildfire relief,343,118,2025-01-14 19:26:32,https://crypto.news/ripple-donates-100k-in-xrp-for-california-wildfire-relief/
XRP,CryptoCurrency,Ripple has donated $100k in XRP to aid in wildfire relief efforts in California,84,39,2025-01-15 22:59:58,https://i.redd.it/6mgynix9n8de1.png
XRP,CryptoCurrency,Veteran Trader Peter Brandt Offers Truce to the XRP Army,8,12,2025-01-14 17:59:49,https://cryptopotato.com/veteran-trader-peter-brandt-offers-truce-to-the-xrp-army-details/
XRP,CryptoCurrency,"JPMorgan believes Solana, XRP ETPs could attract $15 billion in net inflows",37,8,2025-01-14 09:47:57,https://cryptoslate.com/jpmorgan-believes-solana-xrp-etps-could-attract-15-billion-in-net-inflows/
XRP,CryptoCurrency,Peter Brandt praises XRP following massive 10% jump,60,21,2025-01-13 01:27:53,https://www.cryptopolitan.com/peter-brandt-praises-xrp/
XRP,CryptoCurrency,"Do you still believe we’re trading crypto? I woke up and saw this, 4-hour candles moving like an F1 race, identical patterns, same timing. Crypto is how institutions are finding new liquidity. Forget the hype we’re all just pawns in their game.",33,28,2025-01-20 07:57:10,https://www.reddit.com/gallery/1i5l9z5
XRP,CryptoCurrency,Why Is XRP Up 5% Over The Week While the Rest of the Crypto Market Bleeds?,35,107,2025-01-13 17:29:37,https://voiceofcrypto.online/analysis/xrp-defies-crypto-market-crash
XRP,CryptoCurrency,"I bought $1k of the Top 10 Cryptos on January 1st, 2024 (ONE YEAR REPORT/+90%)",326,84,2025-01-15 14:05:56,https://www.reddit.com/r/CryptoCurrency/comments/1i1y3v6/i_bought_1k_of_the_top_10_cryptos_on_january_1st/
XRP,CryptoCurrency,Online news.,3,17,2025-01-14 19:02:14,https://www.reddit.com/r/CryptoCurrency/comments/1i1dl2l/online_news/
XRP,CryptoCurrency,Ripple CEO Says XRP ETF is ‘Next in Line”,15,32,2025-01-08 17:27:49,https://www.coindesk.com/markets/2025/01/08/xrp-etf-could-soon-be-a-reality-ripple-president-says-as-rlusd-gains-traction
XRP,CryptoCurrency,$220.344M Liquidated From The Crypto Market in Last 24 hours,433,79,2025-01-13 13:46:13,https://i.redd.it/saapqknnmrce1.png
XRP,CryptoCurrency,"Ripple's XRP takes second place in trade in South Korea, beats ETH | Cryptopolitan",37,6,2025-01-07 15:26:23,https://www.cryptopolitan.com/ripples-xrp-takes-2nd-place-in-south-korea/
XRP,CryptoCurrency,"XRP dethrones USDT, now ranked third largest crypto",144,51,2025-01-03 18:19:16,https://crypto.news/xrp-dethrones-usdt-now-ranked-third-largest-crypto/
XRP,CryptoCurrency,XRP flips USDT again to become the 3rd-largest crypto by market cap,127,47,2025-01-03 14:12:01,https://cointelegraph.com/news/xrp-becomes-third-largest-crypto-by-market-cap?utm_source=rss_feed&utm_medium=rss&utm_campaign=rss_partner_inbound
XRP,CryptoCurrency,$662.45 Million Liquidated From the Crypto Market in last 24hrs,204,66,2025-01-08 18:20:45,https://i.redd.it/l305es8uatbe1.png
XRP,CryptoCurrency,"XRP Volumes on South Korean Crypto Exchanges beat BTC, DOGE",111,71,2025-01-01 16:12:35,https://www.cryptotimes.io/2025/01/01/xrp-volumes-on-south-korean-crypto-exchanges-beat-btc-doge/
XRP,CryptoCurrency,For the EIGHTH STRAIGHT YEAR: Announcing The Top Ten Crypto Index Fund Experiment for 2025!,32,16,2025-01-07 15:37:33,https://www.reddit.com/r/CryptoCurrency/comments/1hvu3fn/for_the_eighth_straight_year_announcing_the_top/
XRP,CryptoCurrency,New to cryptocurrency. Looking for a trustworthy hot and cold wallet.,3,16,2025-01-06 16:20:12,https://www.reddit.com/r/CryptoCurrency/comments/1hv2si7/new_to_cryptocurrency_looking_for_a_trustworthy/
XRP,CryptoCurrency,Starting my journey,13,41,2025-01-05 12:07:15,https://www.reddit.com/r/CryptoCurrency/comments/1hu5qy5/starting_my_journey/
XRP,CryptoCurrency,"$1,000 to spend - what would you buy?",97,440,2025-01-02 04:38:34,https://www.reddit.com/r/CryptoCurrency/comments/1hrlrh2/1000_to_spend_what_would_you_buy/
XRP,CryptoCurrency,Here's how the top 20 alts from January 1st 2024 performed against Bitcoin in 2024. (Only 6 are green) ,37,44,2024-12-31 20:37:04,https://www.reddit.com/r/CryptoCurrency/comments/1hqngao/heres_how_the_top_20_alts_from_january_1st_2024/
XRP,CryptoCurrency,Why is this XRP rally even happening ? ,60,431,2024-12-25 02:00:45,https://www.reddit.com/r/CryptoCurrency/comments/1hlrjif/why_is_this_xrp_rally_even_happening/
XRP,CryptoCurrency,"XRP Wallets Have Been Growing At Parabolic Rate, Data Shows",33,36,2024-12-24 02:38:09,https://bitcoinist.com/xrp-wallets-growing-parabolic-rate-recently-data/
XRP,CryptoCurrency,"Found an old FOMO post of 2021, actual EOY 2022 Chart was an All Time Low of that Cycle... Nobody knows shit, always DYOR!",266,96,2024-12-25 19:09:06,https://i.redd.it/2yrgt1wml19e1.jpeg
XRP,CryptoCurrency,$7 billion wiped from XRP in a day,1865,332,2024-12-19 17:04:17,https://finbold.com/7-billion-wiped-from-xrp-in-a-day/
XRP,CryptoCurrency,Stock market block chain ,3,28,2024-12-27 17:27:29,https://www.reddit.com/r/CryptoCurrency/comments/1hnjym9/stock_market_block_chain/
XRP,CryptoCurrency,"I bought $1k of the Top 10 Cryptos on January 1st, 2023 (NOV Update/Month 23/+248%)",286,105,2024-12-23 14:19:17,https://www.reddit.com/r/CryptoCurrency/comments/1hkop0t/i_bought_1k_of_the_top_10_cryptos_on_january_1st/
XRP,CryptoCurrency,Will RLUSD Launch help XRP break above $3?,42,44,2024-12-17 09:41:34,https://www.reddit.com/r/CryptoCurrency/comments/1hg76ma/will_rlusd_launch_help_xrp_break_above_3/
XRP,CryptoCurrency,"Bloomberg analysts expect 'a wave of cryptocurrency ETFs' next year, including Solana and XRP funds",59,26,2024-12-17 20:47:24,https://www.theblock.co/post/331260/bloomberg-analysts-expect-a-wave-of-cryptocurrency-etfs-next-year-including-solana-and-xrp-funds
XRP,CryptoCurrency,Central Bank GAM Global Special Situations Fund Considering XRP Buyback Following A Similar Strategy Adopted by MicroStrategy in the US,16,14,2024-12-18 07:10:40,https://www.reddit.com/gallery/1hgw9c6
XRP,CryptoCurrency,"""Screw your stupid coins""",1196,61,2024-12-20 20:16:18,https://i.redd.it/t56cxktaa28e1.jpeg
XRP,CryptoCurrency,What will happen in next month for altcoins Where we are?,3,19,2024-12-18 23:30:16,https://www.reddit.com/r/CryptoCurrency/comments/1hhf0ck/what_will_happen_in_next_month_for_altcoins_where/
XRP,CryptoCurrency,RLUSD / XRP - Explained,20,29,2024-12-10 23:20:36,/r/XRP/comments/1hbej2a/rlusd_xrp_explained/
XRP,CryptoCurrency,Ripple's Stablecoin Approved: RLUSD Launch Could Supercharge XRP Demand – Featured Bitcoin News,94,13,2024-12-11 09:09:27,https://news.bitcoin.com/ripples-stablecoin-approved-rlusd-launch-could-supercharge-xrp-demand/
XRP,CryptoCurrency,How Ripple's XRP defied the odds to dominate the crypto market with a 300% surge,17,10,2024-12-11 21:46:49,https://www.msn.com/en-gb/money/markets/how-ripple-s-xrp-defied-the-odds-to-dominate-the-crypto-market-with-a-300-surge/ar-AA1vCEeN?ocid=BingNewsVerp
XRP,CryptoCurrency,Brad Garlinghouse Slams ’60 Minutes’ Edit For Omitting XRP Legal Victory,139,26,2024-12-10 08:21:31,https://www.blockhead.co/2024/12/10/brad-garlinghouse-slams-60-minutes-edit-for-omitting-xrp-legal-victory-2/
XRP,CryptoCurrency,XRP News Today: XRP Eyes $3.55 High Amid SEC Shake-Up and Spot ETF Hopes,20,11,2024-12-08 08:44:45,https://www.fxempire.com/forecasts/article/xrp-news-today-xrp-eyes-3-55-high-amid-sec-shake-up-and-spot-etf-hopes-1481732
XRP,CryptoCurrency,"Looking for a solid cold wallet. Please help! Reliable, secure, and easy to use. ",1,43,2024-12-16 00:36:02,https://www.reddit.com/r/CryptoCurrency/comments/1hf6t8a/looking_for_a_solid_cold_wallet_please_help/
XRP,CryptoCurrency,Ripple CEO Brad Garlinghouse questions '60 Minutes' omission of key XRP legal victory,113,22,2024-12-09 14:02:10,https://cryptoslate.com/ripple-ceo-brad-garlinghouse-questions-60-minutes-omission-of-key-xrp-legal-victory/
XRP,CryptoCurrency,"I bought $1k of the Top 10 Cryptos on January 1st, 2024 (NOV Update/Month 11/+110%)",276,78,2024-12-11 13:05:07,https://www.reddit.com/r/CryptoCurrency/comments/1hbt0if/i_bought_1k_of_the_top_10_cryptos_on_january_1st/
XRP,CryptoCurrency,Well played CDC!,16,10,2024-12-11 18:17:22,https://www.reddit.com/gallery/1hc00vx
XRP,CryptoCurrency,XRP enters corporate treasury reserves with Worksport and BC Bud Co investments,35,7,2024-12-06 14:02:54,https://cryptoslate.com/xrp-enters-corporate-treasury-reserves-with-worksport-and-bc-bud-co-investments/
XRP,CryptoCurrency,Ripple CEO Unveils Key Date: What XRP Holders Need to Know - Wall Street Pit,48,95,2024-12-07 00:32:07,https://wallstreetpit.com/121090-ripple-ceo-unveils-key-date-what-xrp-holders-need-to-know/
XRP,CryptoCurrency,"Alternative View of Your Portfolio: BTC as the Standard, and 'Stacking Sats' & 'Stash a Gwei'.",2,18,2024-12-12 01:33:42,https://www.reddit.com/r/CryptoCurrency/comments/1hc9vt0/alternative_view_of_your_portfolio_btc_as_the/
XRP,CryptoCurrency,XRP price nears $3 after soaring 425% in a month,249,59,2024-12-04 10:08:53,https://finbold.com/not-a-typo-xrp-price-nears-3-after-soaring-425-in-a-month/
XRP,CryptoCurrency,Take a moment to remember all the Alt Shills who told you taking profit in a bull run was a bad idea.,167,153,2024-12-09 22:50:09,https://www.reddit.com/r/CryptoCurrency/comments/1hamueg/take_a_moment_to_remember_all_the_alt_shills_who/
XRP,CryptoCurrency,‘Immense Potential’—Ripple Braced For XRP Spot ETF To Rival Bitcoin And Ethereum,115,41,2024-12-04 19:30:20,https://www.forbes.com/sites/digital-assets/2024/12/02/ripple-suddenly-braced-for-an-xrp-etf-earthquake-after-price-explosion-to-rival-bitcoin-and-ethereum/
XRP,CryptoCurrency,Asking for advice,3,26,2024-12-10 20:52:09,https://www.reddit.com/r/CryptoCurrency/comments/1hbbyp6/asking_for_advice/
XRP,CryptoCurrency,Ripple's XRP sees over $4 billion in profit-taking following surge in whale activity,220,19,2024-12-04 04:38:13,https://www.fxstreet.com/cryptocurrencies/news/ripples-xrp-investors-book-over-4-billion-in-profits-amid-south-koreas-declaration-of-martial-law-202412040015
XRP,CryptoCurrency,The scariest thing about all of this...,660,341,2024-12-09 10:49:06,https://www.reddit.com/r/CryptoCurrency/comments/1ha730u/the_scariest_thing_about_all_of_this/
XRP,CryptoCurrency,The ISO20022 Compliant Token narrative is fake,20,84,2024-12-09 19:46:54,https://www.reddit.com/r/CryptoCurrency/comments/1haihhz/the_iso20022_compliant_token_narrative_is_fake/
XRP,CryptoCurrency,"ETH Products Outperform BTC, While XRP Sees New Record",22,4,2024-12-03 07:53:05,https://cryptopotato.com/eth-products-outperform-btc-while-xrp-sees-new-record-coinshares/
XRP,CryptoCurrency,Why are XRP users the best at blowing smoke?,64,222,2024-12-02 23:37:25,https://www.reddit.com/r/CryptoCurrency/comments/1h59d5e/why_are_xrp_users_the_best_at_blowing_smoke/
XRP,CryptoCurrency,XRP Price On The Brink Of Another Breakout: The 'Game-Changing Implications' Of Ripple's RLUSD Mints,187,187,2024-12-03 21:13:38,https://bitcoinist.com/xrp-price-on-brink-breakout/?utm_source=coingecko&utm_content=coingecko&utm_campaign=coingecko&utm_medium=coingecko&utm_term=coingecko
XRP,CryptoCurrency,WisdomTree files with SEC for spot XRP ETF,77,10,2024-12-02 19:27:15,https://www.theblock.co/post/329111/wisdomtree-files-with-sec-for-spot-xrp-etf
XRP,CryptoCurrency,"Tron Breezes Past All-Time High After 30% Jump, Justin Sun Says TRX Equals XRP",23,52,2024-12-03 22:51:33,https://news.bitcoin.com/tron-breezes-past-all-time-high-after-30-jump-justin-sun-says-trx-equals-xrp/
XRP,CryptoCurrency,"XRP becomes world's third-largest crypto, overtakes Tether’s USDT in market cap",1021,307,2024-12-02 10:00:24,https://www.theblock.co/post/328877/xrp-third-largest-overtakes-usdt-market-cap
XRP,CryptoCurrency,"Do platforms like ICP and Render actually work? If so, how would I use them?",3,128,2024-12-08 04:56:33,https://www.reddit.com/r/CryptoCurrency/comments/1h9bayz/do_platforms_like_icp_and_render_actually_work_if/
XRP,CryptoCurrency,"XRP Price Hits 7-Year High, Now Up 274% This Month",1210,319,2024-12-01 00:14:15,https://decrypt.co/294162/xrp-price-hits-7-year-high
XRP,CryptoCurrency,XRP Overtakes BNB To Become Fifth-Largest Crypto by Market Cap Following 298% Rally in November,218,79,2024-12-01 13:22:38,https://dailyhodl.com/2024/12/01/xrp-overtakes-bnb-to-become-fifth-largest-crypto-by-market-cap-following-298-rally-in-november/
XRP,CryptoCurrency,We need to have a serious talk about Marketcaps. ,1402,709,2024-12-02 23:53:49,https://www.reddit.com/r/CryptoCurrency/comments/1h59q82/we_need_to_have_a_serious_talk_about_marketcaps/
XRP,CryptoCurrency,XRP price chases $2 after bull flag breakout leads to new 2024 highs,255,79,2024-11-30 00:01:05,https://cointelegraph.com/news/xrp-price-chases-2-after-bull-flag-breakout-leads-to-new-2024-highs?utm_source=rss_feed&utm_medium=rss&utm_campaign=rss_partner_inbound
XRP,CryptoCurrency,This cycle feels different,197,277,2024-12-04 15:47:46,https://www.reddit.com/r/CryptoCurrency/comments/1h6j711/this_cycle_feels_different/
XRP,CryptoCurrency,Coin ranking overtime website ,6,3,2024-12-04 21:37:53,https://www.reddit.com/r/CryptoCurrency/comments/1h6ryt8/coin_ranking_overtime_website/
XRP,CryptoCurrency,Market Cap Explanation Needed,6,49,2024-12-02 16:41:51,https://www.reddit.com/r/CryptoCurrency/comments/1h4z9i3/market_cap_explanation_needed/
XRP,CryptoCurrency,Remember. You can always sell a portion of your holdings. It doesn’t have to be all or nothing. Make a plan.,162,63,2024-12-03 15:52:37,https://www.reddit.com/r/CryptoCurrency/comments/1h5qk9h/remember_you_can_always_sell_a_portion_of_your/
XRP,CryptoCurrency,Am I crazy in thinking that I am getting in the 2017 mode/mood of operating?,24,78,2024-12-02 02:03:01,https://www.reddit.com/r/CryptoCurrency/comments/1h4k0ub/am_i_crazy_in_thinking_that_i_am_getting_in_the/
XRP,CryptoCurrency,People Forget,8,18,2024-12-02 17:58:20,https://youtu.be/onjS3eQlfL8?si=_PNvW0qviH-Y0EAq
XRP,CryptoCurrency,"Serious question, what are the odds of Amazon adopting some form of crypto payments?",9,100,2024-12-03 16:23:22,https://www.reddit.com/r/CryptoCurrency/comments/1h5ra8z/serious_question_what_are_the_odds_of_amazon/
XRP,CryptoCurrency,XRP’s Explosive Month: 163% Growth Powers Through Crypto Turbulence ,7,8,2024-11-26 21:01:07,https://news.bitcoin.com/xrps-explosive-month-163-growth-powers-through-crypto-turbulence/?utm_source=coingecko&utm_content=coingecko&utm_campaign=coingecko&utm_medium=coingecko&utm_term=coingecko
XRP,CryptoCurrency,WisdomTree files for XRP ETF in Delaware,38,6,2024-11-25 19:14:57,https://cointelegraph.com/news/wisdomtree-files-xrp-etf-delaware
XRP,CryptoCurrency,Ripple launches first tokenized money market fund on XRP ledger through UK partnership,47,13,2024-11-26 12:52:00,https://cryptoslate.com/ripple-launches-first-tokenized-money-market-fund-on-xrp-ledger-through-uk-partnership/
XRP,CryptoCurrency,I hope people can see whats happening with US based cryptos and Bitcoin,1164,558,2024-11-29 21:11:55,https://www.reddit.com/r/CryptoCurrency/comments/1h2vzcp/i_hope_people_can_see_whats_happening_with_us/
XRP,CryptoCurrency,XRP Price Hits 3-Year High At $1.6 - 2 Ways It Can Go From Here,32,37,2024-11-25 08:16:21,https://www.newsbtc.com/news/xrp-price-reaches-3-year-high-at-1-6-2-ways-it-can-go-from-here/
XRP,CryptoCurrency,XRP Price Spikes to 3-Year High as Optimism Surges Over SEC Shakeup,73,19,2024-11-23 20:02:17,https://decrypt.co/293259/xrp-price-3-year-high-sec-shakeup
XRP,CryptoCurrency,Will XRP Pull a 2017-Like Rally and Hit $5 Amid Open Interest Hitting All-Time High?,111,62,2024-11-23 22:23:16,https://zycrypto.com/will-xrp-pull-a-2017-like-rally-and-hit-5-amid-open-interest-hitting-all-time-high/
XRP,CryptoCurrency,XRP jumps 25% as SEC may not pursue appeal after Gensler's departure,246,52,2024-11-22 10:00:34,https://cryptobriefing.com/xrp-legal-shift-sec-appeal/
XRP,CryptoCurrency,"Altcoins Shine as Crypto Economy Hits $3.29T: OM, XLM, ADA and XRP Drive the Frenzy",82,42,2024-11-22 19:45:23,https://news.bitcoin.com/altcoins-shine-as-crypto-economy-hits-3-29t-om-xlm-ada-and-xrp-drive-the-frenzy/
XRP,CryptoCurrency,"I bought $1k of the Top 10 Cryptos on January 1st, 2022 (OCTOBER Update/Month 34/-44%)",1074,136,2024-11-26 14:04:12,https://www.reddit.com/r/CryptoCurrency/comments/1h0cm5p/i_bought_1k_of_the_top_10_cryptos_on_january_1st/
XRP,CryptoCurrency,Possible Collaboration of XRP & ADA?,49,47,2024-11-19 11:34:42,https://www.reddit.com/r/CryptoCurrency/comments/1guv3q9/possible_collaboration_of_xrp_ada/
XRP,CryptoCurrency,XRP On Fire: 90% Weekly Growth Lifts Coin To Fresh 2-Year High,45,16,2024-11-19 12:51:35,https://www.newsbtc.com/news/xrp-on-fire-over-90-weekly-growth-catapults-altcoin-to-fresh-2-year-high/
XRP,CryptoCurrency,My personal 2017 crypto notes,10,37,2024-11-23 15:06:43,https://www.reddit.com/r/CryptoCurrency/comments/1gy1n2h/my_personal_2017_crypto_notes/
XRP,CryptoCurrency,"XRP Price Sails Over 119% In A Week, Is The Next Target At $2?",170,51,2024-11-18 10:44:18,https://blockzeit.com/xrp-price-sails-over-119-in-a-week-is-the-next-target-at-2/
XRP,CryptoCurrency,XRP Surpasses $1 Mark After Over 1000 Days,936,278,2024-11-16 10:33:16,https://www.binance.com/en/square/post/11-16-2024-xrp-surpasses-1-mark-after-over-1000-days-16312737226649
XRP,CryptoCurrency,"Cardano's Hoskinson Apologizes to XRP Community, Calls for Industry Unity",238,85,2024-11-16 21:46:58,https://zycrypto.com/cardanos-hoskinson-apologizes-to-xrp-community-calls-for-industry-unity/
XRP,CryptoCurrency,"Robinhood Crypto Expands Offering with Solana (SOL), Pepe (PEPE), Cardano (ADA) & XRP (XRP) for U.S. Customers",102,40,2024-11-13 14:25:46,https://newsroom.aboutrobinhood.com/robinhood-crypto-expands-offering-with-solana-sol-pepe-pepe-cardano-ada-amp-xrp-xrp-for-u-s-customers/
XRP,CryptoCurrency,Are the ISO 20022 coins pumping? ,25,42,2024-11-18 13:30:12,https://www.binance.com/en/square/post/5269189407018
XRP,CryptoCurrency,Eventually everything will run through the Chainlink ecosystem,14,55,2024-11-20 23:24:15,https://www.reddit.com/r/CryptoCurrency/comments/1gw1ocs/eventually_everything_will_run_through_the/
XRP,CryptoCurrency,"The ultimate crypto DCA strategy:  I analyzed 40,000+ cryptocurrencies over the past 10 years to create an optimal DCA strategy for the crypto market",203,43,2024-11-22 11:51:51,https://www.reddit.com/r/CryptoCurrency/comments/1gx62ay/the_ultimate_crypto_dca_strategy_i_analyzed_40000/
XRP,CryptoCurrency,"Tax-Free Crypto in U.S : Donald Trump’s Plan to Eliminate Tax for XRP, ADA, and More",209,97,2024-11-15 01:50:56,https://www.binance.com/en/square/post/16222711110898
XRP,CryptoCurrency,[FRAUD ALERT] - CYBRO Total Scam ,12,4,2024-11-18 18:48:05,https://www.reddit.com/r/CryptoCurrency/comments/1guc6pr/fraud_alert_cybro_total_scam/
XRP,CryptoCurrency,Ripple's Price Explodes Above $0.7 as XRP Bull Run Takes Off,132,118,2024-11-12 21:41:30,https://cryptopotato.com/ripples-price-explodes-above-0-7-as-xrp-bull-run-takes-off/
XRP,CryptoCurrency,No Capital gains tax on US Crypto???,145,177,2024-11-17 05:59:25,https://www.reddit.com/r/CryptoCurrency/comments/1gt738y/no_capital_gains_tax_on_us_crypto/
XRP,CryptoCurrency,Profit is Profit Remember that,302,178,2024-11-16 01:16:53,https://www.reddit.com/r/CryptoCurrency/comments/1gsc15a/profit_is_profit_remember_that/
XRP,CryptoCurrency,"I bought $1k of the Top 10 Cryptos on January 1st, 2024 (OCT Update/Month 10/+11%)",426,66,2024-11-13 14:30:27,https://www.reddit.com/r/CryptoCurrency/comments/1gqe56f/i_bought_1k_of_the_top_10_cryptos_on_january_1st/
XRP,CryptoCurrency,Which coins will enter and leave the top ten this bull cycle? ,257,578,2024-11-11 20:52:43,https://www.reddit.com/r/CryptoCurrency/comments/1gp2v40/which_coins_will_enter_and_leave_the_top_ten_this/
XRP,CryptoCurrency,"WARNING: Crypto Scams are on the rise. Scammers can and do promote their projects through official market entities (Youtube, Instagram, etc...) or social engineering (Reddit Chats, Emails, Unsolicited Calls).",73,21,2024-11-11 18:07:40,https://www.reddit.com/r/CryptoCurrency/comments/1goyqnm/warning_crypto_scams_are_on_the_rise_scammers_can/
XRP,CryptoCurrency,21Shares Files for XRP ETF,178,82,2024-11-01 17:33:41,https://i.redd.it/1ktm38n5sbyd1.png
XRP,CryptoCurrency,Ripple co-founder Chris Larsen says he is donating $10 million in XRP to Kamala Harris. ,775,309,2024-10-21 17:41:47,https://i.redd.it/13zl9414c5wd1.jpeg
XRP,CryptoCurrency,$1k invested into the Top Ten Cryptos in January 2021 - Month 45 (UP +196%),163,54,2024-10-27 12:38:15,https://www.reddit.com/r/CryptoCurrency/comments/1gda0ke/1k_invested_into_the_top_ten_cryptos_in_january/
XRP,CryptoCurrency,Ripple cryptocurrency (XRP) jumps after company to win against SEC for its security status,103,80,2024-10-21 07:57:43,https://tradebrains.in/ripple-cryptocurrency-xrp-jumps-after-company-to-win-against-sec-for-its-security-status/
XRP,CryptoCurrency,Bitwise Sends Second Filing to SEC For Ripple’s XRP ETF,23,5,2024-10-17 09:54:39,https://www.cryptonewsz.com/bitwise-second-filing-sec-for-ripple-xrp-etf/
XRP,CryptoCurrency,Ripple CEO Slams SEC for Ignoring Court Ruling on XRP,15,4,2024-10-15 10:02:42,https://coinpaprika.com/news/ripple-ceo-slams-sec-for-ignoring-court-ruling-on-xrp/
XRP,CryptoCurrency,Ripple co-founder donates $1 million XRP to Kamala Harris campaign PAC,293,131,2024-10-11 20:21:32,https://cryptobriefing.com/ripple-larsen-xrp-donation/
XRP,CryptoCurrency,"I bought $1k of the Top 10 Cryptos on January 1st, 2024 (SEP Update/Month 9/+8%)",99,50,2024-10-17 14:12:30,https://www.reddit.com/r/CryptoCurrency/comments/1g5rtp8/i_bought_1k_of_the_top_10_cryptos_on_january_1st/
XRP,CryptoCurrency,Bitwise has filed an XRP ETF,29,41,2024-10-01 20:38:30,https://cointelegraph.com/news/bitwise-files-xrp-etf
XRP,CryptoCurrency,"SEC’s Ripple Appeal Doesn’t Target XRP Secondary Sales, Clarifies Attorney: Guest Post by Coin Edition | CoinMarketCap",13,5,2024-10-03 22:14:24,https://coinmarketcap.com/community/articles/66ff0b9be7789c03df42b9a2/
XRP,CryptoCurrency,Open Interest in XRP Zooms to $1B as Ripple Tests RLUSD Stablecoin,2,7,2024-10-02 04:13:28,https://www.coindesk.com/markets/2024/10/01/open-interest-in-xrp-zooms-to-1b-as-ripple-tests-rlusd-stablecoin/?utm_content=editorial&utm_medium=social&utm_source=twitter&utm_campaign=coindesk_main&utm_term=organic
XRP,CryptoCurrency,Are FET and POL Worth holding? Are altcoins worth it at all anymore?,3,124,2024-10-04 18:24:26,https://www.reddit.com/r/CryptoCurrency/comments/1fw63mx/are_fet_and_pol_worth_holding_are_altcoins_worth/
XRP,CryptoCurrency,Mcap per node: valid valuation/decentralization measure?,2,5,2024-10-03 15:25:48,https://www.reddit.com/r/CryptoCurrency/comments/1fvaeyl/mcap_per_node_valid_valuationdecentralization/
XRP,CryptoCurrency,Supreme Court of India YouTube channel hijacked to shill XRP,28,18,2024-09-20 09:31:10,https://cointelegraph.com/news/supreme-court-india-youtube-hacked-ripple-xrp-scam
XRP,CryptoCurrency,XRP Spikes 8% as Grayscale Launches XRP Trust in the U.S.,89,45,2024-09-12 13:28:58,https://www.coindesk.com/markets/2024/09/12/xrp-spikes-8-as-grayscale-launches-xrp-trust-in-the-us/
XRP,CryptoCurrency,Grayscale rolls out XRP trust in the US,40,56,2024-09-12 13:42:24,https://cryptobriefing.com/grayscale-xrp-trust-launch/
XRP,CryptoCurrency,"$1k invested into the Top 10 Cryptos on January 1st, 2020 Up +617% (AUG Update - Month 56)",112,76,2024-09-18 11:39:38,https://www.reddit.com/r/CryptoCurrency/comments/1fjqnhe/1k_invested_into_the_top_10_cryptos_on_january/
XRP,CryptoCurrency,"I bought $1k of the Top 10 Cryptos on January 1st, 2024 (AUG Update/Month 8/-5%)",214,121,2024-09-11 11:18:24,https://www.reddit.com/r/CryptoCurrency/comments/1fe7m5t/i_bought_1k_of_the_top_10_cryptos_on_january_1st/
XRP,CryptoCurrency,"$1k into the Top 10 Cryptos on January 1st, 2019 (JULY Update/Month 67) +470%",74,25,2024-08-27 14:04:43,https://www.reddit.com/r/CryptoCurrency/comments/1f2hwdd/1k_into_the_top_10_cryptos_on_january_1st_2019/
XRP,CryptoCurrency,Crypto Pundit Slams XRP As The 'Biggest Scam In Crypto' ,69,117,2024-08-18 18:19:13,https://bitcoinist.com/crypto-pundit-slams-xrp-as-the-biggest-scam-in-crypto/
XRP,CryptoCurrency,"I bought $1k of the Top 10 Cryptos on January 1st, 2024 (JULY Update/Month 7/+10%)",198,50,2024-08-19 13:17:58,https://www.reddit.com/r/CryptoCurrency/comments/1ew1ke2/i_bought_1k_of_the_top_10_cryptos_on_january_1st/
XRP,CryptoCurrency,Ripple’s $125M Fine Confirmed—How Will XRP React?,33,66,2024-08-10 11:19:29,https://cryptonewsland.com/ripples-125m-fine-confirmed-how-will-xrp-react/
XRP,CryptoCurrency,Which of the following altcoins you would be least interested in holding?,55,285,2024-08-12 15:27:23,https://www.reddit.com/r/CryptoCurrency/comments/1eqgoix/which_of_the_following_altcoins_you_would_be/
XRP,CryptoCurrency,Judge Rules XRP Transactions Are Not Securities,135,68,2024-08-07 21:08:44,https://en.coin-turk.com/judge-rules-xrp-transactions-are-not-securities/?utm_source=coingecko&utm_content=coingecko&utm_campaign=coingecko&utm_medium=coingecko&utm_term=coingecko
XRP,CryptoCurrency,Can closing your eyes and investing in top 5 cryptos by market cap work?,7,59,2024-08-12 19:50:34,https://www.reddit.com/r/CryptoCurrency/comments/1eqnfqg/can_closing_your_eyes_and_investing_in_top_5/
XRP,CryptoCurrency,SEC vs Ripple case ends: Ripple must pay 125 million dollars,684,321,2024-08-07 20:11:06,https://www.reddit.com/r/CryptoCurrency/comments/1emm0vg/sec_vs_ripple_case_ends_ripple_must_pay_125/
XRP,CryptoCurrency,Ripple to Allocate $10M to Tokenized U.S. Treasury Bills on XRP Ledger.,16,8,2024-08-01 10:55:51,https://www.coindesk.com/business/2024/08/01/ripple-to-allocate-10m-to-tokenized-us-treasury-bills-on-xrp-ledger/?utm_content=editorial&utm_medium=social&utm_source=telegram&utm_term=organic&utm_campaign=news
XRP,CryptoCurrency,"XRP Surges 7% Amid Ripple-SEC Settlement Hopes, $600M Token Unlock.",18,19,2024-07-31 08:22:36,https://www.coindesk.com/markets/2024/07/31/xrp-surges-7-amid-ripple-sec-settlement-hopes-600m-token-unlock/?utm_content=editorial&utm_medium=social&utm_source=telegram&utm_term=organic&utm_campaign=news
XRP,CryptoCurrency,"2025 Bull Run: Analyst Predicts Bitcoin at $250K, Ethereum at $15K",247,249,2024-08-01 17:38:23,https://www.banklesstimes.com/news/2024/08/01/2025-bull-run-analyst-predicts-bitcoin-at-250k-ethereum-at-15k/
XRP,CryptoCurrency,"OG Experiment Update: I bought $1k of the Top 10 Cryptos on January 1st, 2018 (JUNE 2024 Update/Month 78 +12%)",83,36,2024-07-22 13:28:34,https://www.reddit.com/r/CryptoCurrency/comments/1e9eb8g/og_experiment_update_i_bought_1k_of_the_top_10/
XRP,CryptoCurrency,"I bought $1k of the Top 10 Cryptos on January 1st, 2024 (JUNE Update/Month 6/+11%)",119,48,2024-07-11 21:56:40,https://www.reddit.com/r/CryptoCurrency/comments/1e10vpj/i_bought_1k_of_the_top_10_cryptos_on_january_1st/
XRP,CryptoCurrency,"32,000 XRP Stolen, advice welcome",29,61,2024-06-30 23:55:31,https://www.reddit.com/r/CryptoCurrency/comments/1dsf8dh/32000_xrp_stolen_advice_welcome/
XRP,CryptoCurrency,Convince me that Ripple (XRP) is not a Ponzi Scheme…,312,589,2024-07-01 07:08:59,https://www.reddit.com/r/CryptoCurrency/comments/1dsms08/convince_me_that_ripple_xrp_is_not_a_ponzi_scheme/
XRP,CryptoCurrency,XRP bros….it’s over,284,627,2024-06-26 03:43:33,https://www.reddit.com/r/CryptoCurrency/comments/1dop6n5/xrp_brosits_over/
XRP,CryptoCurrency,Utility Tokens/ASAs.,10,15,2024-06-28 19:50:08,https://www.reddit.com/r/CryptoCurrency/comments/1dqsivo/utility_tokensasas/
XRP,CryptoCurrency,XRP News Today: Ripple Wins in Court But Security Question Remains | FXEmpire,10,9,2024-06-22 10:59:47,https://www.fxempire.com/forecasts/article/xrp-news-today-ripple-wins-in-court-but-security-question-remains-1440478
XRP,CryptoCurrency,"I bought $1k of the Top 10 Cryptos on January 1st, 2023 (MAY Update/Month 17/+101%)",118,37,2024-06-20 13:19:23,https://www.reddit.com/r/CryptoCurrency/comments/1dkbg57/i_bought_1k_of_the_top_10_cryptos_on_january_1st/
XRP,CryptoCurrency,"I bought $1k of the Top 10 Cryptos on January 1st, 2024 (MAY Update/Month 5/+24%)",259,99,2024-06-14 13:40:47,https://www.reddit.com/r/CryptoCurrency/comments/1dfr3tz/i_bought_1k_of_the_top_10_cryptos_on_january_1st/
XRP,CryptoCurrency,"‘A Very Big Opportunity’—Crypto Suddenly Braced For A ‘Tremendous’ China Earthquake After Bitcoin, Ethereum And XRP Price Boom",169,77,2024-06-08 20:15:04,https://www.forbes.com/sites/digital-assets/2024/06/08/a-very-big-opportunity-crypto-suddenly-braced-for-a-tremendous-china-earthquake-after-bitcoin-ethereum-and-xrp-price-boom/
XRP,CryptoCurrency,"I bought $1k of the Top 10 Cryptos on January 1st, 2024 (MAY Update/Month 5/+24%)",26,14,2024-06-13 12:57:06,https://www.reddit.com/r/CryptoCurrency/comments/1deycd9/i_bought_1k_of_the_top_10_cryptos_on_january_1st/
XRP,CryptoCurrency,"After trading in this market for over a decade, I'm beginning to be open minded to the idea that there's beginning to be early signs of what could be dubbed as the ""blue chips"" of crypto.",48,223,2024-06-01 18:32:30,https://www.reddit.com/r/CryptoCurrency/comments/1d5tj0k/after_trading_in_this_market_for_over_a_decade_im/
XRP,CryptoCurrency,Polkadot ETF Is Next According to Analyst Who Predicts DOT ETF Over SOL and XRP ETFs,125,126,2024-05-25 17:25:10,https://cryptonewsland.com/polkadot-etf-is-next-according-to-analyst-who-predicts-dot-etf-over-sol-and-xrp-etfs-will-dot-price-hit-100-this-cycle/
XRP,CryptoCurrency,Coinbase resumes XRP trading in New York,73,11,2024-05-23 14:49:53,https://cryptobriefing.com/coinbase-resumes-xrp-trading-ny/
XRP,CryptoCurrency,"[OC] - I bought $1k of the Top 10 Cryptos on January 1st, 2022 (APRIL Update/Month 28/-46%)",46,26,2024-05-24 10:07:32,https://www.reddit.com/r/CryptoCurrency/comments/1czh9mt/oc_i_bought_1k_of_the_top_10_cryptos_on_january/
XRP,CryptoCurrency,I lost 650k from last bull run.,1031,767,2024-05-20 02:54:07,https://www.reddit.com/r/CryptoCurrency/comments/1cw5gpv/i_lost_650k_from_last_bull_run/
XRP,CryptoCurrency,"Former CEO of MicroStrategy, Michael Saylor, believes that the SEC will classify Ethereum as a security this summer and reject the corresponding applications for spot ETFs. In his opinion, only BTC has full institutional recognition, calling it the “only universal” institutional-level crypto asset",300,266,2024-05-17 08:19:38,https://www.reddit.com/r/CryptoCurrency/comments/1cu03ak/former_ceo_of_microstrategy_michael_saylor/
XRP,CryptoCurrency,"Visa, Mastercard, JPMorgan And Citi Reveal Game-Changing Crypto Plan For ‘Mass Institutional Adoption’ After Bitcoin, Ethereum And XRP Price Pump",334,218,2024-05-12 16:39:56,https://www.forbes.com/sites/digital-assets/2024/05/11/visa-mastercard-jpmorgan-and-citi-reveal-game-changing-crypto-plan-for-mass-institutional-adoption-after-bitcoin-ethereum-and-xrp-price-pump/
XRP,CryptoCurrency,Question on Strike and using lightning rails for fiat transfers,7,3,2024-05-15 08:36:33,https://www.reddit.com/r/CryptoCurrency/comments/1csfx9r/question_on_strike_and_using_lightning_rails_for/
XRP,CryptoCurrency,"I bought $1k of the Top 10 Cryptos on January 1st, 2024 (APRIL Update/Month 4/+10%)",129,19,2024-05-15 14:29:29,https://www.reddit.com/r/CryptoCurrency/comments/1csm7a2/i_bought_1k_of_the_top_10_cryptos_on_january_1st/
XRP,CryptoCurrency,Dogecoin Outpaces XRP and ADA in Wallet Growth Over Six Months,73,85,2024-05-04 17:45:26,https://cryptotale.org/dogecoin-outpaces-xrp-and-ada-in-wallet-growth-over-six-months/
XRP,CryptoCurrency,XRP and institutional sales.... can some explain how that works considering the SEC lawsuit?,6,24,2024-05-04 04:47:06,https://www.reddit.com/r/CryptoCurrency/comments/1cjs8ty/xrp_and_institutional_sales_can_some_explain_how/
XRP,CryptoCurrency,XRP's $0.60 Price Target Faces an Uphill Battle Against Whales Pouring XRP to CEXs,3,19,2024-05-02 19:30:35,https://dailycoin.com/is-xrps-0-60-target-in-jeopardy-here-are-key-signs-to-watch/
XRP,CryptoCurrency,$1k invested into the Top Ten Cryptos in January 2021 - Month 39 (UP +250%),189,50,2024-04-26 13:21:30,https://www.reddit.com/r/CryptoCurrency/comments/1cdl9v1/1k_invested_into_the_top_ten_cryptos_in_january/
XRP,CryptoCurrency,Has anyone looked at the Grayscale Trusts recently? They are wild,51,39,2024-04-24 09:20:42,https://www.reddit.com/r/CryptoCurrency/comments/1cbtsh2/has_anyone_looked_at_the_grayscale_trusts/
XRP,CryptoCurrency,"I bought $1k of the Top 10 Cryptos on January 1st, 2024 (MARCH Update/Month 3/+42%)",287,93,2024-04-19 15:18:06,https://www.reddit.com/r/CryptoCurrency/comments/1c7zg65/i_bought_1k_of_the_top_10_cryptos_on_january_1st/
XRP,CryptoCurrency,"“no harm, no foul” approach",5,6,2024-04-16 15:26:41,https://www.reddit.com/r/CryptoCurrency/comments/1c5iw8i/no_harm_no_foul_approach/
XRP,CryptoCurrency,BE CAREFUL - There's a scam XRP live stream on YouTube,3,22,2024-04-10 12:09:16,https://www.reddit.com/r/CryptoCurrency/comments/1c0jzzl/be_careful_theres_a_scam_xrp_live_stream_on/
XRP,CryptoCurrency,Thoughts on Litecoin?,191,305,2024-04-10 21:50:21,https://www.reddit.com/r/CryptoCurrency/comments/1c0xo97/thoughts_on_litecoin/
XRP,CryptoCurrency,Ripple to launch USD backed stable coin on xrpl and eth,127,80,2024-04-04 13:15:12,https://x.com/ripple/status/1775873224531665051?s=46&t=L01IcsEEBzl6pulAVaJjiA
XRP,CryptoCurrency,Now is the perfect time to buy altcoins,270,276,2024-03-26 14:24:26,https://www.reddit.com/r/CryptoCurrency/comments/1bo96co/now_is_the_perfect_time_to_buy_altcoins/
XRP,CryptoCurrency,Selling my crypto in Canada and looking for help,1,26,2024-03-19 12:56:52,https://www.reddit.com/r/CryptoCurrency/comments/1bijlbd/selling_my_crypto_in_canada_and_looking_for_help/
XRP,CryptoCurrency,"$1k invested into the Top 10 Cryptos on January 1st, 2020 Up +658% (FEB Update - Month 50)",157,40,2024-03-18 04:44:23,https://www.reddit.com/r/CryptoCurrency/comments/1bhijuc/1k_invested_into_the_top_10_cryptos_on_january/
XRP,CryptoCurrency,Thinking about swapping my XRP for Bitcoin… at a loss,427,683,2024-03-10 15:18:48,https://www.reddit.com/r/CryptoCurrency/comments/1bbcq1f/thinking_about_swapping_my_xrp_for_bitcoin_at_a/
XRP,CryptoCurrency,"What is ""Ripple""? (Satoshi emails)",46,38,2024-03-13 01:37:38,https://www.reddit.com/r/CryptoCurrency/comments/1bdf23t/what_is_ripple_satoshi_emails/
XRP,CryptoCurrency,Advice on alt coins holdings,5,28,2024-03-12 23:58:48,https://www.reddit.com/r/CryptoCurrency/comments/1bdcuk4/advice_on_alt_coins_holdings/
XRP,CryptoCurrency,"I bought $1k of the Top 10 Cryptos on January 1st, 2024 (FEB Update/Month 2/+21%)",522,92,2024-03-08 14:35:28,https://www.reddit.com/r/CryptoCurrency/comments/1b9pf9m/i_bought_1k_of_the_top_10_cryptos_on_january_1st/
XRP,CryptoCurrency,Selling XRP from trust wallet to literally anything else,13,16,2024-03-02 06:46:19,https://www.reddit.com/r/CryptoCurrency/comments/1b4hvlt/selling_xrp_from_trust_wallet_to_literally/
XRP,CryptoCurrency,"Fidelity Suddenly Issues Huge $1.5 Trillion Prediction As ‘Parabolic’ Bitcoin Price Surge Boosts Ethereum, XRP And Crypto",787,227,2024-02-27 01:01:12,https://www.forbes.com/sites/digital-assets/2024/02/26/fidelity-suddenly-issues-huge-15-trillion-prediction-as-parabolic-bitcoin-price-surge-boosts-ethereum-xrp-and-crypto/?sh=7611280519b5
XRP,CryptoCurrency,"In case you still haven't realized, the ALT season officially started today, and now everyone can feel like a genius investor.",935,691,2024-03-01 23:36:05,https://www.reddit.com/r/CryptoCurrency/comments/1b49ade/in_case_you_still_havent_realized_the_alt_season/
XRP,CryptoCurrency,Projects with over 95% already in circulating supply,143,216,2024-02-28 01:53:51,https://www.reddit.com/r/CryptoCurrency/comments/1b1tvmi/projects_with_over_95_already_in_circulating/
XRP,CryptoCurrency,"$1k into the Top 10 Cryptos on January 1st, 2019 (JAN Update/Month 61) +320%",174,42,2024-02-26 13:02:47,https://www.reddit.com/r/CryptoCurrency/comments/1b0gzet/1k_into_the_top_10_cryptos_on_january_1st_2019/
XRP,CryptoCurrency,XRP Holders Demand Answers for Depressing Price Performance,180,249,2024-02-12 10:54:30,https://dailycoin.com/xrp-holders-demand-answers-for-depressing-price-performance/
XRP,CryptoCurrency,"Even though the market is mostly in the green, which coins aren’t seeing the upward traction they’ve historically had?",110,355,2024-02-15 18:17:38,https://www.reddit.com/r/CryptoCurrency/comments/1arm3wm/even_though_the_market_is_mostly_in_the_green/
XRP,CryptoCurrency,"I bought $1k of the Top 10 Cryptos on January 1st, 2024 (JAN Update/Month 1/-14%)",443,75,2024-02-16 13:15:04,https://www.reddit.com/r/CryptoCurrency/comments/1as8bbf/i_bought_1k_of_the_top_10_cryptos_on_january_1st/
XRP,CryptoCurrency,Ripple Hack Investigation: Blockchain Analyst Hacken Uncovers Potential Insider Link in Co-Founder Chris Larsen’s XRP Breach,31,27,2024-02-09 08:58:48,https://dailycoin.com/ripples-co-founder-xrp-hack-shows-internal-links-ripple/
XRP,CryptoCurrency,"Is crypto eating Legacy or is Legacy eating crypto? This is something cryptocurrency Reddit can’t understand because the only metric that matters is number go up. ~10 entities: 3 major CEXs, 3 major ETF funds and 3 major asset-backed stablecoin entities rule all crypto. A warning-shot essay!",45,73,2024-02-13 11:07:16,https://www.reddit.com/r/CryptoCurrency/comments/1apqxyw/is_crypto_eating_legacy_or_is_legacy_eating/
XRP,CryptoCurrency,Buying is Easy. Selling is the Hard Part.,484,233,2024-02-13 07:09:35,https://www.reddit.com/r/CryptoCurrency/comments/1apnla0/buying_is_easy_selling_is_the_hard_part/
XRP,CryptoCurrency,I'm in WA State. How can I move all my old coins?,21,37,2024-02-06 19:26:03,https://www.reddit.com/r/CryptoCurrency/comments/1aki538/im_in_wa_state_how_can_i_move_all_my_old_coins/
