title,date,description
BlockDAG affiliate program introduces 5% USDT rewards,2025-01-31 17:00:00,"Shiba Inu sees increased accumulation, Litecoin whale activity rises, and BlockDAG unveils a 5% USDT reward program. #pressrelease"
Meme coin hype fades as experts back this crypto to outpace both DOGE and SHIB,2025-01-28 15:00:00,"Meme coin hype fades as Dogecoin and Shiba Inu slow. Investors shift focus to Remittix, a promising new DeFi project. #partnercontent"
SHIB consolidates while PropiChain prepares for a boom in Q1 2025,2025-01-27 06:43:00,"Shiba Inu price consolidates as PropiChain gears up for a 50,000% ROI by 2025, offering smart tools and real-world utility for savvy investors. #partnercontent"
"Analysts predict 8,350% gains for this untapped meme token",2025-01-26 16:52:00,"The meme coin market is heating up with BeerBear, a token predicted to surge 8,350%, rivaling Shiba Inu’s legendary growth. #partnercontent"
"1Fuel hits $1.5m in presale, steals spotlight from SHIB",2025-01-24 18:27:00,"Shiba Inu shows signs of a potential bull run, but the spotlight shifts to 1Fuel after its record-breaking $1.5m presale success. #partnercontent"
Experts predict SHIB’s surge while this crypto promises huge gains,2025-01-24 18:02:00,"Shiba Inu’s potential $0.001 surge meets WallitIQ’s bold 75,000% gain predictions as investors explore the next big crypto opportunities for Q1 2025. #partnercontent"
SHIB & PEPE could storm ahead of DOGE: 1Fuel pre-release turns heads,2025-01-23 22:25:00,1Fuel’s pre-release is turning heads as Shiba Inu and Pepe look to storm ahead of Dogecoin. #partnercontent
"Cryptos set for price surge: SUI, RBLK, AVAX, SHIB",2025-01-22 22:38:00,"Sui (SUI), Rollblock (RBLK), Avalanche (AVAX), and Shiba Inu (SHIB) listed as cryptos set for notable price surges. #partnercontent"
Yeti Ouro predicted by experts to surpass $1; SHIB aims to catch up,2025-01-22 12:02:00,"As 2025 unfolds, analysts are tipping Yeti Ouro as a breakout star, with predictions that it could hit $1 before established meme coins like Shiba Inu or Dogecoin. #partnercontent"
SHIB shows strength over Trump Coin while 1Fuel storms $1.4m mark,2025-01-22 11:24:00,"As meme coins like Shiba Inu and Trump Coin face volatility, 1Fuel emerges as a leading crypto presale with strong growth potential. #partnercontent"
"TRUMP Coin surges to $13b; Why SHIB, YETIO could be the next big movers",2025-01-21 12:33:00,"Meme coins like Shiba Inu, TRUMP Coin, and Yeti Ouro are gaining traction, driving renewed interest and competition in the crypto market. #partnercontent"
$1 sooner than expected: These 2 crypto coins are racing past Dogecoin in Q1 2025,2025-01-19 19:53:00,"IntelMarkets and Shiba Inu lead the crypto buzz, with INTL’s 811% presale surge and $1 target by 2025. #partnercontent"
"XYZVerse aims to outpace DOGE and SHIB with 15,000% growth",2025-01-17 15:33:00,"XYZVerse eyes a 15,000% surge by 2025, with potential to outpace Dogecoin and Shiba Inu, drawing investor attention. #partnercontent"
"AI picks 3 cryptos to outperform SHIB, SOL in 2025: XLM, AVAX, and RBLK",2025-01-16 08:38:00,"AI predicts Rollblock, along with Stellar and Avalanche, to outperform Shiba Inu and Solana in 2025, with RBLK tipped for a massive 50x surge. #partnercontent"
3 cryptos under $5 that could soar within a few months,2025-01-14 06:54:00,"With Bitcoin’s rise, three cryptos under $5, Rexas Finance, Shiba Inu, and Dogecoin, could turn a $50 investment into $5000 in the next five months. #partnercontent"
"DOGEN to leap from $0.0015 to $100, while SHIB targets $0.1 and Cardano aims for $5",2025-01-13 15:50:00,"Bold predictions are emerging as DOGEN, Shiba Inu, and Cardano target dramatic gains, with DOGEN set to soar 700% by presale’s end. #partnercontent"
"Investors move from SHIB, TON to new PropFi token with better projections",2025-01-13 11:14:00,Shiba Inu and Toncoin investors lean toward a new PropFi token for its better bullish projections in 2025. #pressrelease
"XYZVerse projects 58,000% ROI, DOGE eyes $0.50, SHIB burn rate explodes",2025-01-10 16:17:00,"A new crypto project eyes 58,000% gains as Dogecoin nears $0.50 and Shiba Inu burn rates soar. #partnercontent"
"Experts believe this new crypto will 50x the gains of SHIB, SOL, and XRP in 2025",2025-01-10 12:20:00,"Rollblock is set to transform the $500b GambleFi industry with blockchain transparency, outpacing Shiba Inu, Solana, and Ripple in 2025. #partnercontent"
"DOGE forecasts indicate 300% rally, WLTQ for 65,000% gains ahead of SHIB",2025-01-09 21:19:00,"While Dogecoin eyes a potential 300% rally, WallitIQ emerges with predictions of a 65,000% surge before Shiba Inu. #partnercontent"
"SHIB, PEPE to be replaced by this token, according to popular analyst",2025-01-09 14:40:00,"Rexas Finance emerges as the next big player, poised to outshine Shiba Inu and Pepe Coin with real-world utility and strong growth potential. #partnercontent"
"SHIB, DOGE investors shift their attention to Lightchain AI at $0.0048",2025-01-09 14:06:00,"Shiba Inu and Dogecoin step aside as investors flock to Lightchain AI, raising over $8.5m in its presale with tokens priced at just $0.0048. #sponsored"
"SHIB set to reach $0.00018 this January, why SHIB traders are also buying Lightchain AI",2025-01-08 17:19:00,"Shiba Inu eyes $0.00018 as traders flock to emerging projects like Lightchain AI, blending AI with blockchain tech. #partnercontent"
"Turning $500 into $10,000: $0.175 token could be better than SHIB",2025-01-07 21:48:00,"Rexas Finance emerges as a stronger contender than Shiba Inu for investors aiming to turn $500 into $10,000 this crypto cycle. #partnercontent"
"DOGE, SHIB investors flock to Dogen’s $0.0015 presale promising 30,000% returns",2025-01-07 11:17:00,"DOGEN emerges as the next meme coin sensation, with a $0.0015 presale and promises of 30,000% returns, captivating Dogecoin and Shiba Inu investors. #partnercontent"
"PEPE, SHIB trigger meme frenzy while DTX Exchange eyes 1,000% ROI potential",2025-01-07 08:29:00,"PEPE and Shiba Inu fuel meme coin mania, while DTX Exchange emerges as a utility-driven contender with 1,000% ROI potential and cutting-edge scalability. #partnercontent"
"5 cryptos to watch in 2025: XRP, ADA, RBLK, SHIB, and SOL",2025-01-06 04:49:00,"The crypto market is heating up for 2025, with Rollblock emerging as a standout contender poised for massive growth alongside major tokens like Ripple, Cardano, Shiba Inu, and Solana. #partnercontent"
"$1,090 invested in this crypto poised to replace SHIB, PEPE could grow into $1,090,000",2025-01-03 11:55:00,"Lightchain AI emerges as a promising alternative to Shiba Inu and PEPE, with analysts projecting a 1,000x return by 2026 for early investors. #partnercontent"
"Popular $0.07 altcoin shows similarity to SHIB before 13,000% rally",2025-01-03 01:03:00,"IntelMarkets, a promising AI-driven altcoin, mirrors Shiba Inu’s early price patterns, indicating potential for significant growth. #partnercontent"
"SHIB price forecast for 2025 and alternative to watch for 26,050% returns",2025-01-03 00:14:00,"Analysts predict Shiba Inu’s 234% surge and spotlight Rexas Finance’s massive 26,050% potential. #partnercontent"
"SHIB shows buy signal, analysts see upside for ETH and this low-cap coin",2024-12-31 22:00:00,"Shiba Inu’s TD indicator flashes a buy signal as analysts forecast significant growth for Ethereum and IntelMarkets, a promising low-cap coin. #partnercontent"
"DOGE hints at rally, whale movements seen for SHIB as Yeti Ouro dominates gaming market",2024-12-31 06:13:00,"Yeti Ouro emerges as a standout in the crypto space, blending gaming utility with deflationary mechanics, as Dogecoin and Shiba Inu regain market attention. #partnercontent"
"AVAX targets $75, SUI to overtake SHIB, Lunex Network is the next 10x coin",2024-12-31 01:55:00,Lunex Network emerges as the next 10x coin as Avalanche aims for $75 and Sui prepares to overtake Shiba Inu. #partnercontent
DOGE vs. SHIB vs. RBLK: AI predicts leading crypto investment heading into 2025,2024-12-28 19:06:00,"As 2025 nears, Rollblock’s GambleFi platform positions it to outpace Dogecoin and Shiba Inu in the anticipated crypto bull run. #partnercontent"
Meme coins on the rise: Dogen at $0.0013 joins the race to $1 with DOGE and SHIB,2024-12-28 17:07:00,"A $0.0013 meme coin rises, joining Dogecoin and Shiba Inu in the bold race toward the coveted $1 milestone. #partnercontent"
4 altcoins that will ride Bitcoin’s next surge and turn $500 into $5000 with a 10x rally,2024-12-24 16:20:00,"Rexas Finance leads the charge in real-world asset tokenization, alongside Shiba Inu, Binance Coin, and Tron, as altcoins poised for exponential growth in the next Bitcoin rally. #partnercontent"
DOGE & SHIB holders embrace Lightchain AI for its growth and unique sports-crypto vision,2024-12-22 18:53:00,"Dogecoin and Shiba Inu investors are flocking to Lightchain AI, a game-changing sports-crypto project with real-world utility. #partnercontent"
"Why SHIB Holders are eyeing Catzilla’s 15,000% growth potential",2024-12-21 18:11:00,"Shiba Inu holders are eyeing Catzilla, a rising crypto with 15,000% potential, sparking interest in its unique growth appeal. #partnercontent"
Next SHIB: Investors bet big on CATZILLA as presale exceeds expectations,2024-12-20 21:20:00,Catzilla’s presale success positions it as the next Shiba Inu. #partnercontent
"Analysts forecast surge for SHIB, XRP amid downturn, but this new coin has risen 700%",2024-12-20 13:09:00,"Analysts predict price surges for Shiba Inu and Ripple despite the market downturn, while a new coin delivers an impressive 700% rise. #partnercontent"
"AI foresees this viral crypto to outshine XRP, SHIB in 2025",2024-12-20 09:00:00,"AI predicts Rollblock to outshine XRP and Shiba Inu with an 880% surge by 2025, driven by its viral GameFi protocol. #partnercontent"
"SHIB moon-bound, as whales accumulate 10x coin alongside ETH, new ATH imminent",2024-12-19 09:47:00,Shiba Inu prepares for a moonshot as whales stockpile a 10x coin alongside Ethereum. #partnercontent
AI forecasts new viral altcoin could create more millionaires than SHIB and PEPE,2024-12-18 08:41:00,"AI identifies Rollblock as the next 100x altcoin, rivaling Shiba Inu and Pepe’s explosive gains. #partnercontent"
"This new token could outperform SHIB and DOGE with a 12,000% surge",2024-12-13 19:55:00,"A new crypto token predicts a 12,000% surge, aiming to outshine Shiba Inu and Dogecoin, sparking investor excitement. #partnercontent"
Analyst sees potential for SHIB as new altcoin and XRP show bullish indicators,2024-12-13 19:45:00,Crypto analyst Astekz sees a bright future for Shiba Inu (SHIB) as DTX Exchange (DTX) and Ripple (XRP) show bullish indicators. #partnercontent
Bluntz predicts breakout for SHIB as DTX and ETH ride bullish wave,2024-12-12 03:00:00,Analyst Bluntz predicts Shiba Inu (SHIB) will see a parabolic break as DTX Exchange (DTX) and Ethereum (ETH) ride the bullish wave. #partnercontent
"SHIB set to be replaced by Yeti Ouro and Floki, $1m raised in record time",2024-12-11 12:30:00,"Yeti Ouro emerges as a top contender, challenging Shiba Inu’s dominance with presale success and strong utility in gaming and DeFi. #partnercontent"
"Dogen presale soars 18,000% in early stages, poised to outperform DOGE and SHIB",2024-12-10 16:09:00,"Dogen’s presale skyrockets 18,000%, sparking speculation it could surpass Dogecoin and Shiba Inu. #partnercontent"
SHIB’s bullish signals rise; FXG could be the next big performer,2024-12-10 09:21:00,"Shiba Inu shows bullish signals, but could FXGuys outperform in 2024? Learn how this high-potential altcoin is gaining momentum among traders. #pressrelease"
SHIB and WIF hold strong as BlockDAG attracts Solana developers as next meme coin hub,2024-12-09 19:47:00,"Shiba Inu surges, WIF holds strong, and BlockDAG rises as a new hub for meme coin creation, rivaling Solana’s appeal. #partnercontent"
SHIB and PEPE investors shift attention to this rapidly growing altcoin,2024-12-06 22:11:00,"Shiba Inu (SHIB) and Pepe (PEPE) investors are pivoting to Lunex Network (LNEX), a quickly growing altcoin. #partnercontent"
"SHIB, BRETT lead the charge in market rally, new altcoin sparks a wave",2024-12-06 13:00:00,"Shiba Inu, Brett, and the new viral meme coin Yeti Ouro defy market trends, sparking investor interest with bullish momentum and unique innovations. #partnercontent"
"Analyst makes massive ETH forecast as investors stockpile SHIB, new altcoin",2024-12-02 11:00:00,"Investors are waiting for a surge in Ethereum price as Satoshi Flipper predicts it will come. Meanwhile, some are stocking up on Shiba Inu and a new exchange token. #partnercontent"
Leading meme coins to check out that are not Dogecoin,2024-12-02 07:50:00,"Meme coins like Cutoshi, Shiba Inu, and Brett are trading at undervalued levels, presenting high-growth opportunities this crypto season as they aim to replicate Dogecoin’s success. #sponsored"
SHIB & Bonk poised to race with XRP in 2025 as Lunex Network set to replicate BNB’s ICO,2024-12-01 14:42:00,"Investors eye Q1 2025 as Shiba Inu, Bonk, and XRP rival Lunex Network, poised to emulate BNB’s ICO success in the crypto market. #partnercontent"
Analyst confident of a SHIB surge to $0.0002 as DTX is set to give the meme coin a run,2024-11-30 17:00:00,"As Bitcoin slows, Shiba Inu eyes $0.0002, but experts predict DTX Exchange may surpass it with bigger gains. #partnercontent"
Crypto whales buy Toncoin and new altcoin sensation for double-digit returns,2024-11-30 12:59:00,"Shiba Inu aims for top 5 in crypto by 2029, with rising interest in Toncoin and Yeti Ouro signaling market shifts. #partnercontent"
Rollblock’s breakout year could rival SHIB’s dominance by 2025,2024-11-30 08:14:00,"Shiba Inu preps for a big 2025, but new GambleFi platform Rollblock may 100x this year, say experts. #partnercontent"
"SHIB could reach $1, but this $0.000667 token is set to outperform",2024-11-29 20:38:00,"While Shiba Inu (SHIB) eyes the $1 mark, XYZVerse (XYZ) is targeting a 14,900% surge from $0.000667. #partnercontent"
6 tokens that could turn $600 into $18000 in the next 60 days,2024-11-29 13:46:00,"Six altcoins, including Rexas Finance and Shiba Inu, could turn a $600 investment into $18,000 in just 60 days as the crypto market heats up. #partnercontent"
SHIB faces challenges as this “Dogecoin killer” captures market attention,2024-11-29 01:00:00,"Analysts say the Shiba Inu price rally may end up coming to nothing as a fierce competitor, WallitIQ, attempts a 7,500% price surge, drawing away investors. #partnercontent"
Why Catzilla could dethrone XRP and SHIB in 2025,2024-11-26 22:00:00,Catzilla set to challenge XRP and Shiba Inu with explosive growth potential and a mission to transform meme coins. #partnercontent
"SHIB shows bullish signs, investors focus on ADA, while a new altcoin gains traction",2024-11-26 09:19:00,"Shiba Inu’s 6000% burn rate surge, Cardano’s $1 rally, and Yeti Ouro’s P2E gaming buzz ignite fresh excitement in the crypto market. #partnercontent"
"Veteran investor who made $50M on SHIB backs this new token for 10,000% growth",2024-11-25 18:01:00,"Shiba Inu millionaire shifts focus to a new cryptocurrency predicted to surge 10,000%, signaling the next big market move. #partnercontent"
5 meme coins that could rival DOGE and SHIB with explosive gains,2024-11-24 18:54:00,"Dogecoin & Shiba Inu lead, but 5 rising meme coins show promise for massive growth and could be the next big sensation. #partnercontent"
This $0.0008 token is set to skyrocket past DOGE and SHIB by 2025,2024-11-22 15:34:00,"A new token priced at $0.0008 aims to outshine Dogecoin and Shiba Inu, offering investors a high-growth opportunity in the next bull run. #partnercontent"
"Musk’s audio sparks DOGE surge, SHIB soars as analysts spotlight this crypto",2024-11-22 07:22:00,"Elon Musk’s viral audio chat boosts Dogecoin, Shiba Inu surges on burn rate, while Lunex Network emerges as a potential DeFi breakout star. #partnercontent"
AI forecasts a crypto that could outpace DOGE and SHIB,2024-11-21 15:09:00,Learn how AI forecasts a new cryptocurrency that could outpace Dogecoin and Shiba Inu in the near future. Explore the reasons behind its potential. #partnercontent
New Solana meme coin looking to surpass SHIB and DOGE with massive rally,2024-11-19 20:18:00,DOGEN is positioning itself to surpass meme coin giants like Shiba Inu (SHIB) and Dogecoin (DOGE). #partnercontent
"XRP touches $1 for the first time since 2021, aims to compete with new projects",2024-11-19 14:52:00,"As Bitcoin hits new highs, meme coins like XRP and Shiba Inu surge, but a new contender, XYZVerse, is capturing attention as the first all-sport memecoin with massive growth potential. #partnercontent"
SHIB vs. CATZILLA: Why this newcomer could be the better alternative,2024-11-19 14:20:00,"A new meme coin contender, Catzilla, is making waves with unique features and strong community appeal, promising to rival giants like Shiba Inu in the crypto market. #partnercontent"
"BTC ETFs witness $400m dip, SHIB targets $0.0001, Yeti Ouro attracts investors",2024-11-19 13:27:00,"Bitcoin ETFs see $400m in outflows as investors turn cautious, while Shiba Inu gains momentum and new meme token Yeti Ouro attracts attention with a limited-time bonus. #partnercontent"
New crypto presale sees soaring interest from SHIB and DOGE holders,2024-11-19 10:18:00,"Shiba Inu and Dogecoin lead a meme coin resurgence, but investors eyeing the next 100x gains might find Rollblock’s GambleFi platform more promising. #partnercontent"
Turn missed DOGE and SHIB opportunities into wins with these 5 tokens,2024-11-16 09:15:00,The current bull market highlights five emerging tokens with significant growth potential after the rise of Dogecoin and Shiba Inu. #partnercontent
DTX Exchange achieves another milestone while SHIB crashes,2024-11-15 12:00:00,"DTX Exchange races past milestones as Shiba Inu investors join its presale, pushing funds above $7.6 million. #partnercontent"
SHIB whales add $150k for 1241% returns after AI-blockchain launch,2024-11-14 18:41:00,"Crypto bulls dominate as Bitcoin hits $81,600, sparking a surge in Solana, Shiba Inu, and IntelMarkets’ AI-driven platform. #partnercontent"
"SHIB targets $1, SOL eyes $600 as XRP rival aims for 5000% growth as markets surge",2024-11-14 16:33:00,"Speculation grows as Shiba Inu, Solana, and Ripple aim for new highs, while emerging XYZVerse targets a 20,000% surge for top returns. #partnercontent"
"Underrated crypto picks for 100x gains: SHIB, XRP, and this mystery DeFi altcoin",2024-11-14 08:34:00,"Shiba Inu, Ripple, and DTX Exchange are now among the most successful cryptos to invest in, as the market recovery indicates a bullish outcome in the coming days. #partnercontent"
SHIB targets $0.00003500 as ADA breaks out of consolidation to reclaim $0.60,2024-11-13 07:29:00,"Shiba Inu sets its sights on a $0.00003500 target, while Cardano breaks out of consolidation to reclaim $0.60. #partnercontent"
"SHIB braces to jump ahead of XRP, expert says this altcoin under $0.1 could 10x first",2024-11-11 14:25:00,"Analysts anticipate gains for Ripple and Shiba Inu, while DTX Exchange’s speed sparks bullish sentiment in DeFi markets. #partnercontent"
"Five leading SHIB alternatives set for 20,000% growth in next 4 months",2024-11-11 11:19:00,"Amid the bull market, top 5 Shiba Inu alternatives, including Rexas finance, are set for 20,000% growth in the next few months. #partnercontent"
XRP trends down while SHIB and Intel Markets lead weekly gains with 40% rally,2024-11-11 08:14:00,XRP plummets while Shiba Inu and Intel Markets soar. Discover what’s fueling their uptrends. #partnercontent
"BNB eyes breakout to $1,300, SHIB targets $0.000081, IntelMarkets aims for $0.1",2024-11-09 18:18:00,"US election impacts ripple through crypto: BNB aims for $1,300, Shiba Inu targets $0.000081, and IntelMarkets eyes $0.1. #partnercontent"
A look at how much 5 billion SHIBs be worth when SHIB hits $0.0001 this bull run,2024-11-09 17:23:00,"As Shiba Inu stabilizes, investors ponder how much 5 billion SHIB tokens will be worth if the price hits $0.0001 in 2024. #partnercontent"
"Bulls target for SHIB rise to $0.0001 as whales eye 25,000% rally in 3 weeks for WallitIQ",2024-11-09 13:07:00,"The crypto market is buzzing as bulls eye Shiba Inu gains, and whales anticipate a rally for WallitIQ, offering investor potential. #prtnercontent"
"Market hot after presidential election with SHIB, UNI soaring, a new presale coin up 300%",2024-11-08 10:59:00,"The crypto market is heating post-election, with Shiba Inu and Uniswap seeing price increases. Could the next big winner be a new presale star? #partnercontent"
"This new meme coin sells out stage 4 in record time, attracting DOGE and SHIB fans",2024-11-07 17:11:00,"New meme coin rises fast, closing its fourth presale phase swiftly, drawing Dogecoin and Shiba Inu fans’ attention. #partnercontent"
"Following SHIB’s success, XYZ coin could bring 19,900% gains: $1,000 could yield $200k",2024-11-07 11:44:00,"Following Shiba Inu’s success, XYZ Coin promises a 19,900% surge—turning a $1,000 investment into $200k in a community-driven sports and meme coin movement. #partnercontent"
This new altcoin touted ‘future of DeFi’ could clip SHIB and TON before 2026,2024-11-07 06:55:00,"As Toncoin and Shiba Inu struggle, Lunex Network gains traction with its DeFi features and promising 1,800% upside. #partnercontent"
"Analysts predict Ripple explosion to $7, 10x surge for SHIB and new exchange coin",2024-11-06 09:10:00,"Experts anticipate major gains for Ripple, with a potential surge to $7, alongside a forecasted 10x growth for Shiba Inu and a promising new AI coin. #partnercontent"
"With 15,500% surge, XYZVerse set to outshine Pepe, SHIB in the meme coin market",2024-11-04 15:00:00,"A new meme coin, XYZVerse, is making headlines with a staggering presale surge of over 15,000%, positioning it as a potential rival to popular tokens like Pepe and Shiba Inu. #partnercontent"
"Why DOGEN leads, beating 2024 predictions for DOGE and SHIB",2024-11-04 14:40:00,"A new cryptocurrency, DOGEN, is capturing investor interest with the potential to outperform established tokens like Dogecoin and Shiba Inu in the coming year. #partnercontent"
Top 3 meme coins set to leave Dogecoin and SHIB in the dust by 2025,2024-11-03 16:16:00,A new wave of meme coins is emerging to challenge Dogecoin and Shiba Inu; discover three contenders poised for 2025. #partnercontent
SHIB and XRP expected to surge by 2025—but is this coin could be the real winner,2024-11-02 13:52:00,"As the crypto market shifts, Shiba Inu and XRP attract attention, but under-the-radar XYZVerse aims for 20,000% growth. #partnercontent"
Best Ethereum altcoins this winter: SHIB goes head-to-head with $1.62M IntelMarkets,2024-11-02 13:24:00,"As the year ends, investors hope for a revival in Ethereum and Shiba Inu, eyeing IntelMarkets as a potential game-changer. #partnercontnt"
"For those who missed SHIB, SOL, trending coin under $0.10 like FXG could be a second chance",2024-11-01 17:30:00,"If investors missed out on Shiba Inu or Solana, FXG offers a second chance. Learn why this trending coin under $0.10 could be a top DeFi project. #pressrelease"
"DOGE set to spike on Trump win, with 1500% price explosions for SHIB, Lunex",2024-11-01 16:00:00,"Amid market volatility, Shiba Inu and Dogecoin remain strong, while Lunex Network is expected to soar 1,800% due to its smart features and tools. #partnercontent"
Meme coins shake up cryptocurrency investments as Gen Z seeks new financial paths,2024-10-31 14:51:00,"Meme coins like Dogecoin and Shiba Inu, born from internet culture, are gaining popularity and reshaping the crypto market landscape. #partnercontent"
ETH veteran who gained millions on SHIB predicts 100x growth for emerging meme token,2024-10-31 11:26:00,"An Ethereum investor who profited from Shiba Inu is now targeting the meme token Catzilla, predicting a potential 100x surge. #partnercontent"
AI token expected to overtake SHIB despite expected move to $0.00005,2024-10-30 07:14:00,Shiba Inu whales rush into the WallitIQ ecosystem as analysts speculate the AI token will surpass SHIB amid its ongoing presale. #sponsored
"Dogen presale explodes with a 28,000% increase, aiming to surpass SHIB and PEPE",2024-10-27 14:25:00,"A new meme coin is soaring with a 280-fold presale boost, positioning it to rival Shiba Inu and Pepe. #partnercontnt"
"DOGE analyst says this SHIB killer could yield 30,000% profits before year end",2024-10-25 16:23:00,"A top Dogecoin analyst predicts that ETFSwap could deliver a stunning 30,000% return before the year ends, positioning it as a potential “Shiba Inu killer” in the crypto market. #sponsored"
Investors look for the next SHIB; 4 cryptos gathering momentum,2024-10-25 14:47:00,"Investors are eyeing Rexas Finance, Fantom, NEIRO, and Pepe Coin as potential next Shiba Inu amid the upcoming crypto bull cycle. #partnercontent"
SHIB stays stable despite drop in activity; Underwater investors move to 5000x altcoin,2024-10-24 23:59:00,The Shiba Inu price has remained stable despite a decline in SHIB’s activity while underwater investors move to the 5000x altcoin ETFSwap to recover their losses. #sponsored
"SHIB aims for $0.1, DOGE looks to $11 in 2025; This AI token could perform even better",2024-10-24 14:20:00,"Amid predictions for Shiba Inu and Dogecoin, WallitIQ is emerging as a potential game-changer, poised to outperform both with its AI technology and user-centric features. #sponsored"
"TRON whales pick this hidden RWA token over PEPE, SHIB for long-term gains",2024-10-24 12:33:00,"TRON whales favor PropiChain, a new RWA token, over PEPE and Shiba Inu for long-term growth. Find out why this shift could lead to massive gains. #sponsored"
