title,date,description
"Toncoin price at risk of a 22% decline as burn rate falls, inflation rises",2025-01-29 18:28:00,"Toncoin’s price crashed to a key support level as exchange balances and inflation rose, while its burn rate declined. Tonecoin (TON) fell to $4.80, its lowest level since Nov. 6 last year, and is now 33% below its highest level…"
Suggestive traders pick 1FUEL over Solana and Toncoin for long-term value,2025-01-28 23:15:00,1FUEL gains traction over Solana and Toncoin among suggestive traders looking for long-term value. #partnercontent
"Crypto analyst Ali says DOGE could go to $15, new altcoin to boost Toncoin",2025-01-27 22:00:00,"As crypto analyst Ali forecasts DOGE at $15, Elluminex emerges as a potential catalyst for the Toncoin blockchain. #sponsored"
"Investors ditch XRP, Toncoin, Solana for this trending crypto passive income potential",2025-01-25 13:18:00,"On-chain trends show investors moving from Ripple, Toncoin, and Solana to Rollblock, aiming for 50x returns and staking gains. #partnercontent"
FX Guys presale gains attention over Toncoin and The Sandbox,2025-01-24 15:12:00,"Presale for FX Guys is gaining traction with features surpassing Toncoin and Sandbox, which is drawing investors. #partnercontent"
"Sui, Toncoin, Stellar and Remittix: Crypto gurus pick 1 to hold",2025-01-22 21:56:00,"Crypto experts narrow down the best altcoin to hold from Sui, Toncoin, Stellar, and the rising star, Remittix. #partnercontent"
Toncoin continues muted growth: Trump meme coin and BlockDAG lead the 2025 crypto rally,2025-01-22 17:13:00,"TRUMP meme coin surges to $11B market cap on Solana, while Toncoin holds steady at $6.35 amid ecosystem upgrades and whale moves. #pressrelease"
"Toncoin forms bullish pennant as burn rate, transactions rise",2025-01-18 18:24:00,"Toncoin remained under pressure as cryptocurrencies rebounded and as its on-chain data improved.  Toncoin (TON) was trading at $5.35 on Saturday, down by more than 35% from its highest level last year. It has lagged behind other cryptocurrencies like Bitcoin…"
Next big crypto: New DeFi giant outshines Cardano and Toncoin,2025-01-13 06:35:00,Lunex Network is rapidly gaining momentum and could soon surpass established DeFi leaders like ADA and TON in both value and market position. #partnercontent
"Solana, Toncoin, and Ripple whales are eyeing new sensation Lightchain AI",2024-12-31 10:11:00,"Major crypto whales from Solana, Toncoin, and Ripple are now eyeing Lightchain AI, a rising star blending AI with blockchain technology. #sponsored"
Cardano and Toncoin take a backseat as Lightchain AI presale shines,2024-12-23 22:15:00,Lightchain AI steals the spotlight as Cardano and Toncoin lose investor momentum. #partnercontent
Toncoin and Solana eye new all-time highs as crypto whales rush to buy Lightchain AI,2024-12-21 17:14:00,"Toncoin & Solana near resistance levels, but Lightchain AI steals the spotlight at $0.003. #partnercontent"
Toncoin forecast bullish while AVAX dips; BlockDAG aims to be the next $1 crypto,2024-12-13 15:53:00,"Find the top crypto to buy now as BlockDAG’s WASM & EVM compatibility boosts its price, Toncoin forecast aims for $10, and AVAX price drops. #pressrelease"
XYZVerse presale surpasses Cardano and Toncoin in investor appeal,2024-12-12 22:45:00,"The XYZVerse presale is making headlines, surpassing Cardano and Toncoin in investor appeal. #partnercontent"
"Three cryptos aiming to dominate the market: Toncoin, Shiba Inu, Rollblock",2024-12-03 07:02:00,"Rollblock’s $6.6m presale buzz, Toncoin’s price breakout, and Shiba Inu’s Shibarium upgrade highlight a thrilling race for crypto dominance. #partnercontent"
Crypto whales buy Toncoin and new altcoin sensation for double-digit returns,2024-11-30 12:59:00,"Shiba Inu aims for top 5 in crypto by 2029, with rising interest in Toncoin and Yeti Ouro signaling market shifts. #partnercontent"
"Toncoin eyes $6 level as Pepe surpasses Uniswap, AI coin to advance trading",2024-11-19 06:44:00,"Toncoin approaches the $6 mark, Pepe surpasses Uniswap in market buzz, and a new AI Coin aims to enrich the trading sector. #partnercontent"
Solana trader who made $50M on Toncoin says a $0.035 AI token will reach $50 by 2025,2024-11-05 17:05:00,An investor who turned $50 million with Toncoin now targets a low-priced AI token expected to soar from $0.035 to $50 by 2025. #partnercontent
Investors look towards Lunex Network for gains ahead of Toncoin and Solana,2024-11-05 05:52:00,"As market sell-offs continue and Bitcoin dips, investors are eyeing Lunex Network for potential 100x gains in Q4, while Solana and Toncoin show growing activity in the crypto space. #partnercontent"
"Toncoin is at risk as HMSTR, Catizen, Notcoin, and burn volume dive",2024-11-04 14:08:00,"Toncoin’s price continued its strong sell-off on Monday as most tap-to-earn tokens on its network crashed and burn volume retreated. Toncoin (TON) retreated to $4.90, down 41% from its highest point this year. It has also fallen nearly 30% since…"
Solana faces new challenges from Cybro and Toncoin,2024-11-01 16:21:00,"Newcomers like Cybro and Toncoin are challenging established networks like Solana, raising questions about its leading position in crypto. #partnercontent"
Cardano Teams with BitcoinOS to tap BTC’s $1.4T market; investors back Toncoin and this new hybrid token,2024-10-26 12:17:00,"The crypto market is bullish as Bitcoin nears a peak. Cardano partners with BitcoinOS to unlock BTC’s $1.4T market, while investors also back the new hybrid altcoin DTX. #partnercontent"
New hidden gem to mirror Solana and Toncoin price trajectory,2024-10-25 09:52:00,"Pulsemate AI could emerge as a powerhouse, rivaling Solana and Toncoin with its potential in the booming AI chatbot market. #pressrelease"
FTX’s 178K Solana unlock may trigger sell-off; investors shift to Toncoin and Lunex Network,2024-10-19 08:48:00,"FTX’s 178K SOL unlock raises sell-off fears, pushing investors toward Toncoin and Lunex Network, expected to surge 1800%. #partnercontent"
Zig Network could be a top investment in 2024 than Solana and Toncoin,2024-10-19 08:30:00,"Investors seek promising rewards amid market shifts. While Solana and Toncoin shine, newcomer Zig Network emerges as a top contender. #partnercontent"
"New altcoin tipped for 15,000% gains set to topple Solana, Toncoin",2024-10-14 18:00:00,"As Solana and Toncoin struggle at critical resistance levels, Lunex Network emerges as a promising altcoin in presale, poised for a potential 1,800% rally amid a bullish market outlook. #partnercontent"
Experts predict this new altcoin could oust Solana and Toncoin from the top 10,2024-10-11 19:00:00,"Market volatility affects major players like Solana and Toncoin, while experts predict Rollblock could disrupt the Top 10 in 2025 with a potential 100x surge. #partneercontent"
Experts Analyze Harris and Trump’s Impact on Crypto and Toncoin vs. Tron,2024-10-06 11:35:00,"Toncoin loses investor interest due to a negative funding rate, while TRON gains momentum, surpassing Bitcoin and Ethereum. #partnercontent"
"Toncoin and Dogen surge ahead in October’s bull market, outpacing Dogecoin",2024-10-04 19:23:00,"October sees Toncoin and Dogen surge, eclipsing Dogecoin and SHIB. This shift hints at a new era in crypto. #partnercontent"
"TRX surges 23%, but experts say Dogen and Toncoin are set for 100x gains",2024-10-04 18:36:00,"TRX surges 23%, but the real excitement is around Dogen and Toncoin, with experts predicting massive growth in the bull market. #partnercontent"
Rollblock surges 200% as it steamrolls competition—SOL price prediction and Toncoin news,2024-10-04 15:00:00,"Solana’s price prediction shows promise, while Toncoin aims for a 5x return by November. Meanwhile, Rollblock shines with a 200% surge. #partnercontent"
Toncoin nears a dreaded pattern despite strong on-chain metrics,2024-09-30 18:36:00,"The Toncoin token remained in a bear market and was at risk of forming the dreaded death cross pattern, despite strong on-chain metrics. Toncoin (TON) was trading at $5.81 on Monday, Sep. 30, down by over 30% from the year-to-date…"
Lunex Network may outperform Solana and Toncoin in this bull run,2024-09-27 16:48:00,"As the Toncoin price recovers and Solana awaits its breakout, Lunex Network emerges as a top contender in this bull run with its innovative hybrid exchange model. #partnercontent"
Rollblock’s price set to surge as Toncoin and Solana compete for gains,2024-09-24 13:53:00,"As Toncoin and Solana struggle, Rollblock emerges as a strong contender in crypto gains, targeting the $450 billion online gambling market. #partnercontent"
"Altcoins set for big-time gains: Toncoin, Intel Markets and Ethereum",2024-09-19 20:00:00,"Donald Trump is set to launch a new crypto exchange, World Liberty Financial, sparking interest in altcoins like Toncoin, Intel Markets, and Ethereum. #partnercontent"
"Crypto experts bet big on Toncoin, DTX Exchange and ETH",2024-09-12 22:00:00,"Top crypto experts and analysts are betting on these coins – Toncoin, DTX Exchange, and Ethereum – for huge gains #partnercontent"
"Toncoin holders move to Raboo, a trending memecoin gunning for top 20",2024-09-06 08:27:00,"As Toncoin hits multi-month lows, investors are turning to Raboo, a rising memecoin nearing the end of its Stage 4 ICO with strong potential and smart features. #sponsored"
Red alert: Toncoin price flips key support as death cross nears,2024-09-04 15:19:00,"Toncoin price continued its downward trend, crossing a key support level as cryptocurrencies dropped. Toncoin (TON) fell by 15% on Sep. 4, making it the worst-performing top-ten cryptocurrency. The price dropped to a low of $4.60, down more than 44%…"
"Investors rush to Intel Markets as Solana, Toncoin face massive declines",2024-09-04 15:00:00,"Amid the latest market developments, investors are turning to Intel Markets as Solana and Toncoin face significant challenges. #partnercontent"
"Toncoin price steadies with Durov’s release, but analysis points to possible downturns",2024-09-03 10:44:00,"Toncoin experienced a sharp 27% drop to $5.04 in the wake of Pavel Durov’s arrest. Although the price has since stabilized slightly above that level, the situation remains precarious due to the ongoing investigation surrounding the Russian Zuckerberg. Despite the…"
"Whales stock up on Toncoin, Intel Markets, Dogecoin before next bull run",2024-09-02 15:00:00,"Whales begin stocking up on Toncoin, Intel Markets, and Dogecoin in anticipation of the next bull run in the crypto space. #partnercontent"
Why a memecoin nearly broke the Toncoin blockchain?,2024-09-01 15:16:00,"The TON blockchain went down twice within 36 hours due to an unexpected spike in transaction volumes driven by the sudden popularity of a new memecoin called DOGS. The heavy traffic caused by DOGS transactions overwhelmed the network, leading to…"
Pavel Durov’s arrest unleashes the Streisand Effect on Toncoin,2024-08-30 09:19:00,"On August 24, 2024, French authorities arrested Pavel Durov, the founder of Telegram, and released him on bail a few days later. Though the arrest cited alleged illegal activities conducted through his messaging platform, many have viewed it as an…"
"Toncoin turns bullish, whale transactions decline",2024-08-29 08:55:00,"Toncoin is witnessing bullish sentiment for the first time after the recent price plunge amid declining whale transactions. According to data provided by IntoTheBlock, the bullish sentiment around Toncoin (TON) has increased over the past 24 hours.  TON recorded a…"
"Experts predict massive gains for Solana, DTX Exchange and Toncoin this cycle",2024-08-28 07:00:00,"Top experts are predicting massive gains for Solana, DTX Exchange and Toncoin in the current market cycle. #partnercontent"
"Tron, Toncoin daily active addresses surge amid price fall",2024-08-27 09:05:00,"The number of Tron and Toncoin daily active addresses saw an impressive rise on Monday, Aug. 26, leading the charts by a huge margin. According to data provided by IntoTheBlock, the number of Tron (TRX) daily active addresses increased by…"
New presale coin may leave Toncoin and Solana in the dust,2024-08-27 07:00:00,"A new crypto contender, DTX Exchange, currently in its presale, has the potential to outshine both Toncoin and Solana. #partnercontent"
Cardano and Toncoin investors flock to new presale coin that has raised over $140K,2024-08-26 19:10:00,"Intel Markets raises $140K+ in days, drawing Cardano and Toncoin interest; analysts predict 10x growth soon. #partnercontent"
Toncoin slides 5% as Telegram CEO rumored to face 12 charges,2024-08-26 18:03:00,"Telegram founder and CEO Pavel Durov was reportedly charged with 12 crimes in France related to financial and cybercrimes following his arrest last weekend. Toncoin (TON), the native cryptocurrency of Telegram-endorsed The Open Network, fell by up to 5% following…"
The next Toncoin or Ripple: New presale token poised to take over market,2024-08-26 13:00:00,Discover the next big player in the crypto market with this presale token that is creating waves similar to Toncoin or Ripple. #partnercontent
"Telegram founder Pavel Durov arrested, Toncoin plunges 20%",2024-08-25 10:44:00,"Toncoin faced a strong bearish momentum after Pavel Durov, the founder of Telegram, was arrested at Le Bourget airport near Paris. Toncoin (TON) plunged by 20.6% in the past 24 hours and is trading at $5.3 at the time of…"
"Solana, Toncoin whales are betting big on new presale sensation: Intel Markets",2024-08-23 09:30:00,Learn more about why whales in the Solana and Toncoin projects are betting big on Intel Markets. #partnercontent
"Altcoins with high ROI potential: Rollblock, Pepe Coin, Toncoin",2024-08-21 09:54:00,"As the much-anticipated crypto bull run kicks off, Rollblock, Pepe, and TonCoin are emerging as top contenders for high ROI, with analysts tipping RBLK for a potential 100x rally. #partnercontent"
DTX Exchange presale winds past $1.34M as Shiba Inu and Toncoin investors rally in,2024-08-18 20:24:00,"The crypto market stabilizes as Toncoin surges post-Binance listing, while Shiba Inu declines. DTX Exchange’s presale gains buzz. #partnercontent"
"Toncoin, Notcoin, Celestia rises as July US inflation drops",2024-08-14 13:21:00,"Annual consumer prices retreated in August, raising hopes that the Federal Reserve will start cutting interest rates in its September meeting. Cryptocurrencies and U.S. stocks continued rising on Wednesday, Aug. 14 after the release of July’s inflation report. THORChain (RUNE)…"
"Toncoin price shows bullish pattern, but there’s a catch",2024-08-08 14:40:00,"Toncoin price has staged a strong recovery after retreating to a multi-month low on Monday as investors unwound the Japanese yen carry trade. The Toncoin (TON) token rose to a high of $6.38 in a high-volume environment. At its peak,…"
Toncoin,Inconnu,
"MyTonWallet adds Telegram gifts, crypto payments in latest update",2025-01-31 17:21:00,"MyTonWallet, a self-custodial wallet for The Open Network blockchain, has released version 3.3. The update includes a clearer fee display, an upgraded Explore section, improved navigation, support for Telegram gifts, and a new crypto payment tool called MyTonWallet Pay, according…"
Why IMX’s NFT appeal may falter as 1Fuel captures broader market attention,2025-01-30 15:00:00,"As investor focus shifts from NFTs to utility-backed assets, 1Fuel emerges as a promising token with the potential for a 5,000% rally. #partnercontent"
"Cardano and XRP prices decline, investors use 1Fuel as shelter",2025-01-29 19:12:00,Investors are turning to 1Fuel as a shelter from Cardano and XRP price declines. #partnercontent
"TRUMP, DOGE face downward spiral as investors shift to real-world solutions",2025-01-29 07:32:00,"As meme coins like TRUMP and DOGE struggle to maintain their dominance, 1Fuel, with its real-world use cases and growing adoption, stands out as a strong contender. #partnercontent"
Pepe Coin holders shift focus to promising new viral coin,2025-01-28 00:31:00,"Pepe Coin holders are turning their focus to Elluminex, a promising new viral coin. #sponsored"
BlockDAG: A crypto to watch in 2025,2025-01-27 21:28:00,"Explore BlockDAG, a crypto to watch in 2025. Achieving $185m in presale, selling 18b coins, and boasting a 2,380% ROI. #pressrelease"
TON plans to launch layer-2 Payment Network,2025-01-27 16:55:00,"TON plans to launch a layer-2 payment network as part of The Open Network’s 2025 roadmap. According to an update shared by the TON Core, the layer-2 Payment Network envisioned in the original TON whitepaper is among the key targets…"
"Investors turned $100 into $10k on TRUMP, MELANIA meme coins, FX Guys could be next",2025-01-26 15:32:00,"The TRUMP and MELANIA meme coins turned $100 into $10k before crashing, sparking interest in FX Guys as a 100x token. #partnercontent"
"Experts predict XRP surge as Trump appoints SEC Chair, FX Guys eyes 60x rally",2025-01-25 20:10:00,"With Trump’s SEC appointment, XRP gains traction, while FXGuys eyes 60x rally amid regulatory shifts. #partnercontent"
"BlockDAG Affiliate Program ends on January 26, aims to outshine LTC, Trump Coin",2025-01-24 17:03:00,BlockDAG’s 10% cashback program ends on January 26. Compare its rewards to Litecoin’s whale moves and Official Trump Coin hype. #pressrelease
SOL holders back Remittix: The altcoin set to change the future of global transfers,2025-01-23 22:18:00,"Investors shift focus to Remittix, a new DeFi project raising millions in presale with hopes of changing global transfers. #partnercontent"
"Crypto presale raises $1m in 24 hours, Dogecoin and XRP holders get FOMO",2025-01-23 21:01:00,Dogecoin and XRP holders get FOMO as Remittix’s crypto presale raises $1m in 24 hours. #partnercontent
Aussie couple sells land for BTC: A TON-based coin could make it the new norm,2025-01-23 15:39:00,"Melissa Bower and Trudy Purcell sold their land for Bitcoin, bypassing fees and highlighting crypto’s benefits amid inflation. #sponsoredcontent"
"Remittix could outperform Shiba Inu, Cardano and Binance Coin this year",2025-01-23 13:02:00,"Remittix is making waves in the crypto industry, with its smart approach to cross-border payments and a presale performance that’s catching the eye of investors. #partnercontent"
TON becomes the exclusive blockchain for Telegram’s mini-apps,2025-01-21 18:11:00,"The Open Network Foundation is expanding its partnership with Telegram to boost the adoption of the TON blockchain. In their announcement on Jan. 21, the TON Foundation and Telegram revealed that the TON blockchain will now exclusively support Telegram’s mini…"
"New PayFi crypto continues to outshine ADA, TON as whale transactions soar",2025-01-20 14:22:00,"Remittix is emerging as a strong PayFi contender, with a $3.85m presale and a vision to disrupt the remittance market, potentially outpacing Cardano and Toncoin. #partnercontent"
The bull market is in full swing but these 3 cryptos still look cheap,2025-01-18 09:49:00,"Solana, Uniswap, and Elluminex remain undervalued, with Elluminex poised to tap into a 1 billion-user market. #sponsoredcontent"
Cardano executive Marius Bock joins BlockDAG’s leadership team,2025-01-15 18:24:00,"BlockDAG gains momentum as ex-Cardano exec Marius Bock joins, with a 300% bonus and launch on 10 top exchanges imminent. #pressrelease"
MyTonWallet introduces NFT card customization feature in latest update,2025-01-15 15:47:00,"MyTonWallet, a self-custodial wallet for The Open Network blockchain, launched NFT card customization on Jan. 15. The latest v3.2 update allows users to personalize their wallet interfaces using rare non-fungible token cards. The feature builds on a two-year initiative when…"
TikTok ban: Can crypto survive without TikTok’s influence?,2025-01-15 11:11:00,"TikTok, the social media platform launched in September 2016, is facing a potential ban in the United States. Will it affect the crypto market?"
Telegram-linked TON eyeing U.S. expansion,2025-01-14 14:22:00,"The TON Foundation, associated with Telegram Messenger, is planning to expand into the U.S. market, anticipating more favorable regulatory conditions under President-elect Donald Trump. As part of its U.S. expansion strategy, the foundation has appointed Manuel Stotz, founder of Kingsway…"
"Investors move from SHIB, TON to new PropFi token with better projections",2025-01-13 11:14:00,Shiba Inu and Toncoin investors lean toward a new PropFi token for its better bullish projections in 2025. #pressrelease
Nansen to integrate TON Blockchain for better analytics,2025-01-09 16:02:00,"Nansen has partnered with the TON Blockchain to provide enhanced analytics tools aimed at offering greater transparency and actionable insights for developers, investors, and the broader crypto community. This collaboration introduces Nansen’s Query and Growth Dashboards, which offer data on…"
Dogecoin vs. Dogizen: How Telegram’s debut ICO is challenging the OG meme,2025-01-08 11:00:00,"Dogecoin’s rally grabs headlines, but the real 2025 gains lie with Dogizen, the Telegram gaming token poised for explosive ROI. #pressrelease"
"Set a portfolio for 2025 gains with top crypto picks: BlockDAG, XRP, Cardano, and XLM",2025-01-07 19:30:00,"Cryptos like BlockDAG, XRP, Cardano, and XLM promise 2025 growth with tech advances, scalability, and strong partnerships. #pressrelease"
"Telegram shared data from 2,253 users with US officials in 2024",2025-01-07 17:48:00,"Telegram, the messaging app known for its focus on privacy and free speech, revealed it provided data on more than 2,200 users to U.S. authorities in 2024.  This marks a significant shift for the platform, which previously limited user data…"
BlockDAG’s BDAG400 launch with 250% bonus drives excitement as DOGE whales buy big & ETH eyes ATH,2025-01-06 17:00:00,"Dogecoin whales buy 300M tokens, ETH targets new ATH, while BlockDAG’s 250% BDAG400 bonus fuels 2025 crypto optimism. #pressrelease"
SOL alternative priced at just $0.07 could hit $1 before March,2025-01-05 13:56:00,"SOL hits $205.64 on strong demand, while IntelMarkets gains attention with its AI-driven platform and massive presale raise. #partnercontent"
5 cryptos that have high-growth potential in 2025,2025-01-05 13:17:00,"Discover 5 crypto assets with massive growth potential, turning small investments into fortunes by April 2025. #partnercontent"
"Leading altcoins for January: Pepe, DOGE, and Lightchain AI",2025-01-03 00:19:00,"Analyzing the altcoins with the best potential for January: Pepe, DOGE, and Lightchain AI. #partnercontent"
Chainlink surges; TON’s December blues may turn green as Lunex fuels the HODL spirit,2025-01-02 23:30:00,"LINK surged 20% in December, TON nears $7.2 resistance, and Lunex Network gains attention for its innovative DeFi features and investor appeal #partnercontent"
Linda Yaccarino teases X Money and X TV in New Year’s post,2025-01-02 13:34:00,"The CEO of X, Linda Yaccarino, has hinted at the possibility of launching X Money along with other innovations for the social media platform in 2025. Many speculate that X will introduce its own cryptocurrency, given Elon Musk’s support for…"
Crypto to buy for a potential 10x for those who missed PEPE earlier this year,2025-01-02 10:44:00,"Lightchain AI is transforming crypto by merging blockchain with AI, offering early investors a chance for major returns during its presale. #sponsored"
Solana climbs back above $200 as crypto market gains momentum,2025-01-02 09:21:00,"SOL continues to outperform ETH year-to-date as the cryptocurrency starts 2025 with an 8% jump, with investors continuing to eye a potential Solana ETF. As of Jan. 2, 2025, Solana (SOL) is trading at $205.64, marking an 8.48% increase over…"
PEPE alternative under $0.004: The leading option for a 50x ROI in 2025,2025-01-01 20:59:00,"Lightchain AI, a PEPE alternative under $0.004, could be the best option for a 50x ROI in 2025. #partnercontent"
"$0.004 Solana rival poised for a sharp rally to $2 in 10 weeks, or less",2025-01-01 15:00:00,"Lightchain AI, priced at $0.004 in presale, is gaining momentum as a rival to Solana, with projections of a surge to $2 within 10 weeks. #sponsored"
"Investors snap up millions of this viral altcoin poised to outpace SOL, XRP in 2025",2024-12-31 15:52:00,"Lightchain AI draws major investor attention as it combines AI and blockchain technology, positioning itself as a strong competitor to Solana and Ripple. #partnercontent"
ADA could reach $4.20 before Jan 31; this competitor at $0.004 may get there first,2024-12-31 14:49:00,"Cardano targets $4.20 by January, but Lightchain AI’s $0.004 presale success positions it as a disruptive competitor with explosive growth potential. #sponsored"
"This token may turn $540 into $54K in 9 weeks, echoing Shiba Inu and Solana’s 2021 surge",2024-12-31 14:12:00,"Lightchain AI, priced at $0.004, is drawing investor attention, with potential for explosive growth like SHIB and SOL in 2021. #partnercontent"
5 altcoins on the verge of joining the top 10 with massive growth,2024-12-30 23:43:00,Exploring 5 altcoins with the potential to join the top 10 rankings. #partnercontent
"Dogecoin could rally 6,770% if the current trend holds, says analyst",2024-12-30 11:02:00,Crypto expert Ali says Dogecoin may surge 6780% if it remains in the rising parallel channel pattern.
TON and XRP investors are pivoting to this $0.0007 crypto with 700% returns,2024-12-29 18:05:00,"A new low-priced cryptocurrency priced at $0.0007 offers 700% returns, drawing investors away from TON and XRP. #partnercontnt"
