title,date,description
Shiba Inu announces major web3 partnership with UAE government,2025-02-04 15:29:00,"The United Arab Emirates (UAE) government and cryptocurrency project Shiba Inu have partnered to promote Web3 innovation and growth in the country. In an announcement shared with crypto news, Shiba Inu (SHIB) stated that the collaboration involves the UAE’s Ministry…"
A new Shiba Inu-themed token VICKY surges 22% as Buterin holds 13% after initial sale,2025-02-04 13:17:00,"VICKY is up 22% in the last 24 hours as Vitalik Buterin retains the majority of VICKY holdings allocated to him at launch.  Daughter of Shiba Inu (VICKY), a new Shiba Inu-themed token endorsed by Vitalik Buterin, is up 22%…"
Shiba Inu’s future in December as Panshibi draws big investments in presale,2025-02-03 16:46:00,"As Shiba Inu’s future remains uncertain, Panshibi’s presale gains momentum with strong investor interest. #partnercontent"
"Dogecoin and Shiba Inu may not pump like 2021, this token has better chances",2025-01-31 19:00:00,"While DOGE and SHIB may struggle to replicate their 2021 gains, Lightchain AI emerges as a promising alternative. #partnercontent"
Shiba Inu holders explore a rising altcoin gaining attention,2025-01-31 13:08:00,"Shiba Inu faces continued losses, prompting investors to explore new options; meanwhile, Remittix has gained attention as a rising PayFi project. #partnercontent"
Shiba Inu and Rexas Finance for mega returns by 2026,2025-01-29 20:04:00,Shiba Inu and Rexas Finance are emerging as top contenders for exponential gains by 2026. #partnercontent
"Investors eye Pepe, Shiba Inu, and this new coin for massive 2025 gains",2025-01-29 19:16:00,Lightchain AI emerges as a strong contender for significant gains in 2025 alongside Pepe and Shiba Inu. #partnercontent
This AI coin could push Shiba Inu outside the top 10 list,2025-01-29 00:53:00,IntelMarkets emerges with the potential to push Shiba Inu from the top 10 list with its AI-blockchain combination. #partnercontent
This crypto presale could surge faster than Shiba Inu did,2025-01-29 00:20:00,The Rexas Finance presale is expected to surge faster and higher than Shiba Inu in 2021. #partnercontent
"Shiba Inu millionaire forecasts next move, 2 coins to be the next SHIB",2025-01-28 22:13:00,"Shiba Inu millionaire forecasts SHIB’s next move, with Pudgy Penguins and Rexas Finance coins set to replicate its performance. #partnercontent"
Shiba Inu investors are quietly buying 1Fuel for massive gains,2025-01-28 18:47:00,"Shiba Inu investors are shifting focus to 1FUEL, a promising altcoin poised for significant growth. #partnercontent"
"Utility tokens like Solana, Remittix outshine Shiba Inu, Dogecoin this cycle",2025-01-28 11:23:00,Utility tokens like Solana and Remittix are gaining traction among savvy investors as they prioritize real-world applications over hype-driven meme coins. #partnercontent
Shiba Inu rival at $0.175 could reach $5 before SHIB surges,2025-01-28 07:02:00,Investors shift focus from Shiba Inu to a new contender leveraging real-world asset tokenization for transformative market potential. #partnercontent
Investor identifies the next coin under $1 to outperform Shiba Inu,2025-01-27 17:42:00,A top investor identifies Rexas Finance as the next coin under $1 to outperform Shiba Inu. #partnercontent
AI predicts this coin to replicate Shiba Inu’s 2021 rally in 2025,2025-01-27 12:30:00,"AI predicts Remittix could mirror Shiba Inu’s 2021 rally, offering explosive growth potential in global payments. #partnercontent"
Shiba Inu remains safe choice but 1Fuel could be better bet in 2025,2025-01-27 09:38:00,"Shiba Inu’s dominance faces a challenge as 1Fuel’s presale gains momentum, offering investors the promise of 100x returns by 2025. #partnercontent"
Red alert as Shiba Inu price forms two risky patterns,2025-01-26 16:04:00,"Shiba Inu price remained under pressure as it continued to underperform other popular meme coins.  Shiba Inu (SHIB) dropped to the key support level at $0.000020, its lowest level since December 20. There is a risk that the SHIB coin…"
"New crypto set to outshine Shiba Inu with a 23,476% run could yield massive gains",2025-01-24 20:06:00,"Lightchain AI’s unique blend of blockchain and AI positions it for a 23,476% surge, outshining popular altcoins like SHIB. #partnercontent"
Shiba Inu competitor gains traction with promises of significant gains,2025-01-24 19:07:00,Shiba Inu loses steam as Rexas Finance emerges with real-world asset tokenization and promises massive potential returns. #partnercontent
"Remittix could outperform Shiba Inu, Cardano and Binance Coin this year",2025-01-23 13:02:00,"Remittix is making waves in the crypto industry, with its smart approach to cross-border payments and a presale performance that’s catching the eye of investors. #partnercontent"
"Shiba Inu whales rotate into PropiChain, bet on its AI edge",2025-01-22 23:38:00,"Shiba Inu whales are rotating their profits into PropiChain, betting on its AI features and potential to rise. #partnercontent"
This under $0.50 crypto may crush Shiba Inu and Pepe coin in 2025,2025-01-22 21:17:00,"Meme coins like SHIB and PEPE are fading as Rexas Finance, under $0.50, emerges as the leading choice for 2025. #partnercontent"
"Comparing Dogecoin, Shiba Inu, and XYZVerse for potential growth in 2025",2025-01-22 20:59:00,"With many options available, this analysis compares the growth potential of Dogecoin, Shiba Inu, and XYZVerse. #partnercontent"
1Fuel new exchange is poised to overtake Shiba Inu in 2025,2025-01-22 20:29:00,"As SHIB faces challenges, 1Fuel rises with $1.4M raised and analysts predicting 500% presale gains. #partnercontent"
Investors shift from Cardano and Shiba Inu to this new crypto with 50-100x potential,2025-01-22 20:17:00,"Investors pivot from Cardano and Shiba Inu to Remittix, eyeing 50x-100x growth in global payments innovation. #partnercontent"
"This altcoin could deliver 10x gains, outperforming Dogecoin and Shiba Inu",2025-01-22 18:05:00,"Rollblock emerges as 2025’s altcoin star, poised to outshine meme coins with 10x+ returns for early investors. #partnercontent"
This new crypto is poised to 20x the gains of meme coins Shiba Inu and Pepe,2025-01-21 18:12:00,"Shiba Inu and Pepe Coin recover, but Rollblock shines after raising $8.9M in its presale. #partnercontent"
Crypto experts choose new altcoin as next star after Dogecoin and Shiba Inu,2025-01-20 23:43:00,Crypto experts select Rollblock as the next potential altcoin star after Dogecoin and Shiba Inu. #partnercontent
Traders bet on Lightchain AI to rise above Shiba Inu,2025-01-20 21:53:00,Traders bet on Lightchain AI to rise above Shiba Inu as it faces challenges. #partnercontent
Interest cools in Shiba Inu and Pepe as Trump launches TRUMP meme coin on Solana,2025-01-20 17:27:00,"TRUMP meme coin skyrockets 190% in 24 hours, surpassing SHIB and PEPE, while Remittix secures $3.85M for remittance growth. #partnercontent"
Solana and Shiba Inu may fall short of Rollblock’s ambitious 2025 price targets,2025-01-19 17:52:00,"Solana and Shiba Inu fall short as Rollblock’s GambleFi model gains traction, with $1.75M wagered and massive growth. #partnercontent"
"Shiba Inu price falls, Shibarium crosses milestone, burn rate soars",2025-01-19 13:48:00,"Shiba Inu price retreated during the weekend as crypto traders’ attention possibly shifted to Official Trump. Shiba Inu (SHIB) token retreated to $0.00002099, down by 9%. Its retreat mirrored that of other popular meme coins like Pudgy Penguins, Dogwifhat, Popcat,…"
Shiba Inu millionaires shift focus to new Solana-based coin predicted to explode x1000,2025-01-18 17:33:00,"Shiba Inu investors eye a rising Solana-based coin, buzzing with growth potential and aiming for meme coin dominance. #partnercontent"
Remittix tipped for greater long-term growth than Shiba Inu and Dogecoin,2025-01-17 19:01:00,"Remittix raises $3M in presale, poised for 10x growth, rivaling Shiba Inu and Dogecoin in the $190T PayFi sector. #partnercontent"
The next Solana or Shiba Inu: Here’s what crypto whales are buying,2025-01-17 09:25:00,"As Bitcoin stagnates, investors are turning to Remittix as the next big crypto opportunity for Q1 2025, with its PayFi utility poised to rival top altcoins like Solana and Shiba Inu. #partnercontent"
"January 2025 forecast: Shiba Inu, XRP, and Remittix",2025-01-16 21:19:00,"Analyzing January 2025 forecasts for Shiba Inu, XRP, and Remittix. #partnercontent"
Lightchain AI presale nears capacity; Shiba Inu and PEPE top addresses identified,2025-01-16 20:15:00,"Investors rush to join Lightchain AI’s $10.6M presale, as SHIB and PEPE show strong accumulation trends. #pattnercontent"
This altcoin could turn $800 into $80k like Dogecoin and Shiba Inu in 2021,2025-01-15 22:55:00,"RCO Finance predicted to have a surge similar to Dogecoin and Shiba Inu in 2021, potentially turning $800 into $80k. #partnercontent"
XRP bullish momentum faces strong competition from Lightchain AI and Shiba Inu,2025-01-15 21:38:00,"As XRP gains momentum, Lightchain AI and Shiba Inu rise as strong competitors, attracting investor interest. #partnercontent"
3 meme coins that could outperform Shiba Inu’s legendary rally,2025-01-15 20:25:00,"The crypto world is abuzz with new meme coins poised to outshine Shiba Inu, targeting record-breaking growth by mid-2025. #partnercontent"
Shiba Inu coin price rare pattern points to a 50% jump,2025-01-15 17:44:00,"Shiba Inu price drops 33% from December highs but signals of a potential rebound emerge Shiba Inu (SHIB), the second-biggest meme coin, rose to a high of $0.00002215, up 12% from its lowest swing this week. It has lagged behind…"
"FX Guys outshines Shiba Inu, TRON: Investors look to make massive gains",2025-01-15 08:33:00,"FXGuys is transforming crypto trading with features like Trade2Earn, trader funding, and passive staking, offering profit potential to turn $100 into $10,000. #partnercontent"
"Shiba Inu may not reach $1, here’s the token to make millionaires in 2025",2025-01-08 22:02:00,"As Shiba Inu’s $1 dream fades, Rexas Finance emerges as the next big contender for creating millionaires in 2025. #partnercontent"
Three cryptos under $1 that could surpass Dogecoin and Shiba Inu in 2025,2025-01-08 21:12:00,Analyzing three crypto tokens under $1 with the potential to surpass Dogecoin and Shiba Inu in 2025. #partnercontent
Rexas Finance the next Shiba Inu: Why $1000 could hit $50000 by mid-2025,2025-01-08 21:01:00,"Rexas Finance tipped as the next Shiba Inu for its potential to turn a $1,000 investment into $50,000 by mid-2025. #partnercontent"
"Shiba Inu coin price could fall 50% as Shibarium fees, burn rate crash",2025-01-08 14:15:00,"Shiba Inu coin price has crashed by over 35% from its December high and faces further downside risks as the burn rate and Shibarium fees continue to decline. Shiba Inu (SHIB) retreated to $0.00002150 on January 6, joining other popular…"
$250 made $25k with Shiba Inu and Solana in 2021; this $0.175 crypto could be next in 2025,2025-01-07 15:53:00,"Rexas Finance shows potential for explosive gains in 2025, echoing SHIB and SOL’s transformative 2021 surges. #partnercontent"
"Cryptos to buy in 2025: Ethereum, XRP, Rollblock, Solana, Pepe, and Shiba Inu",2025-01-06 23:08:00,"Evaluating Ethereum, XRP, Rollblock, Solana, Pepe, and Shiba Inu as the best cryptos to buy in 2025. #partnercontent"
Small $100 investment in this token could be life-changing just like Shiba Inu in 202,2025-01-06 18:27:00,"Rexas Finance is capturing attention with its $0.175 entry price, offering 1000x potential returns akin to Shiba Inu’s 2021 rise. #partnercontent"
Three altcoins to watch as they aim to outperform Shiba Inu’s 2021 surge by 2025,2025-01-06 15:48:00,"Emerging altcoins aim to surpass Shiba Inu’s 2021 surge, offering significant returns by 2025. #partnercontent"
"Token superior to DOGE, Shiba Inu to go from $155 to $15500 in 10 weeks",2025-01-06 11:05:00,"Rexas Finance outshines Dogecoin and Shiba Inu with its real-world asset tokenization, targeting 100x growth in just 10 weeks. #partnercontent"
FX Guys presale creates a blueprint for success beyond Dogecoin and Shiba Inu,2025-01-06 07:01:00,"FX Guys presale sets a new success standard, outshining Dogecoin and Shiba Inu with high-yield staking, Trade2Earn, and smart solutions. #partnercontent"
"Shiba Inu price decline opens the door for WallitIQ to achieve 8,950% growth in 14 days",2025-01-05 15:19:00,"As Shiba Inu declines, WallitIQ rises with 8,950% growth potential, positioning itself as the future of decentralized wallets. #partnercontent"
"Shiba Inu investors flock to AI-powered Altcoin predicted for 50,000% growth in Q2 2025",2025-01-05 13:41:00,"As Shiba Inu investors seek better returns, PropiChain, an AI-powered altcoin, is poised for 50,000% growth by Q2 2025. #partnercontent"
"DTX Exchange, Shiba Inu, and Solana gear up for major Q1 2025 gains as the crypto slump fades",2025-01-05 12:16:00,"Shiba Inu and Solana rebound post-crypto slump, but DTX Exchange steals focus with 600% returns and 2025 growth potential. The crypto market had a rough time before 2025 started. Many of the top crypto coins showed red price charts. But…"
Shiba Inu and PEPE might have met their match with Dogen’s rising popularity,2025-01-05 11:58:00,"Dogen, a new meme coin, is rapidly gaining attention, drawing comparisons to market giants and reshaping the meme coin landscape. #partnercontent"
This crypto is expected to lead the 2025 bull market over Solana and Shiba Inu,2025-01-04 16:04:00,"Solana and Shiba Inu rebound, while Rollblock’s presale success positions it as a top crypto performer for 2025. #partnercontent"
Launch a crypto presale like Shiba Inu or Pepe Coin with Blocksync,2025-01-03 16:12:00,Meme coins like Shiba Inu and Pepe Coin have reshaped crypto. Blocksync powers presale launches with expert tools and strategies. #partnercontent
"AI picks Remittix as the next altcoin to outshine Solana, XRP and Shiba Inu",2025-01-03 13:24:00,"Remittix emerges as a PayFi innovator, challenging Solana, Ripple, and Shiba Inu with seamless crypto-to-fiat solutions. #partnercontent"
"Discover 4 promising crypto coins for 2025: Shiba Inu, Avalanche, Rollblock, Cardano",2025-01-03 06:16:00,"These top crypto coins, Shiba Inu, Avalanche, Rollblock, and Cardano, are set to reshape the 2025 market, with Rollblock’s smart casino model leading the way. #partnercontent"
"This token may turn $540 into $54K in 9 weeks, echoing Shiba Inu and Solana’s 2021 surge",2024-12-31 14:12:00,"Lightchain AI, priced at $0.004, is drawing investor attention, with potential for explosive growth like SHIB and SOL in 2021. #partnercontent"
"Shiba Inu, Dogecoin struggle while Rollblock is targeting 10x gains in Q1 2025",2024-12-30 11:26:00,"Rollblock stands out in the GameFi sector with a robust platform, unique tokenomics, and recent audits affirming its security and compliance. #partnercontent"
Experts tip this new crypto presale to 10x the returns of Dogecoin and Shiba Inu in 2025,2024-12-29 17:17:00,"Meme coins lose momentum as traders shift to Rollblock, with a $7.7M presale and 100x rally potential in 2025. #partnercontent"
"This meme token could surpass PEPE and Shiba Inu with 16,000% returns early 2025",2024-12-29 17:07:00,"A new meme coin is gaining traction, with potential returns of 16,000%, possibly surpassing PEPE and Shiba Inu. #partnercontent"
Big whales are circling Catzilla’s presale – poised to replicate Shiba Inu’s iconic rise to fame,2024-12-29 10:44:00,"Big investors are turning to Catzilla’s presale, hinting at Shiba Inu-like growth potential. #partnercontent"
"Shiba Inu coin price at risk as burn rate, Shibarium fees fall",2024-12-28 17:04:00,"Shiba Inu is highly volatile as its burn rate and Shibarium transaction fees continue to fall.  Shiba Inu (SHIB) retreated to $0.000022, down by 33% from its highest level this month. At last check Saturday, the Ethereum meme coin was…"
Shiba Inu whale expects this coin to outperform DOGE and XRP in the $1 price race,2024-12-24 17:06:00,"Shiba Inu whales eye Lightchain AI at $0.003, a rising altcoin poised to outshine Dogecoin and XRP in growth. #partnercontent"
Investors bet on this $0.0013 token destined to leave Cardano and Shiba Inu behind,2024-12-22 20:50:00,"A $0.0013 cryptocurrency is gaining investor buzz, poised to surpass Cardano and Shiba Inu with its market potential. #partnercontent"
Ethereum whales are accumulating Shiba Inu and Remittix – here’s why,2024-12-22 20:26:00,"Shiba Inu surges 114% YTD, with Ethereum whales driving interest as they accumulate SHIB and Remittix for cross-border payments. #partnercontent"
"Shiba Inu, Bonk, Pepe prices rebound: Beware of dead cat bounce",2024-12-21 16:31:00,"Most meme coin prices rebounded on Saturday, Dec. 21, after falling for most of the week, with their combined market cap rising by 4.7% to $109 billion. Shiba Inu (SHIB) price rose by 12.6% to an intraday high of $0.00002397.…"
This Shiba Inu alternative could 20x and turn $500 into $10000 in 2025,2024-12-20 14:00:00,"Rexas Finance emerges as a credible alternative to Shiba Inu, combining real-world applications and smart solutions with a predicted 20x growth. #partnercontent"
Shiba Inu set for 150% growth as this Solana token promises 1000x in 2025,2024-12-17 21:45:00,Shiba Inu targets 150% price growth but all eyes are on Solana-powered token Catzilla for its projected 1000x return by 2025. #partnercontent
Latest updates and developments in the Shiba Inu coin ecosystem,2024-12-17 15:23:00,"Shiba Inu coin shines with DeFi growth and Shibarium launch, while Lightchain AI Presale attracts early investors. #partnercontent"
1Fuel gains momentum as Shiba Inu and Dogecoin lose investor focus,2024-12-16 14:56:00,"As meme coins fade, 1Fuel’s $0.01 presale and 100x growth forecast make it the top choice for investors seeking real utility. #partnercontent"
Can Shiba Inu price really soar to $1 as burn rate jumps?,2024-12-14 12:32:00,Shiba Inu price continued to consolidate this weekend even as some cryptocurrency analysts remained optimistic.
"Investors eye PropFi boom: $500 on FXGuys, Shiba Inu holders chase $50K returns",2024-12-14 10:01:00,"Meme coins like BONK and Dogecoin surge, but investors shift to DeFi project FXGuys aiming for top 20 crypto status. #partnercontent"
Dogecoin vs. Shiba Inu vs. Catzilla: The race for the meme coin crown intensifies,2024-12-13 21:19:00,"Catzilla enters the meme coin arena, challenging dog-inspired tokens in a heated crypto rivalry sparking buzz and anticipation. #partnerconent"
"Shiba Inu to compete with new crypto promising 10,000% growth in 2025",2024-12-12 22:17:00,"Catzilla’s 10,000% growth potential puts Shiba Inu’s dominance to the test. #partnercontent"
Dogecoin and Shiba Inu backers look to XYZVerse for its unmatched 99x growth potential,2024-12-12 17:21:00,"Crypto enthusiasts eye XYZVerse, a sport-themed memecoin blending memes and passion, tipped as the next big opportunity. #partnercontent"
Shiba Inu highlights and Lightchain AI’s blockchain solutions for December 2024,2024-12-12 05:22:00,"Lightchain AI blends blockchain and AI, launching its presale to redefine decentralized solutions while drawing insights from Shiba Inu’s community-driven success. #partnercontent"
"Shiba Inu success reimagined: Discover the token projected for 20,000% growth",2024-12-11 19:56:00,"A new token with 20,000% growth potential aims to surpass Shiba Inu’s success. #partnercontent"
Shiba Inu’s chart pattern turned $750 into $150K—this new token could follows suit,2024-12-11 17:12:00,"Shiba Inu’s explosive rise turned $750 into $150K in weeks. Now, Rexas Finance shows similar potential. #partnercontent"
"Bitcoin flash crash drags meme coins down, Dogecoin, Shiba Inu, PEPE, Dogwifhat, Bonk hit bottom?",2024-12-11 08:50:00,"Bitcoin crashed nearly 10% below its all-time high of $104,088 to a low of $94,150 on Monday. The flash crash was short-lived, but it dragged down altcoins and meme coins like Dogecoin, Shiba Inu, Pepe, Dogwifhat and Bonk."
The race to $1: Dogecoin vs. Shiba Inu vs. Yeti Ouro,2024-12-10 11:38:00,"Meme coins race to $1: Dogecoin and Shiba Inu lead, while Yeti Ouro eyes the prize with utility-driven growth. #partnercontent"
Shiba Inu price and burn rate are falling: time to sell?,2024-12-09 16:25:00,"Shiba Inu price suffered a harsh reversal on Monday, Dec. 9, as Bitcoin and other altcoins retreated.  Shiba Inu (SHIB) dropped by about 7% to a low of $0.000030, much lower than this month’s high of $0.000033. Other popular meme…"
"Chainlink, Shiba Inu to shine in bull market; experts eye $0.04 token with 50x potential",2024-12-08 18:20:00,"Chainlink and Shiba Inu gain traction in the bull season, but a new trading platform offers 50x potential returns. #partnercontent"
Shiba Inu crypto holders have started accumulating Pepe and new 10X MemeFi coin,2024-12-07 11:45:00,"As Shiba Inu cools off, investors are rotating profits into Pepe and the lesser-known Cutoshi, primed for growth. #sponsoredcontent"
"This new coin outshines Shiba Inu with projected 15,000% growth in 2025 – here’s why",2024-12-07 11:07:00,"A new crypto with a 15,000% growth projection by 2025 is gaining attention, poised to rival Shiba Inu and attract investors. #partnercontent"
Can Shiba Inu and Pepe prices rise to $1 in 2025?,2024-12-06 16:47:00,"Shiba Inu and Pepe have become two of the largest meme coins in the crypto industry, boasting a combined market cap of nearly $30 billion. Pepe (PEPE) trading at $0.00002200, up by over 3,700% from its lowest level in 2023.…"
"Popular altcoins that could rally next: Shiba Inu, and Bittensor, DTX Exchange",2024-12-05 16:35:00,"Shiba Inu, Bittensor, and DTX Exchange lead the bull market, with DTX gaining 500% and experts predicting huge returns. #partnercontent"
"Elja eyes $10K ETH, Shiba Inu shows bullish trend but experts back this token to hit $1 first",2024-12-05 15:18:00,"Elja predicts $10K ETH, Shiba Inu surges, but experts say DTX Exchange will hit $1 first with 500% presale gains. #partnercontent"
"Shiba Inu price could rise 60% as burn rate rises 3,400%",2024-12-03 15:31:00,"Shiba Inu price has retreated for two consecutive days, even as the burn rate jumped by over 3,400%. Shiba Inu (SHIB), the second-largest meme coin, retreated to $0.00002765, down by 16.2% from its highest level this month.  This retreat was…"
"Three cryptos aiming to dominate the market: Toncoin, Shiba Inu, Rollblock",2024-12-03 07:02:00,"Rollblock’s $6.6m presale buzz, Toncoin’s price breakout, and Shiba Inu’s Shibarium upgrade highlight a thrilling race for crypto dominance. #partnercontent"
DTX Exchange tops ahead of Shiba Inu to become most under-rated altcoin in 2025,2024-12-03 01:00:00,"DTX Exchange, a smart new technology, is set to outpace Shiba Inu by leveraging its blockchain and massive growth potential. #partnercontent"
"3 Cryptos to consider buying for Christmas rally – XRP, Shiba Inu, Pepe Unchained",2024-12-02 15:52:00,"December begins with investor optimism for gains. Notable tokens to watch: XRP, Shiba Inu, and Pepe Unchained. #partnercontent"
Shiba Inu soars over 17% on heels of burn rate spike,2024-12-01 17:43:00,Dog-themed meme coin Shiba Inu is currently up by 17.7% for the day and 30% over the past week.
Shiba Inu ignites meme coin buzz while Rollblock dominates the gaming token market,2024-12-01 14:57:00,"November’s bull market surged after Trump’s win, boosting Shiba Inu 60% and gaming token Rollblock’s presale beyond predictions. #partnercontent"
Shiba Inu mirrors Dogecoin’s breakout; here’s what to expect,2024-12-01 08:34:00,"A top analyst sees parallels between Shiba Inu and Dogecoin’s price breakout, with WallitIQ AI token also set for growth. #partnercontent"
4 cryptos like missing out on Shiba Inu in 2021,2024-11-27 22:04:00,Analyzing four cryptos poised to deliver returns similar to Shiba Inu (SHIB) in 2021. #partnercontent
Shiba Inu burn rate dips: can its price recover by 90%?,2024-11-26 14:56:00,"Shiba Inu price joined other cryptocurrencies in a steep sell-off as the recent rally took a breather and the burn rate declined. Shiba Inu (SHIB), the second-largest meme coin, dropped to $0.000024, down by 21% from its highest level this…"
"Whales are eyeing Catzilla: A token with potential to soar 16,900% like Shiba Inu",2024-11-25 20:33:00,"Crypto buzz builds as whales back Catzilla, a meme coin eyeing Shiba Inu’s legendary 16,900% surge and massive potential. #partnercontent"
"Dogecoin, Shiba Inu set the trend; this altcoin is ready to take the spotlight next",2024-11-23 16:10:00,"Meme coins thrive as DOGE, SHIB soar. Cutoshi merges memes with DeFi, driving demand for its viral CUTO token presale. #sponsoredcontent"
From $0.0008 to $50: The next big crypto that could outshine Shiba Inu and Dogecoin,2024-11-23 09:42:00,"A rising crypto aims to outshine Shiba Inu and Dogecoin, sparking investor buzz with its potential for remarkable growth. #partnercontent"
"As Dogecoin and Shiba Inu move closer to $1, XYZVerse gears up for a $10 surge",2024-11-22 17:56:00,"Meme coins near milestones as XYZVerse, an all-sport meme coin, gains buzz for its unique potential and community appeal. #partnercontent"
5000% potential gains: Catzilla coin aims to outshine Shiba Inu next year,2024-11-19 17:35:00,"Catzilla Coin aims to outpace meme coins with 5,000% gains, drawing buzz and a growing community in the crypto world. #partnercontent"
Shiba Inu price prepares a big move as burn rate surges 940%,2024-11-19 13:42:00,"Shiba Inu price is preparing for a massive bullish breakout as its token burn accelerates, the crypto fear and greed index remains in the green zone, and a bullish pattern forms. Shiba Inu (SHIB), second-biggest meme coin, was trading at…"
