title,date,description
"Whale activity around leading assets skyrocketed, showing mixed signals",2024-10-22 07:35:00,"The number of large transactions around some of the leading cryptocurrencies significantly increased as the market witnessed a notable correction. According to data provided by IntoTheBlock, Bitcoin (BTC) leads the chart with a large transaction volume of $43.63 billion on…"
TON blockchain sees significant drop in daily active users,2024-10-21 18:36:00,"The Open Network blockchain has recorded a significant decline in daily active users, according to on-chain data from IntoTheBlock. According to a chart shared on X by the on-chain metrics and analytics provider, the TON network has seen its daily…"
"FXGuys to be next altcoin rocket amid slow momentum on ADA, TON",2024-10-21 13:37:00,"FXGuys is gaining attention as the next altcoin to watch, with predictions of rapid growth amid slowing momentum on ADA, TON. Explore why investors are excited about FXG’s potential. #pressrelease"
"ADA, BNB, Lunex Network see increased market activity on major updates",2024-10-21 07:12:00,"As Cardano and Binance thrive amid market fluctuations, a new contender, Lunex Network, is capturing investor attention with its DeFi features and potential for growth. #partnercontent"
Trader who profited from Solana’s 10x rally now bullish on XRP and Lunex Network,2024-10-20 07:09:00,"Solana soared from $20 to $200, exciting investors. Meanwhile, a trader now sees potential in XRP and Lunex Network for growth. #partnercontent"
"With a 215% rally, this altcoin takes center stage over Solana and XRP",2024-10-20 06:35:00,Investors eye small-cap coins like Rollblock to capitalize on the booming online casino market. #partnercontent
Zig Network may stand out in 2024 when compared to BlockDag and Pepe Unchained,2024-10-20 06:14:00,"Zig Network is gaining attention in the crypto market for its unique approach, outshining BlockDag and Pepe Unchained. #partnercontent"
"Following a 215% rally, this altcoin becomes a top contender over Solana and XRP",2024-10-19 08:57:00,"Investors eye smaller-cap coins for 100x gains. Rollblock aims to disrupt online casinos, enticing Solana and Ripple investors to rotate profits into this promising gem. #partnercontent"
"Analysts say TON, SOL time are past, pick new underdog with 10x potential",2024-10-16 21:00:00,"Analysts believe Toncoin and Solana have peaked, pointing to a new underdog in the crypto market that is gaining attention. #partnercontent"
"Analyst says dump SOL, TRON, focus on PropiChain’s whitelist presale",2024-10-16 18:00:00,"With Solana and TRON struggling, PropiChain’s whitelist presale presents a promising opportunity for investors, potentially offering returns of up to 6000x. #sponsored"
This crypto presale could be the next chance after missing the ETH and TON  ICO’s,2024-10-16 17:05:00,"Top altcoins like Ethereum and Toncoin surged, prompting investors to seek alternatives like Rollblock, which boasts 250% returns. #partnercontent"
"How investors could make 100x with Zig Network over TON, Hamster Kombat",2024-10-16 10:33:00,"Zig Network stands out with its unique revenue-sharing model, offering passive income potential that rivals Toncoin and Hamster Kombat. #partnercontent"
5 altcoins under $1.20 with the potential for 55x returns by late November 2024,2024-10-14 15:38:00,Uncover low-cost altcoins under $1.20 that hold the promise of substantial growth by November 2024. #partnercontent
These 4 SHIB alternatives could turn $900 into $1.2m by April 2025,2024-10-14 14:00:00,"Four altcoins — Rexas Finance, Toncoin, Dogecoin, and Uniswap — could turn a $900 investment into over $1.2 million by April 2025. #pressrelease"
3 Reasons why this token has captured huge attention From Solana and XRP whales,2024-10-13 02:47:00,"GambleFi’s Rollblock is disrupting the $500B iGaming market, attracting Solana and XRP whales in its presale, raising $4.2M. #partnercontent"
"Crypto VC funding: Ithaca leads week with $20m, Delta bags $11m",2024-10-12 14:12:00,"Ithaca and Delta are the top two firms with the highest fundraising for the week, data shows. Held against last week’s modest fundraising, crypto VC funding has seen an uptick in the number and volume of funds raised this week.…"
Investors rush to utility tokens after Mark Cuban calls DOGE and SHIB future rug pulls,2024-10-12 14:00:00,"Mark Cuban labels meme coins as rug pulls and urges investors to consider utility tokens like Rollblock, now in presale. #partnercotent"
Investors turn to CYBRO presale for gains as major cryptos like POL and AVAX decline,2024-10-12 12:48:00,"As major cryptocurrencies decline, investors are flocking to CYBRO’s presale for stable profits, seeking insights on promising digital assets. #partnercontent"
Five reasons why the first Telegram ICO is set to moon,2024-10-11 15:30:00,"Dogizen’s ICO has raised $508k in just a week, marking it as the first-ever Telegram ICO and positioning it for major growth in the rapidly expanding TON ecosystem. #partnercontent"
5 altcoins set for 100x returns – The potential path to a $10M portfolio by 2025,2024-10-11 15:13:00,The cryptocurrency market is heating up with five promising digital currencies poised for exponential growth.  #partnercontent
Analyst who predicted Cardano’s rise from $0.50 to $10 sees 800x growth for these 4 tokens,2024-10-11 13:45:00,An analyst famed for predicting Cardano’s rise now sees four undervalued coins poised for 800x growth. #partnercontent
Curve Finance joins forces with TON Foundation to enhance stablecoin trading,2024-10-11 13:03:00,Curve Finance and the TON Foundation have launched a joint hackathon to advance their Stable Swap Project on the TON blockchain. Decentralized crypto exchange Curve Finance and the TON Foundation have announced a collaborative hackathon aimed at developing a new…
"Here’s why RabBitcoin, Catizen, and Dogs tokens have plunged",2024-10-10 14:58:00,"Most highly hyped Telegram tokens have suffered a harsh reversal, a few weeks after their airdrops and exchange listings. RabBitcoin (RBTC), the token for the Rocky Rabbit ecosystem, has plunged to $0.0000037, down from its September high of $0.000007. Its…"
"Altcoins that could challenge Binance dominance in 2025: SOL, TON, LNEX",2024-10-10 09:07:00,"As top DeFi coins like Solana and Toncoin gain momentum, Lunex Network is emerging as a strong competitor with 18x growth potential, set to challenge the DeFi giants in 2025. #partnercontent"
Dogizen price prediction: First Telegram ICO offers parabolic potential,2024-10-10 08:23:00,"As Telegram gaming hits a $1 billion market cap, Dogizen emerges as the next big contender with 100x potential, following in the footsteps of Catizen and Hamster Kombat. #partnercontent"
Gate.io invests $10m in TON to boost Telegram-based projects,2024-10-09 18:54:00,"Cryptocurrency exchange Gate.io has announced a strategic investment in The Open Network blockchain, eyeing a collaboration that will bolster Telegram-based projects. Gate.io revealed the $10 million strategic investment in the TON blockchain on Oct. 9. The news coincided with a…"
ChatGPT 4.0 predicts which altcoin could turn 10k into 1m: Not SOL or TON,2024-10-09 08:20:00,"ChatGPT 4.0 picked Rollblock, not Solana or Toncoin, as the best altcoin to turn $10,000 into $1 million, thanks to its GambleFi model and revenue-sharing system. #partnercontent"
Massive bull run incoming: Experts predict these 5 altcoins will leap 8000% by 2024,2024-10-07 20:04:00,Crypto analysts predict a monumental surge for select digital currencies. Explore five altcoins expected to gain up to 8000% by 2025. #partnercontent
"Dogecoin whales buy 1B DOGE, Shiba Inu shows promise, DOGEN hits another presale record",2024-10-07 19:54:00,"Investors are buying Dogecoin, Shiba Inu shows growth potential, and DOGEN hits a new presale milestone. #partnercontent"
TON and DOGE feel pressured by revenue sharing altcoin set to hit crypto top 10,2024-10-07 19:00:00,"Toncoin struggles to stay above $6 despite Binance listing, while Rollblock changes the gambling market with huge potential. #partnercontent"
DOGS token price prediction: What’s next for Telegram’s volatile meme coin?,2024-10-07 18:47:00,"The canine-themed meme coin DOGS has been gaining traction in the crypto community with its volatile price swings. Recent events involving DOGS, like its Token Generation Event (TGE) and listing on top crypto exchanges, have led to increased brand awareness…"
UN: Telegram is a hotspot for crypto fraud and laundering,2024-10-07 16:43:00,"A recent United Nations report showed that criminal networks in Southeast Asia are increasingly using the messaging app Telegram to facilitate illicit activities, ranging from trading hacked data to laundering money through unlicensed cryptocurrency exchanges.  The UN Office for Drugs…"
"XRP loses race to $1: Cardano, INTL top new race with $900k inflows",2024-10-07 16:30:00,"Ripple’s legal troubles stall XRP, leading investors to Cardano and Intel Markets. ADA shows stability, while INTL’s AI trading tools attract over $900k in inflows. #partnercontent"
ChatGPT 4.0 answers which crypto will dominate 2025: Not Solana or XRP,2024-10-07 16:00:00,"As Solana struggles to break past $160 and XRP remains below $0.60, analysts and ChatGPT 4.0 highlight Rollblock as a promising new contender with potential for a 100x return in 2025. #partnercontent"
Discover the top 3 memecoins set for explosive growth,2024-10-07 15:42:00,"As the crypto landscape evolves, three standout meme coins are attracting attention for their potential explosive growth in 2024, promising investors opportunities for substantial returns. #partnercontent"
"ETH isn’t surging in October, analysts predict these 3 altcoins will rise instead",2024-10-07 15:10:00,"As Ethereum holds steady this October, analysts highlight CYBRO, which has raised over $3 million in presale and targets a 1200% ROI. #partnercontent"
"Telegram unveils gifts, verification feature as TON fails to pump",2024-10-06 17:20:00,"Toncoin has failed to exhibit a positive surge in price despite Telegram’s recent announcement of new features. Telegram has announced a gift feature alongside a few other new features on their app. However, Toncoin (TON) has failed to showcase a…"
"Giko Cat, inSure DeFi and Sudeng coins exhibit double-digit gains as Solana struggles",2024-10-06 16:24:00,"Giko Cat, Sudeng and inSure DeFi emerged as the top gainers in the last 24 hours with a double-digit surge. CoinGecko data shows that while top coins like Ethereum (ETH) and Solana (SOL) are recovering with a 1-3% surge after…"
"2025 predictions: Shiba Inu emerges as DOGE killer, Rollblock set to dominate",2024-10-06 11:52:00,"Shiba Inu is up over 31% since September, vying to be “the DOGE killer,” while Rollblock may achieve a 100x rally. #partnercontent"
This new crypto sensation could make someone a millionaire,2024-10-06 04:17:00,"A unique crypto trend is emerging, with experts predicting massive growth by 2025. Discover the top contenders poised for gains. #partnercontent"
Cutoshi shakes up meme market with DeFi hub; TON & SHIB investors notice,2024-10-05 19:32:00,"Savvy DeFi traders are eyeing Cutoshi, a new memecoin in presale, attracting attention from Shiba Inu and Toncoin investors. #sponsoredcontent"
"XRP and Solana may rise, but won’t match this new crypto’s performance",2024-10-05 18:24:00,"XRP and Solana face price declines, but optimism remains for Q4. Meanwhile, Rollblock’s new GambleFi protocol could surge 100x at launch. #partnercontent"
"Dogecoin, Render, and Rollblock: Exploring the top cryptocurrencies to buy now",2024-10-05 18:00:00,"Dogecoin and Render may rebound in Q4, but analysts predict Rollblock could see a huge 100x surge post-launch. #partnercontent"
ADA set for a 600% price Spike; Shiba Inu and Dogen aim for $1 before it,2024-10-05 16:07:00,Crypto enthusiasts anticipate major gains as a top asset may soar. Shiba Inu and Dogen also aim for bold growth.  #partnercontent
Whale strategies revealed: These 5 altcoins are primed for 500x returns,2024-10-05 05:34:00,Crypto whales are eyeing altcoins with huge gain potential. Discover five digital currencies experts believe could skyrocket soon. #partnercontent
The largest TON tokens collapsed by 50%: Here are the possible reasons,2024-10-04 17:37:00,"TON ecosystem tokens recently listed on major crypto exchanges have significantly dropped. The largest tokens by market capitalization in the TON ecosystem have seen a sharp decline in the past few days. Relative to the all-time high (ATH), the drop…"
First Telegram ICO begins today amid Telegram boom,2024-10-04 13:20:00,"The rapidly growing Telegram gaming sector, now worth over $1 billion, is set to welcome Dogizen, launching its presale as the first-ever Telegram ICO on October 4th #pressrelease"
Cab driver set to retire after investing in DTX Exchange,2024-10-03 09:56:00,"DTX Exchange stands out as a promising hybrid platform with significant upside, potentially outpacing top altcoins like Dogecoin and Ripple. #partnercontent"
"SHIB, TON, PEPE drive market upwards but RCOF prepares to outrun them",2024-10-01 16:00:00,"Shiba Inu, PEPE, and Toncoin are boosting the market, while RCO Finance aims for a 5000x rally by 2025 with its smart DeFi platform. #sponsored"
WOO surges 17% amid South Korean trading frenzy,2024-10-01 09:26:00,"WOO’s price shot up 17% in the last 24 hours, ranking it as the top performer among the 300 leading cryptocurrencies. WOO (WOO) was exchanging hands at $0.2109 at press time, marking a 59% rise from its monthly low of…"
Hamster Kombat down 59% after airdrop,2024-09-30 14:41:00,Hamster Kombat’s token fell sharply days after the viral Telegram mini-game airdropped millions of tokens to users. Trading data revealed that Hamster Kombat (HMSTR) plunged nearly 60% since its token generation event and exchange listing on Sept. 26. HMSTR’s debut…
Lunex Network Exchange boosts trading with advanced aggregation protocol,2024-09-30 11:16:00,Lunex Network transforms crypto trading by using advanced aggregation to secure the best prices across multiple DEXs. #partnercontent
Lunex Network aims to replace CEXs and DEXs; challenges Binance and Uniswap,2024-09-29 04:03:00,"Binance and Uniswap are losing ground as traders favor Lunex Network, a Layer 1 web3 solution for enhanced security. #paartnercontent"
Lunex Network’s DeFi protocol attracts Shiba Inu and Dogecoin investors,2024-09-28 17:47:00,The memecoin markets lack of returns have left Shiba Inu and Dogecoin investors diversifying with new projects like Lunex. #partnercontent
"Rollblock’s unique growth strategy: How it can measure up to BNB, TON",2024-09-27 06:55:00,"Discover how Rollblock plans to compete with BNB and Toncoin, capturing a piece of the $450B iGaming industry with its smart GambleFi platform. #partnercontent"
TON vs DTX: Altcoins under $10 offering better upside than Avalanche,2024-09-26 19:00:00,"Toncoin and Avalanche gain momentum, while the leading DeFi platform DTX Exchange steals the spotlight by securing nearly $3 million in presale. #partnercontent"
Rollblock’s community focus may outshine memecoins like Dogecoin and Shiba Inu,2024-09-26 15:41:00,"As memecoins like Dogecoin cool, Rollblock emerges, offering passive income through an innovative online casino model. #partnercontent"
"Clock ticking for DTX stage 3 as $2.8m raised from TON, XRP whales",2024-09-26 15:00:00,"As DTX Exchange’s presale stage 3 nears completion, Toncoin and Ripple whales jump in, pushing the total raised amount up to $2.8 million. #partnercontent"
Rollblock gains unprecedented momentum outpacing SOL and TON this year,2024-09-26 07:21:00,"With Solana and Toncoin struggling to gain traction, Rollblock emerges as a hot new crypto, offering investors exciting opportunities in the booming online gambling market. #partnercontent"
"SHIB, TON climb, but this trending altcoin readies to skyrocket",2024-09-26 06:11:00,"Shiba Inu and Toncoin are gaining momentum, but Raboo, an AI-driven memecoin, is emerging as the next major player in the altcoin space. #sponsored"
"Hamster Kombat hints at NFTs, web app after airdrop",2024-09-25 17:55:00,"Less than a day before its airdrop, the Hamster Kombat team shared an updated roadmap with new planned features extending through mid-2025. While users speculated on Hamster Kombat’s (HMSTR) listing price and unhappy users threatened to boycott the viral Telegram…"
"Q4 pump incoming: SOL, DTX Exchange, SHIB to lead as on-chain metrics rise",2024-09-25 15:00:00,"Investors get ready for the Q4 crypto rally: Solana, DTX Exchange, and Shiba Inu show promising on-chain metrics, signaling significant price increases. #partnercontent"
Solana’s 11-month bullish trend in question as other tokens prepare for gains,2024-09-25 14:22:00,"As Solana faces uncertainty, Raboo’s RABT has surged 90% in its presale, with analysts predicting a 233% gain before it ends, positioning Raboo as a standout player. #sponsored"
ChatGPT pinpoints key altcoin set to eclipse top ranking cryptos BNB and Solana,2024-09-25 14:09:00,"Crypto analysts agree with ChatGPT that Rollblock could surpass BNB and Solana, fueled by its GambleFi platform and presale success. #partnercontent"
"Experts bet on ADA, TRX and new hybrid exchange-based token",2024-09-25 12:00:00,"With “Uptober” around the corner and a bull run anticipated, Cardano, TRON, and the emerging DTX Exchange are positioned as top picks. #partnercontent"
"Investors enter Intel Markets presale batch 2 as FTM, AVAX fluctuate",2024-09-25 12:00:00,"Investors are rushing to get their hands on Intel Markets as its presale stage 2 is selling out quickly; meanwhile, Fantom and Avalanche start a bullish uptrend. #partnercontent"
"Reasons why crypto whales are on XRP, Solana, and Rollblock buying spree",2024-09-25 06:08:00,"Discover why crypto whales are heavily investing in XRP, Solana, and Rollblock, and what their price direction and potential gains look like for 2024. #partnercontent"
"Intel Markets soars with $1m Quantum AI research grant as XRP, LINK sinks",2024-09-24 16:00:00,"Ripple’s never-ending drama takes a new turn, and Chainlink ignites outflows post-token unlock, while Intel Markets gains attention. #partnercontent"
XRP faces abandonment while ADA investors jump to fast-gaining altcoins,2024-09-24 15:00:00,"As Bitcoin holds above $64k after the Fed rate cut, investors are shifting focus to DTX Exchange, while Ripple and Cardano struggle to break out. #partnercontent"
Trader who bought SUI at $0.5 now bet on LINK and Intel Markets,2024-09-24 14:45:00,Intel Markets and Chainlink are the latest on traders’ radars after Sui’s explosive growth. #partnercontent
"Viral crypto tokenizing real estate and other real-world assets to outperform TON, TRX",2024-09-24 11:27:00,"Rexas Finance, focused on tokenizing real-world assets like real estate, is gaining attention with its rapid presale success, positioning it to outpace Toncoin and Tron. #pressrelease"
Supposed Hamster Kombat co-founder launches new game,2024-09-23 18:10:00,"Hamster Cash, a hard fork of Hamster Kombat, was allegedly launched by a Hamster Kombat co-founder amid complaints of unfair airdrop allocations. The alleged co-founder, who remains unidentified, reportedly started Hamster Cash to offer a better reward system than Hamster…"
Policymakers compare Intel Markets with 2021 Dogecoin as it overshadows ADA,2024-09-23 18:00:00,"As Cardano slows down and Dogecoin stays steady, Intel Markets is emerging as a promising new contender with innovative features and strong growth potential. #partnercontent"
Telegram’s Durov: User data may be shared with authorities,2024-09-23 17:25:00,"Pavel Durov, the CEO of Telegram, addressed concerns about the misuse of Telegram’s search functionality in a recent post, announcing significant updates to the platform’s moderation policies. In his Telegram post, Durov emphasized that while Telegram’s search feature allows users…"
TON-native wallet announces support for Tron assets,2024-09-23 15:46:00,"MyTonWallet, a wallet application native to The Open Network blockchain, has added support for Tron. The TON wallet announced its multi-chain support in a post on X on Sept. 23, noting that users can now access TronDAO assets via its…"
"DTX Exchange builds excitement with $2.67m presale as TON, XRP whales load up",2024-09-23 07:59:00,"Toncoin and Ripple enjoy massive inflow as market conditions settle; meanwhile, the DTX Exchange soars with a $2.67 million bullish presale rally. #partnercontent"
TON price stalls as investors eye a new altcoin showcasing triple-digit growth,2024-09-22 12:47:00,"Rollblock surges 170% in presale, attracting Toncoin investors amid negative news, with analysts forecasting 880% gains. #partnercontent"
"Crypto VC funding: The Open Network raises $30M, Drift Protocol brings in $25M",2024-09-21 18:26:00,"Our crypto VC funding column, for the week of Sept. 15 to Sept. 21, explores the latest capital-raising efforts: Open Network, Drift Protocol, Helius, Hemi Labs and Pipe Network."
Surprise crypto surge may come this week – here are the top coins to keep an eye on,2024-09-20 19:19:00,This week’s crypto market shift has investors buzzing—find out which digital currencies could be poised for a breakout. #partnercontnt
"TON, ETH holders are betting big on this hidden gem for huge returns",2024-09-20 16:00:00,Big-time Toncoin and Ethereum holders are turning to a new hidden crypto gem that could rise by 30x in the crypto space. #partnercontent
"Multichain Intel Markets becomes leading choice for AAVE, ADA traders post-FOMC",2024-09-20 13:02:00,"Intel Markets, a leading AI-powered trading platform rallies to $370k post-FOMC, with Cardano and AAVE traders diving into the project. #partnercontent"
"ETH, DOT fear losing key price levels; INTL blockchain captures expert attention",2024-09-20 12:00:00,"Amid Ethereum and Polkadot losing key price levels, experts’ attention has been captured by Intel Markets’ AI-powered blockchain. #partnercontent"
SOL prediction for Q4; XRP and new hybrid exchange protocol gain attention,2024-09-19 20:30:00,"Solana is set to close the year above $250. Meanwhile, investors are attracted to XRP and DTX Exchange thanks to their budget-friendliness and growth prospects. #partnercontent"
Telegram trading bot Maestro elevates crypto trading experience,2024-09-19 14:32:00,"Telegram trading bot Maestro simplifies crypto trading with advanced tools like sniping, copy trading, and anti-rug features, helping traders of all levels. #partnercontent"
RedStone debuts first price oracles for TON blockchain,2024-09-19 13:25:00,"Blockchain developer RedStone has integrated its oracle solution into The Open Network, offering the first-ever price feeds on the network. Telegram-incubated The Open Network (TON) is bolstering its decentralized finance ecosystem with RedStone’s launch of the first oracle price feeds,…"
"Intel Markets presale heats up with support from big-time SOL, TON holders",2024-09-18 22:00:00,"Excitement builds around the Intel Markets presale, drawing attention from major holders of Solana and Toncoin as they seek the next big opportunity. #partnercontent"
Elympics: Web3 gaming adoption is driven by platforms like Telegram,2024-09-18 19:25:00,"A recent report commissioned by Elympics, a Web3 gaming protocol, highlighted how Telegram and blockchain technology have transformed the gaming world. The research report, shared with crypto.news and based on feedback from nearly 1,000 global gamers, shows how platforms like…"
Expert consensus foresees 25bps cut and short-term volatility,2024-09-18 16:38:00,"Ahead of the Federal Reserve meeting, markets weighed the expected rate cuts and how asset prices might react over the coming months. Of 114 economist opinions polled by Bloomberg, 104 experts predicted the Federal Reserve would cut funding rates by…"
"ICP price triple bottoms as BOB, MSQ push transactions higher",2024-09-18 12:50:00,"Internet Computer price retreated for the fourth consecutive day as network activity surged following the launch of fair minting protocols in its ecosystem. Internet Computer (ICP) dropped to $7.70, its lowest level since Sept. 9, and 16% below its highest…"
"BNB eyes $600 milestone with CZ’s return, as Raboo poises for top 20",2024-09-17 11:41:00,"Binance Coin eyes a $600 breakout as Raboo gains momentum, positioning itself as a potential top 20 crypto with its smart AI-powered meme platform. #sponsored"
Top cryptos this September with potential to turn $15 into $1250 by January 2025,2024-09-16 17:42:00,"CYBRO’s token presale surges past $2M, drawing crypto whales with a 1200% ROI potential and a $0.03 presale price. #partnercontent"
IntelMarkets: A crypto with 11x growth potential attracting ETH & TON whales,2024-09-15 16:46:00,"IntelMarkets is set to launch an AI trading platform, with 32M tokens sold in Stage 1 and an 11x growth forecast. #partnercontent"
"Layer-2 criticism hits Arbitrum, Optimism; DTX Exchange debuts hybrid blockchain",2024-09-14 12:59:00,"Ethereum L2s Arbitrum and Optimism face criticism and price drops, while DTX Exchange’s layer-1 blockchain excels in presale. #partnercontent"
"Investors pivot from PEPE, DOGE, shift to new hybrid exchange protocol",2024-09-13 18:30:00,"With memecoins like Pepe and Dogecoin plummeting, investors are turning to DTX Exchange for its hybrid trading potential and massive upside. #partnercontent"
