title,date,description
Trader who made $15M on Solana is bullish on CATZILLA as PEPE and WIF rally,2024-11-09 16:20:00,A trader who made $15M from Solana now backs CATZILLA as PEPE and WIF prepare for surges. CATZILLA could be the next big meme coin. #partnercontent
"Investors eye DTX Exchange for DeFi profits after profiting from Dogecoin, Uniswap",2024-11-09 15:58:00,"After profiting from Dogecoin and Uniswap, investors now target DTX Exchange for DeFi gains, with a 300% presale surge and CoinMarketCap listing. #partnercontent"
From spare change to serious cash: How this $100 bet could make $1 million by 2025,2024-11-08 16:34:00,"In crypto’s fast-paced world, small investments today could grow into fortunes by 2025. Discover the strategies behind this potential. #partnercontent"
CATZILLA is poised to dethrone DOGE and PEPE as meme coin leader,2024-11-08 15:28:00,"Crypto world buzzes as CATZILLA’s presale gains momentum, sparking speculation it could surpass DOGE and PEPE. #partnercontent"
"Analysts predict this low-cost token will surge to $10 in 2025, outpacing PEPE and SHIB",2024-11-08 15:07:00,"Market analysts focus on a low-cost token set to soar to $10 by 2025, outpacing PEPE and SHIB, fueling crypto excitement. #partnercontent"
Next meme coin boom: 5 tokens to buy now for potential 50x profits in two months,2024-11-08 14:57:00,"Five meme-based cryptocurrencies are gaining investor attention, with potential for fiftyfold returns in two months. #partnercontent"
"Dogen doubles in value, Chainlink sets sights on $50, XRP faces new legal challenges",2024-11-08 14:35:00,"Crypto market surges: One coin doubles in price, another nears a major milestone, while legal woes loom over a top cryptocurrency. #partnercontent"
"Meme coins explode as Donald Trump wins Bitcoin election, catalyst or coincidence?",2024-11-08 14:00:00,"Crypto traders rejoiced as pro-Bitcoin candidate Donald Trump won the US Presidential election in 2024, leading to numerous potential changes throughout the industry."
DOGE on the verge of crash as whales dump millions to buy into ETFSwap,2024-11-08 11:37:00,"With Dogecoin’s price facing a potential crash, whales are flocking to ETFSwap for its 40,000% growth potential ahead of a bull run. #partnercontent"
5 cryptos under $1 to focus on before end of year,2024-11-08 07:42:00,"Explore top 5 cryptos under $1 with massive growth potential, including DOGEN’s 500% presale surge and established players like Dogecoin, Cardano, and XRP. #partnercontent"
"Ripple bulls hold strong, Tron rises while Cutoshi tops presale charts",2024-11-08 07:08:00,"XRP holds above $0.5 with predictions of a huge surge, Cutoshi’s presale is booming and could hit $0.5 by 2024, while Tron eyes a breakout following its partnership with Chainlink. #sponsored"
"Cardano and Ripple give up on new highs; migrates to PCHAIN for 21,320% returns",2024-11-08 01:00:00,"Cardano and Ripple may rise with a pro-crypto U.S. president, as PCHAIN’s presale surges by 208%. #partnercontent"
How many cryptocurrencies are there? A growing industry,2024-11-07 22:59:00,"The first cryptocurrency appeared in 2009, and today, its name is known by almost everyone — Bitcoin. What made it so intriguing was the promise of a new kind of money: no government interference, full privacy, and everyone having the…"
Dogecoin’s price spike expected to drive gains in these meme coins,2024-11-07 15:30:00,"Dogecoin surges toward $1.50, stirring investor excitement and raising hopes for wider gains across the memecoin market. #partnercontent"
"Cardano on track for major gains by year-end, say market analysts",2024-11-07 15:00:00,"Cardano is set for big gains, while DOGEN is primed for a 700% rise, making it the next meme coin to watch. #partnercontent"
"Meme coins to eye before the bull run begins: XYZ on spotlight with 10,000% potential",2024-11-07 09:11:00,"XYZVerse is leading the charge in the memecoin arena, combining sports fandom with meme culture for explosive growth potential in the upcoming crypto bull run. #partnercontent"
Why Solana and XRP holders are turning to this potential 100x crypto,2024-11-07 06:26:00,"Rollblock is rapidly approaching $5 million in investment, drawing Solana and Ripple holders with its 100x potential to change the online gaming space. #partnercontent"
DOGE on the verge of crash as whales dump millions to buy into ETFSwap,2024-11-06 18:06:00,"With Dogecoin’s price at risk, whales shift to ETFSwap, aiming for a projected 40,000% rally before the bull run. #partnercontent"
"Life-changing gains on Solana and XRP may be over, but this altcoin could 1,000x",2024-11-06 15:52:00,"Solana and Ripple may not see massive gains again, but Rollblock (RBLK) could 1,000x by its presale’s end in early 2025. #partnercontent"
Why Ripple could hit $10 as SEC case nears resolution: Experts predict XRP’s best year yet,2024-11-06 15:44:00,"As Ripple’s SEC battle nears its end, XRP is set for a surge, while DOGEN, the next big meme token, is primed for a 700% pump. #partnercontent"
"5 altcoins to turn $1,500 into $3m if global crypto market cap reaches $5t this cycle",2024-11-06 14:14:00,"With the global crypto market potentially reaching $5 trillion, select altcoins could offer explosive growth, turning modest investments into life-changing returns. #partnercontent"
"DOGE market dominance tops 1%, Cutoshi’s DeFi ecosystem attracts investors as Kaspa plays catch up",2024-11-06 06:38:00,"Dogecoin achieves a market dominance of over 1% with a significant rise of more than 22%; meanwhile, Cutoshi’s DeFi ecosystem is attracting investors, and Kaspa is catching up. #sponsored"
SynFutures launches Perp Launchpad with $1m grant for new tokens,2024-11-05 19:16:00,"SynFutures, a decentralized derivatives trading platform, has launched its Perp Launchpad, designed to help crypto projects establish perpetual futures markets. The platform’s objective is to increase trading access for lesser-known tokens, offering more opportunities for users to engage with a…"
PEPE whales accumulate this sub-$0.10 token set to overtake PEPE by 2025,2024-11-05 18:14:00,"PEPE’s major investors shift focus to a new sub-10-cent token, gaining traction and poised to surpass PEPE by 2025. #partnercontent"
"Overlooked Solana alternative poised to outdo POPCAT, PEPE in the next mega rally",2024-11-05 17:00:00,Read how PropiChain is positioning itself as a Solana alternative. The token is ready to outperform meme coins like PEPE and POPCAT in the next crypto rally. #partnercontent
Three Q4 cryptos experts say could mirror Solana’s success by 2025,2024-11-05 14:28:00,"As Solana sets the bar, investors are eyeing new crypto stars like XYZVerse, a sports-themed memecoin with massive growth potential set to outpace recent token successes. #partnercontent"
Expert recommends 4 Solana alternatives set to explode by Christmas,2024-11-05 12:38:00,"With Solana’s rise and meme coins dominating 2024, XYZVerse is emerging as the all-sport memecoin poised to outperform the competition. #partnercontent"
Whales bag huge profits on SOL as SHIB fluctuates; Rollblock presale booms,2024-11-05 11:12:00,"Rollblock’s presale is heating up as Solana whales profit and SHIB hovers in consolidation, investors prepare for a unique crypto casino opportunity that’s capturing the spotlight. #partnercontent"
"3 cryptos priced less than a coffee cup with 5,300% ROI potential",2024-11-05 09:54:00,"XYZVerse, the first all-sport meme coin, is taking the crypto world by storm, offering a unique blend of sports fandom and meme culture with massive growth potential. #partnercontent"
Death of famous squirrel sparks scandal and meme coin rally: What’s going on?,2024-11-05 09:41:00,The tragic death of a famous internet squirrel Peanut has caused controversy in the United States. Its owner said authorities took the animal away from him and forcibly euthanized it. The story has sparked a surge in interest in the…
Six leading meme coins set to skyrocket in 2024,2024-11-05 08:46:00,Explore the top meme coins that have the potential to outperform Dogecoin’s impressive 2021 rally. #partnercontent
Meme coins surge amid market correction ahead of US election,2024-11-05 07:32:00,"Meme coins gained bullish momentum just hours before the U.S. presidential election while the broader market is wandering in the bearish zone. According to data provided by CoinGecko, the total meme coin market cap increased by 4.3% in the past…"
From hype to reality: what meme coin presales reveal about Trump and Harris,2024-11-04 15:07:00,"In the world of cryptocurrency, Token Generation Events are pivotal moments when a project creates and then distributes its tokens to early supporters, investors, or the public. Before their upcoming TGEs, projects often offer speculative future value in exchange for…"
"SHIB expected to triple, yet DOGEN’s 13,600% potential draws in new investors",2024-11-04 08:39:00,"DOGEN is making waves in the crypto space with a rumored potential for 13,600% growth, drawing in new investors eager to capitalize on this rising meme token. #partnercontent"
Digital asset use surges: How Cardano and Cutoshi are bringing in users,2024-11-04 07:29:00,"Digital asset use has surged, hitting $901m in inflows last week and a record $27b this year, while Cutoshi’s DeFi offerings and Cardano’s new partnership aim to attract more investors. #sponsored"
"Invest smart, play hard – sports meme coins aiming for a massive 99,900% growth",2024-11-04 02:25:00,"XYZverse fuses sports and meme coin culture, offering early access to fans of football, basketball, MMA, and Dota 2. #partnercontent"
$500 investment today could mean $50k tomorrow – 5 altcoins set for the bull run,2024-11-03 17:12:00,"As the crypto market eyes a surge, XYZVerse, a sports-focused memecoin, offers investors a unique, high-growth opportunity. #partnercontent"
How crypto wins the people’s vote: Lessons from the 2024 US elections | Opinion,2024-11-03 11:01:00,The 2024 US elections were littered with examples of masterful communication tactics that can be adopted by crypto projects.
Trump meme coin spikes 40% after ex-President’s Milwaukee rally goes wrong,2024-11-02 12:32:00,"After Donald Trump’s Milwaukee rally was marred by technical issues and what some called an uncharacteristically agitated performance, at least one Trump-themed meme coin jumped in value while others took a significant downturn. Investors, who once rallied around these coins…"
These 4 altcoins could turn $400 into a $1.4 million portfolio by 2025,2024-11-02 12:16:00,"Small crypto investments could yield big returns by 2025, with coins like XYZVerse, an all-sport memecoin, showing high growth potential. #partnercontnt"
These 3 DOGE alternatives could transform a $750 investment into $1 million by 2025,2024-11-01 19:42:00,"A modest $750 investment in the right cryptocurrency could yield extraordinary returns, with three promising alternatives emerging by 2025. #partnercontent"
Buying these 4 altcoins under $1 may be like getting Dogecoin before its 2021 boom,2024-11-01 19:06:00,"Investing in affordable altcoins today could echo the early days of successful cryptocurrencies, with XYZVerse leading the way. #partnercontent"
3 reasons Cardano and XRP investors are rushing to buy this new token under $0.001,2024-11-01 16:31:00,"Investors are shifting focus to XYZVerse, a new token with a low entry price, attracting seasoned traders seeking growth. #partnercontent"
Catzilla ready to claim the meme coin throne and compete with FLOKI and WIF,2024-11-01 10:01:00,"Catzilla, a new meme coin, is generating buzz with potential returns over 1500%, aiming to compete with established favorites like FLOKI and WIF. #partnercontent"
5 meme coins to eye for the November bull run,2024-11-01 07:18:00,"As Bitcoin nears a new all-time high, traders are gearing up for a November bull rally, making now the perfect time to consider these five top meme coins for potential explosive returns. #partnercontent"
Bitget Research: ETFs not the only factor behind Bitcoin’s run,2024-11-01 07:14:00,"Ryan Lee, the chief analyst at Bitget Research, observed that while Bitcoin exchange-traded funds play a major role in driving demand, multiple factors are contributing to Bitcoin’s momentum. Since January 2024, when spot Bitcoin (BTC) ETFs began trading in the…"
"Analyst: ETH, SOL are not the best shot at a 100x win in 2024, but this RWA altcoin is",2024-10-31 03:00:00,Discover why analysts say PropiChain will outperform Ethereum and Solana. It is set to give traders 100x. #partnercontent
Dogwifhat price prediction: another ATH on the way?,2024-10-30 21:45:00,"As Bitcoin hovers near its all-time high of $73k, crypto investors are witnessing a green run, especially in meme coins, including Dogwifhat (WIF).  Launched in November 2023, the WIF token has appreciated almost 170x in price and currently standing at…"
"Popcat up 24% in a week, raising questions if it is a good entry point or not",2024-10-30 21:09:00,"The rise of cat-themed meme coins is here, with Popcat leading a 24% surge this week.  #patnercontent"
"These 3 meme coins could outpace XRP, says Wall Street expert, expecting 7,700% growth",2024-10-30 12:22:00,"Wall Street experts predict that these three meme coins could outpace XRP, with potential growth projections hitting 7,700%. #partnercontent"
Spot Bitcoin ETFs recorded 5-month high inflows of $870m,2024-10-30 06:49:00,"The U.S.-based spot Bitcoin exchange-traded funds have been running wild over the past three weeks, acting as a major catalyst for the market-wide bullish momentum. According to data provided by Farside Investors, spot Bitcoin (BTC) ETFs in the U.S. recorded…"
"RWA altcoin sets ADA community ablaze; AI, and metaverse features to unlock $300t real estate sector",2024-10-29 14:00:00,Cardano could lose support to Propichain as the new altcoin is gaining investor attention for its AI and metaverse features. #partnercontent
Here are 5 cryptos poised for significant gains in the next 30 days,2024-10-28 18:24:00,"Analysts identify five cryptocurrencies poised for significant growth in the coming month, offering exciting investment opportunities. #partnercontent"
Pepe down 4% amid reports of whale dumping on Binance,2024-10-28 17:43:00,"Pepe meme coin faced selling pressure as the broader crypto market dipped, with reports of a whale allegedly selling one trillion coins. Crypto influencer Jake Gagain claimed that an unknown Pepe (PEPE) whale offloaded one trillion tokens, worth approximately $8.7…"
BlockDAG price prediction: $101.5 million raised in token presale,2024-10-28 10:56:00,"Bitcoin ranges near its all-time high, and new crypto tokens continue to make big waves in the cryptocurrency market. One such upcoming cryptocurrency is BlockDAG, a layer-1 blockchain that has managed to raise over $101.5 million (at the time of…"
Which meme coin will reach $1?,2024-10-28 10:30:00,"Meme coins are those quirky cryptocurrencies that started out as internet jokes but have surprisingly turned into major players in the financial world, racking up billions in trading volume. Yet, despite all the buzz, even the biggest meme coin, Dogecoin,…"
IntelMarkets records historic volume surge after Quantum Wallet; SHIB whales join in,2024-10-27 15:22:00,"Ahead of the US election, IntelMarkets sees historic volume surges after launching its Quantum Wallet, attracting SHIB whales. #partnercontent"
Aqua Doge could be the next big meme coin as early investors rush into its presale,2024-10-27 13:45:00,"Aqua Doge raises over $200k in its presale, featuring a play-to-earn game and aiming to reshape crypto gaming. #partnercontent"
Beyond DOGE and SHIB: Identifying the next crypto gem with 100x growth potential,2024-10-26 12:49:00,"In the crypto landscape, new growth opportunities emerge constantly. This article guides you to uncover undervalued assets with potential for massive returns. #partnercontent"
Experts predict these altcoins could explode with 200x returns as Bitcoin aims 100K,2024-10-25 16:08:00,"As Bitcoin approaches record highs, analysts spotlight XYZVerse, a meme coin uniting sports fans and promising big returns. #partnercontent"
A top analyst predicts Lunex Network will outpace DOGE and SHIB this cycle,2024-10-25 15:48:00,"Meme coins like WIF, BONK, and PEPE have surged, but analysts now predict Lunex could outpace SHIB and DOGE this cycle. #partnercontent"
Tron could flip key price as Justin Sun predicts big moves ahead,2024-10-25 14:51:00,"Tron token rallied for six consecutive days, reaching its highest level since August as Justin Sun made a bold prediction about its ecosystem. Tron (TRX), the tenth-largest cryptocurrency, rose to $0.166 as it approached the important resistance point at $0.1700.…"
DOGE whale that sold at the $0.7 peak buys this RWA token to get similar returns,2024-10-25 13:08:00,"A Dogecoin whale who sold at the $0.7 peak invests in PropiChain (PCHAIN), aiming to replicate massive returns through real-world asset tokenization. #partnercontent"
"Bold crypto predictions for 2025: Dogecoin at $1, XRP at $5, Dogen at $10",2024-10-25 08:13:00,"Popular cryptocurrencies could reach remarkable new highs by 2025, with DOGEN leading the charge as the strongest meme token in the market. #partnercontent"
These meme coins could turn investor strategy into a 300x fortune,2024-10-25 07:19:00,The crypto community believes XYZVerse has the potential to transform small investments into massive fortunes overnight. #partnercontent
"These 3 penny cryptos could skyrocket a portfolio by 20,000% by early 2025",2024-10-24 15:55:00,"Investors target small-cap coins for extraordinary returns, with XYZVerse emerging as a promising meme coin for growth by 2025. #partnercontent"
Cardano whale shocks community with ADA prediction: Will lose to this altcoin by December,2024-10-23 19:00:00,"A Cardano whale predicts that the ADA price may underperform against the rising altcoin RCO Finance by December 2024, stirring interest in the crypto community. #sponsored"
This under-$0.30 token is following in SHIB and POL footsteps,2024-10-23 16:34:00,"A low-priced token under 30 cents is gaining traction, echoing SHIB and POL’s success. #partnercontent"
These 5 meme coins are set to start trending higher this month – potential for 100x,2024-10-23 16:11:00,"In the crypto space, five emerging meme coins are attracting investor attention this month, poised for significant growth. #partnercontent"
"Solana vs Ethereum: Why SOL is winning in speed, users, and adoption",2024-10-23 15:59:00,"Are we witnessing a major shift in blockchain adoption as Solana’s user numbers skyrocket, or will Ethereum’s continued dominance in high-value applications keep it ahead in the long run? Solana’s massive comeback Solana (SOL), one of the most promising blockchain…"
"PropiChain attracts Solana and Cardano investors seeking 8,000x profit potential",2024-10-23 15:38:00,"With Solana and Cardano dipping over 3%, investors are flocking to PropiChain for potential 8,000x gains. #sponsoredcontent"
XYZVerse readies to surpasses DOGE and SHIB in the bull run,2024-10-23 14:47:00,"The crypto market is buzzing with new memecoins, and XYZVerse is gaining traction as the first all-sport memecoin, targeting remarkable growth and promising returns. #partnercontent"
"BTC action causes fear among investors, many jumping to these high-growth tokens",2024-10-23 14:22:00,"As Bitcoin fluctuates, investors are eyeing promising altcoins like DOGEN, MEW, MANTRA, Jupiter, and Aave for potential gains. #partnercontent"
"Whale resurrects after 3-year hiatus, dumps $400k worth of ADA to buy this AI competitor",2024-10-23 13:02:00,"A dormant Cardano whale resurfaces after three years to sell $400,000 worth of ADA and reinvest in the emerging AI competitor WallitIQ, sparking interest in the presale. #sponsored"
"Amid DOGE, SUI fluctuations, Cutoshi’s impressive utility attracts interest from crypto whales",2024-10-23 10:14:00,"As altcoins like DOGE rebound with a 33% increase, the spotlight is shifting to the presale success of Cutoshi, a hybrid MemeFi project that’s quickly gaining traction. #sponsored"
BEAM futures open interest hits 3-month high as it secures top gainer spot,2024-10-23 10:03:00,"While the rest of the crypto market slumped, BEAM was up 7.4%, emerging as the leading gainer among the top 100 cryptocurrencies on Oct. 23. Beam (BEAM) rose for five consecutive days to an intraday high of $0.0198, a 27%…"
Here’s why Lunex Network may outpace Cardano and XRP in the race To $1,2024-10-22 18:09:00,"Cardano and XRP gain momentum as bullish sentiment rises post-Bitcoin recovery, while Lunex Network’s presale exceeds $1M. #partnercontent"
ETH bulls push for $12k before SOL reaches $1k; Why this altcoin rival is better,2024-10-22 18:00:00,"While Ethereum bulls aim for ETH to hit $12,000 before Solana reaches $1,000, ETFSwap stands out as a better alternative. #sponsored"
"After profiting from Bitcoin, this trader shares these 5 memecoins to build a $50M portfolio",2024-10-22 17:57:00,"After success with Bitcoin, a savvy trader shifts to memecoins, aiming to turn $500 into $50 million with five promising picks. #partnercontent"
D3 launches .APE domain names for ApeCoin users,2024-10-22 16:21:00,"D3 Global, a web3 domain name company, has launched top-level domain names for the ApeCoin community. An announcement the firm published on Oct. 22 noted that the ApeCoin (APE) ecosystem can now use the .APE top-level domain names on the…"
"ETH’s powerful comeback to drive a bull run for these altcoins with 5,000% upside",2024-10-22 13:46:00,"As Ethereum strengthens, altcoin rallies are on the horizon, with XYZVerse positioning itself as a standout meme coin that blends sports enthusiasm with significant growth potential. #partnercontent"
Why investors should lower expectations for ADA and consider other crypto,2024-10-22 08:11:00,"As Cardano struggles to regain its former glory, the emerging sports memecoin XYZVerse could redefine growth opportunities for investors seeking fresh prospects. #partnercontent"
"This undervalued meme coin readies to explode, outshining FLOKI, BONK",2024-10-22 06:47:00,"While FLOKI and BONK grab headlines, a lesser-known memecoin, DOGEN, is poised for a major surge, attracting savvy investors eager for significant gains. #partnercontent"
How many Pepe coins are there?,2024-10-21 20:48:00,"Launched back in April 2023, Pepe took only a short time to become one of the most popular meme coins in the world of crypto and one of the top ones alongside the likes of Doge, Shib, and others. At…"
"From $1,200 to $1.2M: These 3 meme tokens offer the potential for attractive gains",2024-10-21 18:03:00,Meme tokens can turn small investments into fortunes. Here are three coins poised for rapid growth. #partnercontent
"5 altcoins that could achieve 5,000% returns in the coming month",2024-10-21 17:12:00,"Emerging tokens are poised for growth in the evolving crypto landscape, with investors eyeing XYZ, a unique memecoin. #partnercontent"
"SOL and XRP are set for a 2025 breakout, potentially jumping 2,000% and 900%",2024-10-21 15:45:00,"Solana and XRP are attracting attention, with Solana’s cup-and-handle pattern poised for new highs and XRP aiming for a 900% surge. #pressrelease"
BTC whale who made $34m on DOGE makes big bet on this viral ETH token,2024-10-21 14:02:00,"A popular Bitcoin whale who made $34,000,000 from Dogecoin bets $2,000,000 on ETFSwap to rally 120x in Q1 2025. #partnercontent"
Solana vs. XRP vs. Rollblock: A race for 50x returns in the coming months,2024-10-20 07:24:00,"Solana, XRP, and Rollblock are among the top altcoins to watch. Rollblock’s presale at $0.0315 attracts investors eyeing 50x returns. #partnercontent"
"With a 215% rally, this altcoin takes center stage over Solana and XRP",2024-10-20 06:35:00,Investors eye small-cap coins like Rollblock to capitalize on the booming online casino market. #partnercontent
"Dogecoin surges 10%, but analysts say Dogen could deliver 100x bigger gains",2024-10-19 08:09:00,"A meme cryptocurrency surged 10%, but analysts highlight another coin, Dogen, with potential gains of up to 100 times. #partnercontent"
"ADA, XRP, and Dogecoin are poised to be the top performers in the 2024 crypto market",2024-10-18 16:31:00,"As 2024 nears, Cardano, Ripple, and Dogecoin are in the spotlight for potential growth. Explore what drives their success. #partnercontent"
"Cardano is strong, but traders eyeing meme coins for fast triple-digit gains",2024-10-18 16:04:00,"Cardano remains a solid investment, but seasoned traders are now eyeing meme coins for quick, triple-digit profits. Discover which coins are poised for growth in this emerging trend. #partnercontent"
SOL price prediction: SOL risks $100 as bearish flag formation opens up,2024-10-18 16:00:00,"Technical indicators suggest that Solana’s price may drop to $100, yet investors remain optimistic about a potential rise to $1,000, actively participating in the ETFSwap presale. #sponsored"
Hachiko is the new meme coin to rally with 933% gain; this crypto could explode next,2024-10-18 14:28:00,"Hachiko, a new Solana-based dog coin, surged 933% in one day, while presale Crypto All-Stars is poised for significant gains. #partnercontent"
"Crypto that could turn $1000 into $100,000: ETH, ADA, Rollblock",2024-10-18 08:11:00,"Investors are shifting their focus to Rollblock, a promising new crypto project with potential for massive gains, having raised over $4.5 million in presale. #partnercontent"
"Dogecoin, Solana whales show interest in new DeFi coin with 1,800% potential",2024-10-18 06:46:00,"Dogecoin and Solana whales are turning their attention to a new DeFi coin, which analysts predict has a 1,800% growth potential. #partnercontent"
