title,date,description
Hamster Kombat to debut layer-2 network on TON after failed airdrop,2024-12-27 16:55:00,"Hamster Kombat, once a top Telegram game, is turning to blockchain development on TON after struggling with declining popularity. Hamster Kombat, a tap-to-earn game built on Telegram, is showing signs to deepen its blockchain roots, this time launching a layer-2…"
"Ex Wall Street analyst predicts 9,500% rise for CATZILLA, outpacing KASPA, TON",2024-12-27 16:31:00,"Wall Street predicts CATZILLA could surge by 9,500%, positioning it as a standout meme coin poised to outpace Kaspa and Toncoin. #partnercontent"
Bybit adds TON staking with Tonstakers integration,2024-12-27 16:14:00,"Crypto exchange Bybit has announced the integration of Tonstakers to bring new staking opportunities to its users. This follows the exchange’s announcement on Dec. 27 that its web3 wallet now supports the TON blockchain’s leading liquid staking protocol, Tonstakers.  By…"
OKX Ventures 2024 report: injected $100m in more than 60 projects with AI and Bitcoin focus,2024-12-26 14:45:00,"OKX Ventures’ annual report for 2024 revealed the firm made a total of $100 million in investments throughout 2024 in more than 60 projects, with AI and Bitcoin-related projects taking up the largest portion. According to the shared X post,…"
Dogizen presale frenzy: The project ready to surpass all new meme coins,2024-12-26 06:57:00,"Dogizen emerges as the first-ever Telegram ICO, blending canine meme coin appeal with GameFi innovation to target the next crypto bull run. #pressrelease"
This week’s top crypto picks – 6 altcoins primed for 2025 profits,2024-12-25 16:00:00,Crypto investors seek the next big opportunity; here are six altcoins poised for massive growth by 2025. #partnercontent
Lightchain AI: Why it’s a better investment than Solana or Ripple in 2024,2024-12-25 11:00:00,"Lightchain AI gains traction in 2024, blending AI and blockchain, challenging Solana and Ripple at just $0.0037. #partnercontent"
"Solana hits $250, Dogecoin nears $0.5, Lightchain AI soars 30,000% to $5",2024-12-25 05:02:00,"Discover why Solana, Dogecoin, and Lightchain AI are top picks for 2025, with LCAI predicted to rally by 30,000%. #partnercontnt"
Top 3 altcoins set to deliver big returns before ETH’s move,2024-12-24 22:30:00,"As Ethereum’s next move captures attention, these three altcoins are poised to steal the spotlight with big returns. #partnercontent"
Analysts: This altcoin has the potential to surpass established cryptos,2024-12-24 20:55:00,Market analysts believe Lightchain AI could surpass established cryptocurrencies. #sponsored
Shiba Inu whale expects this coin to outperform DOGE and XRP in the $1 price race,2024-12-24 17:06:00,"Shiba Inu whales eye Lightchain AI at $0.003, a rising altcoin poised to outshine Dogecoin and XRP in growth. #partnercontent"
Post-correction boom – crypto analysts predict this altcoin will outperform SOL and XRP,2024-12-24 16:42:00,"Crypto shifts focus to Lightchain AI, blending AI and blockchain at $0.003, with analysts eyeing it as the next big altcoin. #partnercontent"
5 low-cap crypto picks for December 2024 that could surge beyond Solana and TRX,2024-12-24 02:56:00,"5 small-cap cryptocurrencies are poised to outperform Solana and TRX by 2024, offering remarkable growth potential. #partnercontent"
Investors turn to Lightchain AI 3000x potential after PEPE drop,2024-12-23 22:32:00,"As PEPE declines, investors are flocking to Lightchain AI for its 3000x growth potential. #partnercontent"
Escape the crash: These 5 cryptos could protect against the $10k collapse,2024-12-23 17:52:00,Crypto market braces for a plunge: Discover 5 cryptocurrencies that could offer stability and safeguard investments. #partnercontent
Coins below $1 ready to surge: Lightchain AI and Cardano,2024-12-23 12:11:00,"The under-$1 crypto market is buzzing with potential, led by Lightchain AI and Cardano, both poised for significant growth. #partnercontent"
Breaking out 3 low-cap altcoins inventors can’t afford to miss right now,2024-12-22 19:59:00,"Savvy investors are eyeing Lightchain AI, AeroChain, and GreenNode Protocol for big returns. #partnercontent"
DOGE & SHIB holders embrace Lightchain AI for its growth and unique sports-crypto vision,2024-12-22 18:53:00,"Dogecoin and Shiba Inu investors are flocking to Lightchain AI, a game-changing sports-crypto project with real-world utility. #partnercontent"
TON blockchain data now live on Dune,2024-12-19 14:57:00,"The Open Network, a blockchain originally developed by Telegram, is now integrated with Dune , a platform for on-chain data exploration.  This integration allows developers, analysts, and blockchain enthusiasts to access and study TON’s ecosystem activity through custom dashboards and…"
"Cardano, Dogecoin, XRP, and XYZVerse: Bold 2025 bull run price predictions inside",2024-12-18 17:44:00,"Amid the crypto upswing, XYZVerse unites sports fans in a dynamic ecosystem, set to lead the next market wave. #partnercontent"
"Ethereum and Solana may stall, but this $0.001333 gem aims for 7,402% ROI by year-end",2024-12-17 19:51:00,"As Ethereum slows, emerging tokens like XYZVerse, the first all-sport memecoin, promise exponential returns in a bullish market. #partnercontent"
"2025 to be huge year for BlockDAG with $1 forecast; Developers join SOL’s ecosystem, XLM to climb",2024-12-17 17:00:00,Discover BlockDAG’s $1 forecast for 2025 as Solana’s ecosystem attracts developers and Stellar price hints at a climb. #pressrelease
"Amid market correction, ETH, TON traders see benefits of Rollblock’s deflationary crypto",2024-12-17 06:52:00,"Corrections may sting, but Rollblock proves its resilience, blending DeFi and online gaming to outshine struggling giants like Ethereum and Toncoin. #partnercontent"
AI predicts XRP surpassing ETH this cycle — but the real crypto winner could be XYZ,2024-12-16 19:55:00,"Crypto buzz grows as XYZVerse, a meme coin for sports fans, sees big gains and is hinting at a major market shake-up. #partnercontent"
"Why selling XRP, SOL, and ADA in 30 days could unlock these altcoin gems",2024-12-15 16:01:00,"Bitcoin hits $100K, XRP, SOL, ADA soar, but investors eye XYZVerse, a meme coin uniting sports fans with growth potential. #partnercontent"
Best altcoins to watch as phase 2 of the bull market prepares for liftoff,2024-12-15 12:27:00,"As crypto rebounds, XYZVerse stands out, uniting sports fans and esports enthusiasts in a thriving meme coin community. #partnercontent"
"This new meme presale targets 99,900% growth and top 20 status by 2026",2024-12-14 19:21:00,"Meme coins like DOGE and PEPE delivered massive gains; now XYZ enters, merging sports with memes for fresh, exciting potential. #partnercontent"
Prepare for the 2025 crypto bull market with this ultimate guide,2024-12-14 18:00:00,"Investors eye the next crypto surge as XYZVerse merges sports fandom with meme culture, promising growth through engagement. #partnercontent"
"Pepe Unchained jumps 500%, new meme coin to steal the show in Q1 2025",2024-12-14 00:03:00,"Pepe Unchained’s 500% debut stirs hype, but XYZVerse aims to dominate Q1 2025. #partnercontent"
"Massive 16,900% growth predicted for this new Polygon meme coin, surpassing SHIB and PEPE",2024-12-13 17:45:00,"XYZVerse, a new all-sport meme coin on Polygon, eyes 20,000% growth, aiming to outpace SHIB, PEPE, and lead the bull market buzz. With the bull market surging and Bitcoin smashing through milestones, a new meme coin on the Polygon network…"
Hong Kong’s crypto broker OSL adds support for TON into OTC services,2024-12-13 08:50:00,"OSL Digital Securities has expanded its OTC offerings with the addition of Toncoin, boosting investor access to The Open Network’s native token. Hong Kong‘s regulated crypto broker OSL Digital Securities has added Toncoin (TON) to its over-the-counter trading services, allowing…"
How this low-cap AI coin could outperform 2024’s top cryptos,2024-12-12 23:13:00,"CYBRO is quickly gaining traction and could outpace top cryptos like Solana, Sui, and Toncoin. #partnercontent"
Chainlink price hits 3-year high as open interest spikes to all-time high,2024-12-12 15:37:00,"Chainlink is among top gainers on Dec. 12 as its price breaks to its highest level in nearly three years, with this coming as futures open interest spiked to an all-time high. Data from on-chain and financial metrics provider Glassnode…"
"ADA eyes $2, TON aims for $10, while BlockDAG dominates crypto mining with over 14.6k miners sold",2024-12-10 17:00:00,Discover why BlockDAG is the leading crypto to mine with over 14.6k mining rigs sold. Get the latest on Cardano’s price target nearing $2 & Toncoin’s push towards $10. #partnercontent
TON Accelerator partners with Bybit to advance cross-chain innovation,2024-12-09 14:38:00,"TON Accelerator and crypto exchange Bybit have partnered to launch the Cross-Chain Synergy Cohort. This program aims to help developers create projects compatible with multiple blockchain networks. It seeks to connect the TON (TON) ecosystem, associated with the Telegram Open…"
6 tokens that could help build a 7-figure crypto portfolio in the next 6 months,2024-12-09 14:24:00,"Cryptos like Bitcoin and Ethereum lead, but 6 altcoins could grow your portfolio to 7 figures in 6 months. #partnercontent"
New cryptocurrency to mine for free: Top 10 projects,2024-12-06 19:18:00,"In the early days of crypto, mining felt like an adventure for many, a hands-on way to dive in and start earning. Since this is a complex process that requires expensive and energy-intensive equipment, crypto mining on phones is becoming…"
Ethereum leads the bull season as BNB investors diversify with Rollblock,2024-12-05 09:30:00,"Ethereum surges with record inflows while Rollblock’s GambleFi project captures trader attention, promising 880% gains amid BNB’s security struggles. #partnercontent"
How Dogizen’s partnerships and $1.4m raised threaten rivals like Catizen,2024-12-04 17:12:00,"Telegram gaming hits $1.3B market cap as Dogizen raises $1.4M presale, partnering with top players to capture massive growth. #pressrelease"
5 cryptos primed to trigger the next bull market frenzy before December ends,2024-12-04 15:48:00,"December’s crypto surge sees Ethereum, Solana shine, while Lightchain AI and Just a Chill Guy spark investor excitement. #partnercontent"
Ethereum’s next ATH imminent; POL and Rollblock positioned for massive breakouts,2024-12-04 14:27:00,"Ethereum eyes new ATH after outperforming Bitcoin, as Polygon surges and Rollblock’s presale hints at explosive potential. #partnercontent"
5 coins that may rocket crypto portfolio 8500% during altcoin season,2024-12-03 16:55:00,"Savvy investors eye explosive returns in the upcoming altcoin season, with some cryptos promising up to 8500% gains. #partnercontent"
Bitcoin dominance crumbles: Top 10 beginner friendly altcoins to watch,2024-12-03 15:22:00,"Bitcoin (BTC) dominance dips to 55.81%, down from its November 2024 top of 61.53%. Declining BTC dominance has paved the way for the altcoin season with over 75% of the top 100 altcoins outperforming Bitcoin consistently. Let’s deep-dive into top 10 beginner-friendly altcoins to buy in December 2024."
6 tokens that could turn $600 into $18000 in the next 60 days,2024-11-29 13:46:00,"Six altcoins, including Rexas Finance and Shiba Inu, could turn a $600 investment into $18,000 in just 60 days as the crypto market heats up. #partnercontent"
"These 5 cryptos could turn $744 into $74,400 in the next 3 months",2024-11-28 12:15:00,"Amid the current bull run, Rexas Finance and four other tokens are set to redefine crypto profits in the coming months. #partnercontent"
"5 overlooked altcoins that could deliver 15,000% gains",2024-11-26 21:00:00,"These five under-the-radar altcoins could be the key to unlocking 15,000% gains. #partnercontent"
How Telegram made over half a billion dollars thanks to crypto?,2024-11-26 15:22:00,"Telegram’s revenue soared to $525 million in the first half of 2024 before its founder, Pavel Durov, was arrested on charges of criminal activity on the platform. According to Financial Times, Telegram has told investors that Durov’s detention by French…"
AI predicts a crypto that may surpass TON and DOGE,2024-11-25 13:05:00,"AI forecasts highlight rising stars in crypto, with TON, Dogecoin, and presale sensation Minotaurus poised for significant growth and investor interest. #partnercontent"
"Multichain AI token poised to dethrone SOL, TON: 5,000% gains expected",2024-11-25 12:11:00,"A new AI-powered multichain crypto, CYBRO, is disrupting the market with projections of up to 5,000% growth, attracting investors eager for the next big opportunity. #partnercontent"
AI says this new DeFi coin could outshine SOL and DOGE in 2025,2024-11-20 06:55:00,"As Solana and Dogecoin steadily rise with the bull market, Lunex Network emerges as a top pick for potential high returns, driven by unique DEX features and solid fundamentals. #partnercontent"
"TON, SUI target $10 this cycle while whales rush to new DeFi coin",2024-11-19 10:37:00,"Discover why Toncoin and Sui are targeting the $10 mark this cycle, and why investors are increasingly buying LNEX tokens. #partnercontent"
Centralized exchanges face a hard blow amid cooling liquidations,2024-11-18 07:20:00,"Bitcoin’s sideways movement close to the $90,000 mark has calmed down the broader cryptocurrency market with declining trading volumes on centralized exchanges. Binance, the largest crypto exchange by trading volume, saw a 15.2% decline in its daily trading volume to…"
"5 penny cryptos that could turn pocket change into a $100,000 portfolio",2024-11-16 20:06:00,Penny cryptocurrencies offer high-return potential for low investment—explore 5 promising coins under $1 poised for growth. #partnercontent
"Forget SOL and TON: This AI-powered token could deliver 5,000% gains by 2025",2024-11-15 20:48:00,"Solana and Toncoin soar, but a rising AI-powered token aims for 5,000% growth by 2025, blending AI with blockchain innovation.#partnercontent"
"Experts predict massive gains for Avalanche, Sui, and Lunex Network this cycle",2024-11-15 16:00:00,"Bitcoin’s rally toward $100,000 is sparking altcoin momentum, with experts eyeing major gains for Avalanche, Sui, and Lunex Network in the coming cycle. #partnercontent"
"DOGE surge suggests 45% rally, while TON soars 15%, Yeti Ouro attracts investors",2024-11-15 15:00:00,"Dogecoin’s rally continues as it nears a $60 billion market cap, while Toncoin and Yeti Ouro gain traction amid a bullish market. #partnercontent"
TRON picks up momentum while this new DeFi token skyrockets,2024-11-14 18:11:00,"Meme coins lead the bull run as DOGE nears all-time highs; DTX Exchange soars, set to reshape trading markets. #partnercontent"
Exploring the ecosystem and features of PirateCash,2024-11-14 14:57:00,"Pirate Cash is redefining crypto ecosystems with its treasure hunt, staking, and privacy-focused services, offering investors a unique way to engage and earn in DeFi. #projectreview"
Solana targets for 2025; Lunex Network shakes DeFi market with 18x potential,2024-11-14 07:17:00,"Fueled by Trump’s victory, the crypto market is surging, with Bitcoin aiming for $100k and analysts eyeing massive gains for Solana and Lunex Network. #partnercontent"
"XRP eyes $1 as TON shows phenomenal growth, Yeti Ouro dominates the P2E market",2024-11-13 08:09:00,"As the crypto bull run gains momentum, Ripple, Toncoin, and Yeti Ouro are capturing attention, with YETIO leading the Play-to-Earn gaming sector. #partnercontent"
SHIB targets $0.00003500 as ADA breaks out of consolidation to reclaim $0.60,2024-11-13 07:29:00,"Shiba Inu sets its sights on a $0.00003500 target, while Cardano breaks out of consolidation to reclaim $0.60. #partnercontent"
"Holders invest $1k in these 5 altcoins for potential 5,000% gains",2024-11-12 11:28:00,"Explore five altcoins with explosive growth potential, including CYBRO’s unique NeoBank platform that’s already raised $4 million in presales. #partnercontent"
XRP fails to capture bull market momentum as crypto whales find solace in Solana,2024-11-12 08:08:00,"The bull market lifts Solana past BNB, while XRP lags and Lunex Network catches whale attention. #partnercontent"
"Bitcoin soars to $76.8K, but analysts say these 5 altcoins will dominate the bull run",2024-11-11 18:41:00,"Bitcoin hits record highs, but experts eye five altcoins poised to outshine it in this bullish market. #partnercontent"
Truflation launches GameFi Index to track hottest gaming tokens,2024-11-11 17:15:00,"Truflation has announced the launch of GameFi Index, a new tool designed to track the performance of top blockchain-based gaming tokens. In its Nov. 11 announcement, Truflation stated that the GameFi Index goes beyond tracking the price of individual play-to-earn…"
"Solana skyrockets to 7-month high, crosses $200, analysts forecast massive upsurge",2024-11-11 09:47:00,"Solana reaches a 7-month peak, breaking past $200, with analysts anticipating a strong continued uptrend and potential for further gains. #partnercontent"
"SHIB eyes a new ATH, positioning itself as the safest bet of Q4 2024",2024-11-09 17:32:00,"SHIB’s ATH was three years ago, now down 78%, with resistance at $0.000019. Despite a 125% surge this year, SHIB holders eye 100x opportunities in DeFi and web3. #partnercontent"
Low-cap cryptos with high potential: $1K today could turn into $1M by 2025,2024-11-08 14:47:00,"Some lesser-known cryptocurrencies are showing signs of explosive growth, potentially turning small stakes into fortunes by 2025. #partnercontent"
SOL and TON face off: Analysts debate which has the better potential in Q4,2024-11-08 08:14:00,"With Donald Trump’s election win sparking market optimism, Solana and Toncoin are vying for supremacy, each with compelling arguments for Q4 growth. #partnercontent"
This new altcoin touted ‘future of DeFi’ could clip SHIB and TON before 2026,2024-11-07 06:55:00,"As Toncoin and Shiba Inu struggle, Lunex Network gains traction with its DeFi features and promising 1,800% upside. #partnercontent"
"SOL faces decline as XRP and this new crypto stand strong, winning trust",2024-11-06 11:04:00,"As Solana struggles, Lunex Network and XRP rise as strong alternatives, with Lunex poised for explosive growth. #partnercontent"
Three Q4 cryptos experts say could mirror Solana’s success by 2025,2024-11-05 14:28:00,"As Solana sets the bar, investors are eyeing new crypto stars like XYZVerse, a sports-themed memecoin with massive growth potential set to outpace recent token successes. #partnercontent"
"3 cryptos priced less than a coffee cup with 5,300% ROI potential",2024-11-05 09:54:00,"XYZVerse, the first all-sport meme coin, is taking the crypto world by storm, offering a unique blend of sports fandom and meme culture with massive growth potential. #partnercontent"
"TON, Intel Markets aim to hit new ATH this year while DOGE promises limited gain",2024-11-05 06:35:00,"Toncoin declines over 40% from ATH, sparking uncertainty about a new peak. Meanwhile, Intel Markets, a new AI coin, could be the next to hit a $1 billion market cap, outshining Dogecoin. #partnercontent"
Dogecoin price is holding steady as crypto pro sees more gains,2024-11-04 16:02:00,"Dogecoin’s price held steady on Monday, outperforming other large-cap coins as traders focused on Tuesday’s U.S. presidential election. Dogecoin (DOGE), the largest meme coin in the industry, rose to $0.1570, marking a 10% increase from its lowest level on Sunday.…"
TON Accelerator unveils $5m program to drive cross-chain product growth,2024-11-04 14:56:00,"TON Accelerator, an incubation project for The Open Network blockchain, has launched a new program aimed at accelerating innovation and adoption within the TON ecosystem. On Nov. 4, the TON Accelerator team announced the launch of a $5 million program…"
Top 3 Q4 cryptos experts say could mirror Solana’s success by 2025,2024-11-04 13:28:00,"As the crypto market heats up, all eyes are on XYZVerse, a new memecoin targeting sports fans and aiming for explosive growth with a bold roadmap and strategic partnerships. #partnercontent"
Why Dogizen partnerships signal a 20x future as the bull run heats up,2024-11-04 12:55:00,"Dogizen is poised for explosive growth, with $1.1 million raised in presale and strategic partnerships in the Telegram gaming sector that could propel its value. #pressrelease"
"TON breaks barriers, SOL lags behind; Lunex Network shines with decentralized exchange growth",2024-11-04 10:35:00,"The crypto market is heating up with Lunex Network’s presale gaining momentum, Toncoin’s whale activity surging, and Solana showing resilience, highlighting exciting new opportunities. #partnercontent"
"While TON and APT rise steadily, CYBRO soars ahead with 5,000% growth potential",2024-11-03 15:33:00,"As Toncoin and Aptos rise, new player CYBRO shows 5,000% growth potential, igniting curiosity in the crypto space. #partnercontent"
3 high-potential altcoins that could be millionaire-makers by 2026,2024-11-02 13:12:00,The crypto market buzzes with altcoins that could skyrocket. Discover three hidden gems experts predict will yield big gains by 2026. #partnercontent
"This token is drawing investors from Chainlink, with analysts predicting a 2,500% rise",2024-11-02 12:30:00,"A lesser-known crypto under $0.08 is gaining traction, drawing investors from Chainlink as analysts forecast a 2,500% surge. #partnercontent"
Ethereum whales shift focus to this hidden gem under $0.10,2024-11-02 11:15:00,"Major Ethereum holders are eyeing an under-$0.10 cryptocurrency like Cybro, sparking investor interest. #partnercontent"
"3 rising Ethereum competitors that could turn $1 into $1,500 by 2025’s bull market",2024-11-01 18:50:00,"As the crypto landscape changes, three emerging platforms could outperform Ethereum and turn modest investments into significant gains by 2025. #partnercontent"
SOL surpasses PayPal’s market cap; TON slips while Rollblock soars with new revenue sharing model,2024-11-01 16:30:00,"Solana has surpassed PayPal in market cap, sparking crypto excitement, while Rollblock’s revenue-sharing model presents a promising investment opportunity. #partnercontent"
SOL eyes new ATH after crossing PayPal market cap; TON dips as Lunex skyrockets,2024-10-31 08:44:00,"As Solana approaches its all-time high with an 11.8% surge, Lunex is gaining traction in DeFi, raising over $1.55 million in presale and promising enticing passive income for investors. #partnercontent"
ADA could flip TON before year-end but greater returns expected from RBLK,2024-10-30 10:10:00,"Cardano eyes a comeback over Toncoin as crypto casino Rollblock rockets toward the top 10, projected for 10,000x growth by early 2025. #partnercontent"
"Ethereum-based token Cutoshi takes over TON, SUI as CUTO surges 46% in presale",2024-10-29 08:06:00,"Cutoshi is making headlines with a 46% presale surge, emerging as a strong contender in the meme coin market against established tokens like Toncoin and Sui. #sponsored"
Dogizen primed to ride massive TON predictions for 2024,2024-10-29 07:07:00,"Toncoin is making waves, reaching all-time highs, and the TON-based gaming platform Dogizen is set for explosive growth, with its ICO already raising $1 million. #pressrelease"
"These 4 cryptos might rival Solana, offering growth potential for late investors",2024-10-26 13:28:00,"After Solana’s surge, 4 new cryptocurrencies are emerging with strong growth potential, offering investors similar opportunities. #partnercntent"
5 altcoins with 1000% upside potential: A millionaire-making crypto strategy,2024-10-25 15:11:00,"While Bitcoin and Ethereum steal the spotlight, 5 lesser-known altcoins are primed for substantial growth and potential profits. #partnercontent"
"Three crypto coins to watch in Q4: SUI, Pulsemate AI, and TON",2024-10-25 13:42:00,"As Q4 approaches, analysts spotlight Sui, Pulsemate AI, and Toncoin as potential crypto leaders, with PAI emerging as a promising contender in the AI and DeFi space. #pressrelease"
"Leading cryptos to eye before 2025: TON, LINK, Intel Markets",2024-10-24 06:21:00,"Analysts highlight Toncoin, Chainlink, and Intel Markets as top investments for significant profits before 2025, with Intel Markets gaining momentum in its presale. #partnercontent"
"Why more investors are choosing Zig Network over DOGE, ETC, NEO",2024-10-23 10:46:00,"Zig Network attracts investors from Dogecoin, Ethereum Classic, and NEO with its transparent revenue-sharing model amid market fluctuations. #partnercontent"
Fraudsters have decided not to operate in TON. But is this a good thing?,2024-10-23 02:48:00,"Crypto scammers using malware to steal digital assets refused to attack TON users. However, things are not so clear-cut. Scam Sniffer experts noted that the operators of a drainer popular among scammers rejected the TON network. In a message published…"
"Whales move from KAS, TON to CYBRO: Analysts predict 8800% growth in 90 days",2024-10-22 18:05:00,"Big investors are shifting away from established altcoins like KAS and TON, setting their sights on CYBRO, which analysts predict could surge by an astonishing 8800% in the next 90 days. #partnercontent"
"Expressing concerns about POL, TON, expert suggests Cybro for long-term growth",2024-10-22 08:38:00,"A crypto expert questions the future of tokens like Polygon and Toncoin, instead highlighting Cybro as a key asset for long-term growth. #partnercontent"
