title,date,description
This $0.0015 meme coin could redefine portfolios with a $50 price target,2025-01-03 00:00:00,"DOGEN, a $0.0015 meme coin, could transform investment portfolios with its $50 price target. #partnercontent"
From $0.175 to $24: This SHIB killer could turn $500 into $68k in 2025,2025-01-02 18:28:00,"Rexas Finance (RXS) gains attention for its presale surge and potential 13,500% growth through real-world asset tokenization. Rexas Finance (RXS), a blockchain project exhibiting explosive development during its presale, is a topic of great interest among savvy investors and cryptocurrency…"
Why Dogizen’s edge over the best new meme coins has investors aping in,2025-01-02 16:08:00,"As the crypto market heats up in 2025, Dogizen, the first Telegram-based ICO with a revenue-generating game, is gaining traction as a standout new meme coin #pressrealese"
"Memecoins are redefining digital value, not just a passing trend: DWF Labs",2025-01-02 15:38:00,"A new report from DWF Labs discusses how memecoins have become a major force in the digital asset landscape, highlighting the powerful intersection of social capital and financial innovation. Memecoins were once viewed as humorous offshoots of cryptocurrency. Whether inspired…"
"Solana, SUI hedge investments with high prospect token FXGuys amid bullish trends",2025-01-02 12:55:00,FXGuys (FXG) presale gains momentum as Solana and SUI investors explore its potential for high returns in a volatile market #pressrealese
Crypto legend says meme coins are the shortcut from $200 to $2m,2025-01-02 12:32:00,"A crypto expert claims meme coins like DOGEN could turn $200 into $2 million, making it the top choice for investors. #partnercontent"
Catzilla’s pounce on 2025: Shaping the January effect like never before,2025-01-01 19:38:00,Catzilla set to shape the January effect and claw its way to meme coin supremacy in 2025. #partnercontent
2025 crypto guide: 5 coins to secure high returns,2025-01-01 19:26:00,Analyzing 5 cryptos to secure high returns in 2025. #partnercontent
Build 2025 wealth this holiday season: These leading 6 cryptos are poised to explode,2025-01-01 17:10:00,6 cryptos poised for explosive growth — investing early this holiday season could bring significant gains by 2025. #partnercontnt
"SHIB and PEPE faces new rival as Catzilla token targets a 10,000% surge by next year",2025-01-01 16:53:00,"Catzilla, a new meme token, aims to rival SHIB and PEPE with bold plans for a 10,000% surge by next year, stirring curiosity. #partnercontent"
Lead the charge: Why Solana’s Dogen is the meme coin game-changer for 2024,2025-01-01 16:36:00,"DOGEN, a meme token on Solana, stirs excitement with its potential for explosive gains, fueled by viral success. #partnercontent"
Ethereum holders flock to this presale gem for unmatched gains in 2025,2024-12-31 22:30:00,Ethereum holders move to Catzilla’s presale for its potential gains in 2025. #partnercontent
"Meme coins to buy for huge gains; PEPE, BRETT, SHIB, PENGU and WIF",2024-12-31 19:05:00,"Meme coins like PEPE, SHIB, and PENGU shine, but Remittix steals focus with $1M presale success. #partnercontent"
"Turn $50 into $100,000 with these 3 meme tokens better than DOGE",2024-12-31 15:16:00,"New meme tokens like DOGEN, BONK, and PEPE are gaining traction, offering unique opportunities for growth in the evolving crypto market. #partnercontent"
Altcoin market heats up: These 5 could be must-have coins for the rally,2024-12-31 13:59:00,Altcoin surge ignites market buzz; discover which coins could be key to maximizing this rally’s potential gains. #partnercontent
"Dogecoin, Solana eye fresh highs in q1 2025 but this new altcoin could steal the show",2024-12-31 13:45:00,"Crypto giants Dogecoin and Solana eye Q1 2025 highs, but Rollblock may lead with a breakout rally. #partnercontent"
"This altcoin is expected to explode with 12,000% gains in 2025",2024-12-31 12:09:00,"The new altcoin Catzilla, with a projected 12,000% surge by 2025, offers investors a second chance at transformative crypto gains. #partnercontent"
"Solana’s next big thing: DOGEN set to rocket to $10 outshining BONK, WIF",2024-12-31 08:57:00,"DOGEN rises in the Solana ecosystem, aiming for a $10 milestone by year’s end, outpacing rivals BONK and WIF with its bold vision and explosive potential. #partnercontent"
"3 cryptos traders should check out in 2025, according to experts",2024-12-31 08:10:00,"Cardano and Dogwifhat are on the road to recovery, both these coins and ICO star DTX Exchange are must-haves for any growth portfolio in 2025. #partnercontent"
"Why analysts are backing this crypto to outperform XRP, ADA and SUI in 2025",2024-12-31 05:48:00,"Rollblock emerges at the intersection of DeFi and iGaming, with analysts projecting significant growth during its presale and beyond. #partnercontent"
"Rising star predicted to outperform XRP in 2025, and it’s not SUI",2024-12-31 01:26:00,Rollblock positioned as a rising star set to outperform XRP and SUI in 2025. #partnercontent
"SHIB and ADA Holders shift to this gem ready for 9,600% growth",2024-12-31 01:03:00,"SHIB and ADA holders shift to XYZ, a crypto gem ready for 9,600% growth. #partnercontent"
3 cryptocurrencies to transform average investors into whales,2024-12-31 00:19:00,Analyzing three cryptocurrencies poised to turn average investors into crypto whales. #partnercontent
5 altcoins on the verge of joining the top 10 with massive growth,2024-12-30 23:43:00,Exploring 5 altcoins with the potential to join the top 10 rankings. #partnercontent
"Analysts says SHIB and PEPE’s big gains are over, but Remittix 5,880% rally is just beginning",2024-12-30 16:54:00,"Analysts hint SHIB and PEPE have peaked, spotlighting Remittix as a rising star with a forecasted 5,880% rally potential. #partnercontent"
Chainlink price forms risky pattern but expert predicts a rebound in 2025,2024-12-30 15:46:00,"Chainlink price has suffered a big reversal in the past two weeks, but one top crypto analyst expects its price to surge in 2025. Chainlink (LINK) dropped to $20.25 on Monday, Dec. 30, down by 35% from its highest level…"
When to sell: Cycle top Rollblock and Solana price predictions,2024-12-30 15:40:00,"Crypto experts debate a 2025 cycle peak, with Solana holders urged to sell incrementally. Low-cap gems like RBLK shine for 50-100x gains. #partnercontent"
"DOGE trader who made $2.8m predicts this altcoin will deliver over 10,000% gains in 2025",2024-12-30 15:11:00,"A Dogecoin millionaire shifts focus to a new altcoin, predicting over 10,000% growth by 2025, fueling speculation among crypto enthusiasts. #partnercontent"
Binance announces the launch of Solv Protocol on its Megadrop platform,2024-12-30 13:47:00,"Binance has now introduced Solv Protocol, a Bitcoin staking protocol with aspirations to build a Bitcoin and Bitcoin-native financial ecosystem."
Solana’s meme tokens frenzy: DOGEN leads with $10 target in sight,2024-12-30 13:22:00,"Solana’s meme token market heats up as DOGEN gains traction, drawing attention with its ambitious goals and potential for exponential growth this bull run. #partnercontent"
"Investors aim to make $10,000 with $100 on FXGuys amid bearish pressure on SUI and SHIB",2024-12-29 20:30:00,"Despite bearish pressure on altcoins like SUI and SHIB, FXGuys offers a chance for $10,000 gains with just $100. #partnercontent"
"Solana struggles to break the $250 level, this SOL alternative plans 3,800% price rise",2024-12-29 18:29:00,"Solana’s ATH of $263 faded in December, but Remittix offers frustrated investors a new opportunity. #partnercontent"
TON and XRP investors are pivoting to this $0.0007 crypto with 700% returns,2024-12-29 18:05:00,"A new low-priced cryptocurrency priced at $0.0007 offers 700% returns, drawing investors away from TON and XRP. #partnercontnt"
Spot bullish vs. bearish crypto trends: 5 trending coins for any market,2024-12-29 16:54:00,"Explore five cryptocurrencies with strong potential in any market condition, essential for a balanced investment portfolio. #partnercontent"
"SUI, EIGEN, GMT: Top 3 cryptocurrencies to watch this week",2024-12-29 14:36:00,"Cryptocurrencies remained on edge last week as the volume dried up because of the Christmas holidays. The Santa Claus rally pushed Bitcoin (BTC) close to the $100,000 level and then the momentum faded, pushing it below $95,000. Sui (SUI) will…"
Bearish movement persists on Solana and Ethereum as investors switch to FXGuys for gains,2024-12-29 12:30:00,"FXGuys outshines Solana and Ethereum, offering staking rewards and a promising DeFi investment opportunity. #partnercontent"
"Indicator signals positive momentum for DOGE, SOL, and DOGEN — new rally toward ATH",2024-12-29 10:09:00,"Dogecoin, Solana, and DOGEN show positive momentum, with trends hinting at significant upward movement in the crypto market. #partnercontent"
Analysts predict this under $1 token will surpass WIF and FLOKI in 2025; here’s why,2024-12-28 20:24:00,"Analysts predict a new cryptocurrency under $1 could surpass WIF and FLOKI by 2025, gaining major attention. #partnercontent"
Experts are tipping these 2 altcoins to eclipse Solana for gains in Q1 2025,2024-12-28 20:10:00,"As SOL slows down, analysts recommend Remittix and Hedera for major gains, with RTX predicted to surge 25x in Q1 2025. #partnercontent"
"Expert names 5 cryptos ready for 15,650% returns in 2025",2024-12-28 19:33:00,"Five cryptocurrencies are set for massive growth by 2025, with returns up to 15,650%. #partnercontent"
The next 3 months would be critical — top 5 crypto opportunities to discover now,2024-12-28 19:20:00,The crypto market is entering a pivotal phase — discover the top 5 prospects with potential for significant gains. #partnercontent
"This new low-cap PayFi token could soar 40,000% as analysts call it XRP 2.0",2024-12-28 17:43:00,"Remittix, a low-cap PayFi token, emerges as XRP’s rival, with experts predicting a 40,000% surge by 2025 amid rising demand. #partnercontent"
Meme Index raises $500k in presale for its unique platform,2024-12-27 20:11:00,Meme Index raises $500k in presale for its decentralized meme coin index trading platform. #partnercontent
This new viral altcoin named the “XRP killer” could even surpass Solana,2024-12-27 16:56:00,"Remittix, dubbed the “XRP killer,” is poised to disrupt a $190T market and outshine Solana with 200x growth potential. #partnercontent"
Early 2025 crypto goldmine: Undervalued altcoins to keep an eye on,2024-12-27 11:46:00,"Bitcoin’s surge past $100,000 sparks interest in undervalued altcoins like XYZverse, ADA, XLM, IOTA, and SHIB, each poised for significant growth in 2025. #partnercontent"
BONK price falls over 7% after burning 1.69 trillion tokens-what’s going on?,2024-12-27 09:36:00,"Solana-based meme coin Bonk continued its downward rally despite the project recently burning 1.69 trillion BONK tokens. On Dec. 26, over 1.8% of BONK’s entire supply, amounting to 1.69 trillion tokens worth over $51 million was burned as part of…"
5 high-growth meme coins poised for massive breakouts in 2025,2024-12-27 07:29:00,"The crypto market in 2025 could see a surge in meme coins, blending humor with innovation to captivate communities and investors alike. #partnercontent"
Top crypto pick for those who missed SHIB and PEPE,2024-12-26 22:53:00,Analyzing Rexas Finance as a top pick for those who missed SHIB and PEPE. #partnercontent
Why meme coins are fading this cycle: A tale of Bitcoin and the others,2024-12-26 17:38:00,"Meme coins ranked among the most popular crypto narratives of 2024, creating a divide between crypto tokens. Bitcoin stands out among top crypto tokens with 125% year-to-date gains and the meme coin category, or the “other tokens” hit a key milestone, crossing a market capitalization of $100 billion."
SHIB and PEPE’s dominance is fading: This new crypto is making millionaires fast,2024-12-26 17:02:00,"A rising crypto is challenging popular tokens, making millionaires overnight and reshaping the future of digital investments. #partnercontent"
Here is why crypto whales are flocking to these 4 altcoins,2024-12-26 16:22:00,"Bitcoin’s surge past $100K shifts focus to altcoins as whales pour in, drawn by unique growth factors. #partnercontent"
Crypto expert behind BONK’s 900% rise predicts DOGEN will hit $5 after historic low,2024-12-26 16:05:00,"Crypto expert behind BONK’s surge now predicts DOGEN to rise from $0.0013 to $5, sparking investor excitement. #partnercontent"
"Here’s why meme coins like Floki, SHIB, Fartcoin are crashing",2024-12-26 14:48:00,"Meme coin prices crashed on Thursday, erasing most of the gains made during the Santa Claus rally on Christmas Eve.  Fartcoin (FARTCOIN), one of the top meme coins in the Solana ecosystem, dropped by 16.8%, making it one of the…"
Flockerz presale enters final stage with 28 days remaining,2024-12-26 14:22:00,"Flockerz nears the end of its $7.7m presale, introducing a Vote-to-Earn DAO and staking rewards to engage and reward its community. #partnercontent"
Chainlink price forms a risky pattern despite whales accumulation,2024-12-26 14:11:00,"Chainlink price retreated on Boxing Day even as whales accumulated the biggest oracle project in the crypto industry. Chainlink (LINK) retreated to $22.90, down by 12.45% from its highest level this week and by 26% from the year-to-date high. This…"
"Should web3 devs be building tribes, not just tools? | Opinion",2024-12-26 14:08:00,"Younger consumers give as much importance to fun, identity, and emotional connection as functionalities."
"A Christmas miracle: Dogecoin and PEPE holders eye DOGEN for explosive 30,000x growth",2024-12-26 13:51:00,"DOGEN, the new alpha meme token, is captivating investors with projected 700% presale growth and potential for thousand-fold returns, redefining the meme coin landscape. #partnercontent"
"3 altcoins set to dominate gains in 2025: Cardano, Remittix, Chainlink",2024-12-26 10:47:00,"ADA, LINK, and RTX lead the charge for 2025, with Remittix poised for a potential 20x ROI through its game-changing cross-border payment solutions. #partnercontent"
Crypto whales stockpile these 3 altcoins before the next bull run,2024-12-25 22:40:00,Analyzing three altcoins crypto whales are stockpiling before the next bull run. #partnercontent
5 game-changing altcoins for December/January,2024-12-25 21:35:00,Analyzing five potentially game-changing altcoins for December and January. #partnercontent
"Don’t overlook these bargain cryptos poised for explosive 10,000 growth next year",2024-12-25 16:10:00,These undervalued cryptocurrencies are poised for massive growth in the coming year. #partnercontent
"Solana hits $250, Dogecoin nears $0.5, Lightchain AI soars 30,000% to $5",2024-12-25 05:02:00,"Discover why Solana, Dogecoin, and Lightchain AI are top picks for 2025, with LCAI predicted to rally by 30,000%. #partnercontnt"
"Christmas bull run: Top 5 meme coins for 12,000x gains",2024-12-24 21:37:00,"Analyzing 5 meme coins with the potential for 12,000x gains in the Christmas bull run. #partnercontent"
Explosive 100x gains expected: Cryptos to add to portfolios now,2024-12-24 16:51:00,"XYZVerse leads the pack in 2024’s crypto race, uniting sports and meme culture for explosive growth potential alongside rising stars like SUI, WIF, SHIB, and PNUT. #partnercontent"
NEIRO’s success shadowed; Catzilla’s presale sparks new market buzz,2024-12-24 14:40:00,"Catzilla roars into the spotlight with a 700% ROI presale, aiming to dominate the meme coin market in a post-Trump victory crypto frenzy. #partnercontent"
This cheap Solana alternative is predicted to surge by over 4500% in 2025,2024-12-24 12:43:00,"Discover an alternative to Solana, predicted to surge by over 4,500% in 2025. This project is now in presale, so its price is also low. #partnercontent"
"Move over SHIB and PEPE: A hot $0.0013 token is looking at 18,000% potential returns",2024-12-24 03:40:00,"A new low-cost crypto priced at $0.0013 is drawing attention with potential 18,000% returns, set to rival SHIB and PEPE. #partnercontent"
Undervalued altcoins poised for breakout gains in 2025,2024-12-23 22:23:00,Analyzing undervalued altcoins that could bring significant gains in 2025. #partnercontent
Polygon meme coin to overtake PEPE and SHIB in the bull run,2024-12-23 21:11:00,"XYZ, a new meme coin on Polygon, could overtake PEPE and SHIB in the bull run. #partnercontent"
"TRX, SHIB, or CATZILLA: Analyzing the best bet for gains next quarter",2024-12-23 21:04:00,"TRX, SHIB, and CATZILLA vie for the best gains next quarter. #partnercontent"
"Ex-Wall Street Trader predicts 12,250% gains for new Solana coin set to outpace BRETT, FLOKI",2024-12-23 18:12:00,"Ex-Wall Street trader forecasts 12,250% returns for a new Solana token, set to outshine BRETT and FLOKI in growth. #partnercontent"
"The introduction of Hydra could see Cardano surpass Ethereum with 100,000 TPS",2024-12-22 21:10:00,"Cardano’s Hydra boosts ADA past $1, positioning it as a scalable dApp hub and a potential challenger to Ethereum’s dominance. #partnercontent"
Dogecoin millionaire reveals why XYZVerse at $0.001333 mirrors DOGE’s 2021 rise,2024-12-22 19:47:00,"An early Dogecoin investor eyes XYZVerse, priced at $0.001333, predicting a rise like Dogecoin’s 2021 surge. #partnercontent"
"Pepe coin rival set to repeat 2023’s wild run, turning $100 into $40,000",2024-12-22 19:27:00,"Pepe Coin’s meteoric rise turned $100 into $40,000 in weeks, and a trending rival is set to follow suit. #partnecontent"
Leading coins to watch: Consider buying before prices bounce back stronger,2024-12-22 17:12:00,"The crypto market rebounds, with select coins set for major gains as investor confidence rises. #partnercontent"
Dogecoin & PEPE stall as new $0.04 coin gains attention from small and large investors,2024-12-22 16:53:00,Dogecoin and PEPE struggle as investors turn to a new $0.04 DeFi coin with massive ROI potential by 2025. #partnercontent
Discovering the next crypto to hit $1: Top picks for 2025,2024-12-21 17:28:00,Discover the top low-cap cryptocurrencies with potential to reach $1 in 2025. Explore their features and growth opportunities. #partnercontent
"Asset manager GraniteShares files for RIOT, MARA, MSTR, and HOOD ETFs",2024-12-21 16:50:00,"GraniteShares, a fast-growing asset manager with over $10 billion, has filed for new crypto-linked exchange-traded funds. On Friday, Dec. 20, the New York-based firm filed for new leveraged ETFs to track companies like Riot Platforms, Marathon Digital, MicroStrategy and Robinhood. …"
"While SHIB and ADA prices struggle, this token is making headlines with 500% price gain",2024-12-21 16:30:00,"As SHIB and ADA face challenges, DTX Exchange shines with 500% returns and predictions of 5x growth by 2025. #partnercontent"
"$1,000 in Dogecoin and FX Guys could help someone to become a millionaire in 2025",2024-12-21 07:37:00,"Explore how investing $1,000 in FX Guys and Dogecoin could lead to significant financial growth. #partnercontent"
ETH’s $5K path to trigger altcoin rally: Analyst reveal 5 cryptos to buy,2024-12-20 21:03:00,"Ethereum’s path to $5,000 could ignite an altcoin rally, with analysts highlighting five cryptos primed for massive gains. #partnercontent"
Why crypto market’s dip isn’t the end of the bull market — According to experts,2024-12-20 20:49:00,"Are the recent liquidations and falling prices setting the stage for a longer crypto winter, or could this be the breather before another bull run? Crypto market stumbles as year-end draws near As the year winds down, the crypto market…"
5 affordable cryptos to watch: Huge potential under $1,2024-12-20 19:59:00,"Affordable tokens under $1, like XYZVerse, are attracting investors with explosive growth potential. #partnercontent"
"Bonk and WIF to be outshone by new altcoin 1Fuel, say experts",2024-12-20 14:00:00,"Bonk saw a 14% uptick in its trading volume, while WIF slipped 20%; as 1FUEL gains momentum, experts expect it to outshine established players like Bonk and WIF. #partnercontent"
Choosing DOGE or SHIB might be a missed chance for $0.10 alternative,2024-12-19 22:40:00,"Choosing DOGE or SHIB could mean missing XYZ, a meme coin primed for a 9,900% rally. #partnercontent"
These 4 low-cost cryptos could turn small investments into millions by mid-2025,2024-12-19 20:11:00,Lightchain AI Presale at $0.003 leads 4 undervalued tokens poised to create millionaires by 2025. #partnercontent
Unlock massive 1000x gains: Analysts favor new SOL meme coin over ADA and SUI for 2025,2024-12-19 17:24:00,"Analysts highlight a Solana-powered meme coin with 1000x potential by 2025, drawing comparisons to Cardano and SUI. #partnercontent"
Crypto All-Stars hits $23 million with just 24 hours left of viral presale,2024-12-19 17:01:00,"Crypto All-Stars presale soars past $24M, with 24 hours left, fueled by its unique  MemeVault staking platform. #partnercontent"
"DOGE, SHIB breakout delayed as traders get distracted by PEPE and another $0.003 token",2024-12-19 15:15:00,"Traders shift focus from DOGE and SHIB to emerging tokens like PEPE and Lightchain AI, with LCAI offering unique features and 1,000x growth potential. #partnercontent"
"FXGuys presents a shot at taking $100 to $10,000 while SUI and Avalanche consolidate",2024-12-19 14:54:00,FXGuys presents a new investment opportunity with unique features and a 100x profit potential as top altcoins like SUI and Avalanche consolidate. #partnercontent
Pepe coin price slips as smart money sells: has the rally ended?,2024-12-18 16:31:00,"Pepe coin price dropped for three consecutive days, invalidating a previously bullish pattern and forming another bearish one. Pepe (PEPE), the third-largest meme coin globally, fell to a low of $0.00002117, marking its lowest level since December 6. This decline…"
"CATZILLA set for 5,000% rally after PNUT’s 1,800% surge & PENGU’s 500% boom",2024-12-18 15:24:00,"After PNUT’s 1,800% surge and PENGU’s 500% rise, analysts predict CATZILLA’s 5,000% rally driven by viral hype and rewards. #partnercontent"
"BTC rises to $106k, ADA targets $5 as new viral presale enters stage 2 with $1.2m raised",2024-12-18 12:30:00,"Bitcoin hits $106k, Cardano eyes $5, while Yeti Ouro raises $1.2m, positioning itself as the next breakout altcoin in the P2E market. #partnercontent"
Excitement builds as ADA and DOT investors look to 1Fuel’s Q2 debut,2024-12-18 08:59:00,"Cardano and Polkadot investors eye 1Fuel OFT’s Q2 2025 debut, with its presale gaining momentum as the next big altcoin opportunity. #partnercontent"
"Investors bet on FXG to turn $100 into $10,000 over BNB and AVAX",2024-12-18 08:30:00,"Investors eye FXG for its potential to turn $100 into $10,000 ahead of BNB and AVAX. #pressrelease"
XYZVerse to rival XRP & Cardano in the bull market at $0.1,2024-12-17 22:02:00,XYZVerse (XYZ) poised to rival XRP and Cardano (ADA) at its targeted $0.1 price. #partnercontent
"ETH and ADA may repeat history, XYZ could be the dark horse",2024-12-17 21:43:00,"As ETH and ADA eye breakouts, XYZ emerges as a dark horse with high potential. #partnercontent"
Crypto.news Awards 2024 categories and nominees,2024-12-17 20:55:00,"This year, the Crypto.news organizes an award among the best crypto projects. There will be two winners in each category — Crypto.news choice and Community choice. Winners will be announced on December 23rd. Awards feature projects nominated in the following…"
"Ethereum and Solana may stall, but this $0.001333 gem aims for 7,402% ROI by year-end",2024-12-17 19:51:00,"As Ethereum slows, emerging tokens like XYZVerse, the first all-sport memecoin, promise exponential returns in a bullish market. #partnercontent"
Coins with potential: 4 best crypto presales to consider investing in for 2025,2024-12-17 19:35:00,"Bitcoin hits $107K, fueling altcoin and presale buzz. Discover 4 top crypto presales to watch for big 2025 gains. #partnerontent"
"Yeti Ouro sells out of stage 1 ahead of schedule, early investors enjoy over 40% gains",2024-12-17 12:30:00,"Yeti Ouro storms the crypto scene with a sold-out presale, 40% early returns, and a P2E gaming platform set to spark the market. #partnercontent"
"Crypto expert predicts BTC at $200K in 2025, but there’s another 1,000x gem",2024-12-17 00:54:00,"Michael J. Saylor predicts BTC at $200K in 2025 as  Dawgz AI emerges with 1,000x growth potential. #partnercontent"
AI predicts XRP surpassing ETH this cycle — but the real crypto winner could be XYZ,2024-12-16 19:55:00,"Crypto buzz grows as XYZVerse, a meme coin for sports fans, sees big gains and is hinting at a major market shake-up. #partnercontent"
"DOGEN is gearing up for 25,000% returns, outshining XRP and DOGE gains",2024-12-16 19:40:00,"DOGEN gains momentum as projections suggest 25,000% returns, surpassing XRP and Dogecoin’s performance. #partnercontent"
PEPE and DOGE hold steady while 1FUEL’s privacy features gain attention in DeFi,2024-12-16 16:13:00,"Bull run sparks new highs, but tokens like PEPE and DOGE lag. Analysts see 1Fuel, in presale, primed for 500% growth. #partnercontent"
"Bitcoin to $150K, ETH to $5K by summer – veteran trader reveals 5 altcoins riding the trend",2024-12-16 16:07:00,"A veteran trader predicts Bitcoin at $150K and Ethereum at $5K by summer, spotlighting 5 altcoins primed for big gains. #partnercontent"
FARTCOIN flips GOAT in meme coin wars as Bitcoin hits new ATH,2024-12-16 13:18:00,"Fartcoin is up 22% in 24-hour trading and a whopping 164% on the week, leading to surge in interest among retail traders as Bitcoin hits a new ATH. According to data from Coingecko, Fartcoin (FARTCOIN) is currently trading at $0.78…"
